[
  {
    "section_title": "\ud83c\udfa4 [00:00:00] Introduction to AI-900",
    "chunk_id": 1,
    "timestamp_range": "00:00:28 \u2013 00:03:45",
    "key_concepts": [
      "AI-900 (Azure AI Fundamentals) certification is designed for those seeking roles like AI engineer or data scientist.",
      "Certification demonstrates understanding of Azure AI services including Cognitive Services, Azure Applied AI Services, AI concepts, knowledge mining, responsible AI, classical ML models, AutoML, generative AI workloads, and Azure AI Studio.",
      "AI-900 is considered an entry-level, foundational certification suitable for beginners in cloud and ML technologies.",
      "Recommended to have foundational Azure knowledge (e.g., AZ-900) before AI-900, but not mandatory.",
      "AI-900 paths diverge into AI engineer (focus on AI services usage) and data scientist (focus on ML pipelines and Azure ML).",
      "Data scientist path is more challenging than AI engineer path.",
      "Suggested learning order: AZ-900 \u2192 AI-900 \u2192 Data Scientist or AI Engineer certifications.",
      "Having AZ-900 and Administrator Associate certifications can help with confidence for more advanced certifications."
    ],
    "definitions": {
      "AI-900": "Azure AI Fundamentals certification exam code.",
      "AI Engineer": "Role focused on using Azure AI services effectively.",
      "Data Scientist": "Role focused on building and managing ML pipelines and models."
    },
    "key_facts": [
      "AI-900 is an easy-to-pass foundational exam.",
      "AI-900 certification does not expire as long as technology remains relevant.",
      "AI-900 exam duration: 60 minutes (90 minutes recommended including instructions).",
      "Passing score: 700 out of 1000 (approx. 70%).",
      "Number of questions: 37 to 47.",
      "Question types: multiple choice, multiple answer, drag and drop, hot area.",
      "No penalty for wrong answers.",
      "Exam can be taken online or in-person at test centers (e.g., CERA, Pearson VUE).",
      "Proctor monitors exam (in-person or online)."
    ],
    "examples": [
      "Using AI-900 certification to enhance resume and LinkedIn profile for job opportunities.",
      "Pairing AI-900 with DP-900 (Azure Data Fundamentals) for broader knowledge."
    ],
    "exam_tips": [],
    "raw_markdown": "### \ud83c\udfa4 [00:00:00] Introduction to AI-900  \n**Timestamp**: 00:00:28 \u2013 00:03:45  \n\n**Key Concepts**  \n- AI-900 (Azure AI Fundamentals) certification is designed for those seeking roles like AI engineer or data scientist.  \n- Certification demonstrates understanding of Azure AI services including Cognitive Services, Azure Applied AI Services, AI concepts, knowledge mining, responsible AI, classical ML models, AutoML, generative AI workloads, and Azure AI Studio.  \n- AI-900 is considered an entry-level, foundational certification suitable for beginners in cloud and ML technologies.  \n- Recommended to have foundational Azure knowledge (e.g., AZ-900) before AI-900, but not mandatory.  \n- AI-900 paths diverge into AI engineer (focus on AI services usage) and data scientist (focus on ML pipelines and Azure ML).  \n- Data scientist path is more challenging than AI engineer path.  \n- Suggested learning order: AZ-900 \u2192 AI-900 \u2192 Data Scientist or AI Engineer certifications.  \n- Having AZ-900 and Administrator Associate certifications can help with confidence for more advanced certifications.  \n\n**Definitions**  \n- **AI-900**: Azure AI Fundamentals certification exam code.  \n- **AI Engineer**: Role focused on using Azure AI services effectively.  \n- **Data Scientist**: Role focused on building and managing ML pipelines and models.  \n\n**Key Facts**  \n- AI-900 is an easy-to-pass foundational exam.  \n- AI-900 certification does not expire as long as technology remains relevant.  \n- AI-900 exam duration: 60 minutes (90 minutes recommended including instructions).  \n- Passing score: 700 out of 1000 (approx. 70%).  \n- Number of questions: 37 to 47.  \n- Question types: multiple choice, multiple answer, drag and drop, hot area.  \n- No penalty for wrong answers.  \n- Exam can be taken online or in-person at test centers (e.g., CERA, Pearson VUE).  \n- Proctor monitors exam (in-person or online).  \n\n**Examples**  \n- Using AI-900 certification to enhance resume and LinkedIn profile for job opportunities.  \n- Pairing AI-900 with DP-900 (Azure Data Fundamentals) for broader knowledge.  \n\n**Exam Tips \ud83c\udfaf**  \n- Study time recommendations:  \n  - Beginners: 20-30 hours  \n  - Intermediate: 8-10 hours  \n  - Experienced cloud users: ~5 hours or less  \n- Split study time evenly between lectures/labs and practice exams.  \n- Practice exams are strongly recommended for Azure certifications like AI-900.  \n- Hands-on labs reinforce learning but watching videos alone may suffice for foundational level.  \n- Be cautious with Azure resources during labs to avoid unexpected costs; delete instances after use.  \n- Understand exam format and question types to manage time effectively (about 1 minute per question).  \n- Use official Microsoft exam guide and keep updated on minor changes.  \n\n---\n\n"
  },
  {
    "section_title": "\ud83c\udfa4 [00:08:18] Exam Guide Breakdown",
    "chunk_id": 1,
    "timestamp_range": "00:03:45 \u2013 00:17:06",
    "key_concepts": [
      "AI-900 exam domains and their weightings:"
    ],
    "definitions": {
      "Responsible AI": "Microsoft\u2019s framework of six principles guiding ethical AI development and deployment.",
      "AutoML": "Automated machine learning that simplifies model building and selection.",
      "Computer Vision": "AI workloads that analyze images and videos to extract information.",
      "Natural Language Processing (NLP)": "AI workloads that process and understand human language.",
      "Generative AI": "AI models that generate new content such as text, code, or images."
    },
    "key_facts": [
      "Exam questions are mostly conceptual and descriptive rather than hands-on or coding-based.",
      "Azure AI services have evolved and consolidated for easier integration.",
      "Responsible AI principles are emphasized across Azure AI services."
    ],
    "examples": [
      "Content moderation as an AI workload to filter harmful content.",
      "Personalization workloads analyzing user behavior for tailored experiences.",
      "Using Azure AI Vision, Face Detection, and Video Indexer for computer vision tasks.",
      "Text Analytics, LUIS, and Translator services for NLP tasks.",
      "Azure OpenAI Service for generative AI capabilities."
    ],
    "exam_tips": [],
    "raw_markdown": "### \ud83c\udfa4 [00:08:18] Exam Guide Breakdown  \n**Timestamp**: 00:03:45 \u2013 00:17:06  \n\n**Key Concepts**  \n- AI-900 exam domains and their weightings:  \n  - Describe AI workloads and considerations: 15-20%  \n  - Describe fundamental principles of machine learning on Azure: 20-25%  \n  - Describe features of computer vision workloads on Azure: 15-20%  \n  - Describe features of natural language processing workloads on Azure: 15-20%  \n  - Describe features of generative AI workloads on Azure: 15-20%  \n- The exam focuses on describing concepts rather than deep technical implementation.  \n- Microsoft\u2019s six Responsible AI principles are important to know.  \n- Machine learning fundamentals include regression, classification, clustering, and deep learning.  \n- Core ML concepts: features, labels, training and validation datasets, AutoML capabilities, and Azure ML compute and data services.  \n- Computer vision workloads include image classification, object detection, OCR, facial detection, and facial analysis.  \n- NLP workloads include key phrase extraction, entity recognition, sentiment analysis, language modeling, speech recognition and synthesis, and translation.  \n- Azure AI services have been consolidated under umbrella services (e.g., Azure AI Language, Speech, Translator).  \n- Generative AI workloads cover natural language generation, code generation, image generation, and responsible AI considerations.  \n\n**Definitions**  \n- **Responsible AI**: Microsoft\u2019s framework of six principles guiding ethical AI development and deployment.  \n- **AutoML**: Automated machine learning that simplifies model building and selection.  \n- **Computer Vision**: AI workloads that analyze images and videos to extract information.  \n- **Natural Language Processing (NLP)**: AI workloads that process and understand human language.  \n- **Generative AI**: AI models that generate new content such as text, code, or images.  \n\n**Key Facts**  \n- Exam questions are mostly conceptual and descriptive rather than hands-on or coding-based.  \n- Azure AI services have evolved and consolidated for easier integration.  \n- Responsible AI principles are emphasized across Azure AI services.  \n\n**Examples**  \n- Content moderation as an AI workload to filter harmful content.  \n- Personalization workloads analyzing user behavior for tailored experiences.  \n- Using Azure AI Vision, Face Detection, and Video Indexer for computer vision tasks.  \n- Text Analytics, LUIS, and Translator services for NLP tasks.  \n- Azure OpenAI Service for generative AI capabilities.  \n\n**Exam Tips \ud83c\udfaf**  \n- Focus on understanding what each AI workload does rather than how to implement it in detail.  \n- Memorize Microsoft\u2019s six Responsible AI principles.  \n- Be familiar with the capabilities and use cases of Azure AI services under each domain.  \n- Know the differences between AI workloads: computer vision, NLP, generative AI.  \n- Review the official Microsoft exam outline regularly for updates.  \n\n---\n\n"
  },
  {
    "section_title": "\ud83c\udfa4 [00:12:51] Layers of Machine Learning",
    "chunk_id": 1,
    "timestamp_range": "00:13:03 \u2013 00:13:57",
    "key_concepts": [
      "AI is the broad concept of machines mimicking human behavior.",
      "Machine Learning (ML) is a subset of AI where machines improve at tasks without explicit programming.",
      "Deep Learning is a subset of ML using artificial neural networks inspired by the human brain to solve complex problems.",
      "Data scientists are professionals who build ML and deep learning models using multidisciplinary skills (math, statistics, predictive modeling).",
      "AI is the outcome; ML and deep learning are methods to achieve AI."
    ],
    "definitions": {
      "Artificial Intelligence (AI)": "Machines performing tasks that mimic human behavior.",
      "Machine Learning (ML)": "Machines improving at tasks through experience without explicit programming.",
      "Deep Learning": "ML using neural networks to solve complex problems.",
      "Data Scientist": "A professional skilled in building ML and deep learning models."
    },
    "key_facts": [
      "AI can be implemented using ML, deep learning, or even simple rule-based systems (e.g., if-else statements).",
      "Deep learning models are inspired by the structure and function of the human brain."
    ],
    "examples": [
      "None specifically mentioned in this chunk."
    ],
    "exam_tips": [],
    "raw_markdown": "### \ud83c\udfa4 [00:12:51] Layers of Machine Learning  \n**Timestamp**: 00:13:03 \u2013 00:13:57  \n\n**Key Concepts**  \n- AI is the broad concept of machines mimicking human behavior.  \n- Machine Learning (ML) is a subset of AI where machines improve at tasks without explicit programming.  \n- Deep Learning is a subset of ML using artificial neural networks inspired by the human brain to solve complex problems.  \n- Data scientists are professionals who build ML and deep learning models using multidisciplinary skills (math, statistics, predictive modeling).  \n- AI is the outcome; ML and deep learning are methods to achieve AI.  \n\n**Definitions**  \n- **Artificial Intelligence (AI)**: Machines performing tasks that mimic human behavior.  \n- **Machine Learning (ML)**: Machines improving at tasks through experience without explicit programming.  \n- **Deep Learning**: ML using neural networks to solve complex problems.  \n- **Data Scientist**: A professional skilled in building ML and deep learning models.  \n\n**Key Facts**  \n- AI can be implemented using ML, deep learning, or even simple rule-based systems (e.g., if-else statements).  \n- Deep learning models are inspired by the structure and function of the human brain.  \n\n**Examples**  \n- None specifically mentioned in this chunk.  \n\n**Exam Tips \ud83c\udfaf**  \n- Understand the hierarchical relationship: AI > ML > Deep Learning.  \n- Know the role of a data scientist in the AI/ML ecosystem.  \n- Be able to distinguish AI from ML and deep learning in exam questions.  \n\n---\n\n"
  },
  {
    "section_title": "\ud83c\udfa4 [00:13:59] Key Elements of AI",
    "chunk_id": 1,
    "timestamp_range": "00:13:57 \u2013 00:15:04",
    "key_concepts": [
      "AI imitates human behaviors and capabilities.",
      "Microsoft/Azure defines key AI elements as:"
    ],
    "definitions": {
      "Machine Learning": "AI foundation enabling learning and prediction.",
      "Anomaly Detection": "Identifying data points that deviate from normal patterns.",
      "Computer Vision": "Ability to interpret visual data like humans.",
      "Natural Language Processing (NLP)": "Processing and understanding human language.",
      "Conversational AI": "AI systems capable of human-like conversations."
    },
    "key_facts": [
      "Exam questions may specifically reference Microsoft/Azure\u2019s definitions."
    ],
    "examples": [
      "None explicitly given in this chunk."
    ],
    "exam_tips": [],
    "raw_markdown": "### \ud83c\udfa4 [00:13:59] Key Elements of AI  \n**Timestamp**: 00:13:57 \u2013 00:15:04  \n\n**Key Concepts**  \n- AI imitates human behaviors and capabilities.  \n- Microsoft/Azure defines key AI elements as:  \n  - Machine Learning: foundation for AI systems that learn and predict.  \n  - Anomaly Detection: detecting outliers or unusual patterns.  \n  - Computer Vision: enabling machines to see and interpret images/videos.  \n  - Natural Language Processing (NLP): processing human language in context.  \n  - Conversational AI: enabling machines to hold conversations with humans.  \n- These definitions align with Microsoft\u2019s perspective and are important for the exam.  \n\n**Definitions**  \n- **Machine Learning**: AI foundation enabling learning and prediction.  \n- **Anomaly Detection**: Identifying data points that deviate from normal patterns.  \n- **Computer Vision**: Ability to interpret visual data like humans.  \n- **Natural Language Processing (NLP)**: Processing and understanding human language.  \n- **Conversational AI**: AI systems capable of human-like conversations.  \n\n**Key Facts**  \n- Exam questions may specifically reference Microsoft/Azure\u2019s definitions.  \n\n**Examples**  \n- None explicitly given in this chunk.  \n\n**Exam Tips \ud83c\udfaf**  \n- Memorize Microsoft\u2019s key AI elements as they may appear in exam questions.  \n- Be prepared to identify AI capabilities based on these elements.  \n\n---\n\n"
  },
  {
    "section_title": "\ud83c\udfa4 [00:14:57] DataSets",
    "chunk_id": 1,
    "timestamp_range": "00:15:04 \u2013 00:16:34",
    "key_concepts": [
      "A dataset is a logical grouping of related data units sharing the same structure.",
      "Public datasets are commonly used for learning statistics, data analytics, and ML.",
      "MNIST dataset: images of handwritten digits used for classification and image processing tasks.",
      "COCO dataset: contains images with labeled objects and segments, used for object detection and segmentation tasks.",
      "Azure Machine Learning Studio supports data labeling and can export data in COCO format.",
      "Azure ML pipelines can use open datasets like MNIST and COCO for training and testing models."
    ],
    "definitions": {
      "Dataset": "A collection of related data units with a shared structure.",
      "MNIST": "Dataset of handwritten digits for image classification.",
      "COCO (Common Objects in Context)": "Dataset with images and JSON annotations for object detection and segmentation."
    },
    "key_facts": [
      "COCO dataset supports complex annotations like object segmentation and superpixel segmentation.",
      "Azure ML Studio\u2019s data labeling service can export labels in COCO format."
    ],
    "examples": [
      "MNIST used for handwriting recognition models.",
      "COCO used for object detection and segmentation in images."
    ],
    "exam_tips": [],
    "raw_markdown": "### \ud83c\udfa4 [00:14:57] DataSets  \n**Timestamp**: 00:15:04 \u2013 00:16:34  \n\n**Key Concepts**  \n- A dataset is a logical grouping of related data units sharing the same structure.  \n- Public datasets are commonly used for learning statistics, data analytics, and ML.  \n- MNIST dataset: images of handwritten digits used for classification and image processing tasks.  \n- COCO dataset: contains images with labeled objects and segments, used for object detection and segmentation tasks.  \n- Azure Machine Learning Studio supports data labeling and can export data in COCO format.  \n- Azure ML pipelines can use open datasets like MNIST and COCO for training and testing models.  \n\n**Definitions**  \n- **Dataset**: A collection of related data units with a shared structure.  \n- **MNIST**: Dataset of handwritten digits for image classification.  \n- **COCO (Common Objects in Context)**: Dataset with images and JSON annotations for object detection and segmentation.  \n\n**Key Facts**  \n- COCO dataset supports complex annotations like object segmentation and superpixel segmentation.  \n- Azure ML Studio\u2019s data labeling service can export labels in COCO format.  \n\n**Examples**  \n- MNIST used for handwriting recognition models.  \n- COCO used for object detection and segmentation in images.  \n\n**Exam Tips \ud83c\udfaf**  \n- Know common datasets like MNIST and COCO and their typical use cases.  \n- Understand the role of datasets in training and evaluating ML models.  \n- Be aware that Azure ML supports these datasets and labeling formats.  \n\n---\n\n"
  },
  {
    "section_title": "\ud83c\udfa4 [00:16:37] Labeling",
    "chunk_id": 1,
    "timestamp_range": "00:16:34 \u2013 00:17:06",
    "key_concepts": [
      "Data labeling is the process of identifying raw data (images, text, videos) and adding meaningful labels for ML context.",
      "In supervised ML, labeling is essential to create training data, usually done by humans.",
      "Azure\u2019s data labeling service can assist labeling with ML-assisted labeling to reduce manual effort.",
      "In unsupervised ML, labels are generated by the machine and may not be human-readable.",
      "**Ground Truth**: A properly labeled dataset used as the objective standard for training and evaluating models.",
      "Model accuracy depends on the quality of the ground truth data."
    ],
    "definitions": {
      "Ground Truth": "The accurate, human-verified labeled data used for training and evaluation.",
      "Data Labeling": "Adding informative labels to raw data to provide context for ML.",
      "Supervised Machine Learning": "ML that requires labeled training data.",
      "Unsupervised Machine Learning": "ML that finds patterns without labeled data."
    },
    "key_facts": [
      "Azure\u2019s data labeling service supports ML-assisted labeling to improve efficiency.",
      "The quality of ground truth directly impacts model performance."
    ],
    "examples": [
      "Labeling images with objects or categories for supervised learning."
    ],
    "exam_tips": [],
    "raw_markdown": "### \ud83c\udfa4 [00:16:37] Labeling  \n**Timestamp**: 00:16:34 \u2013 00:17:06  \n\n**Key Concepts**  \n- Data labeling is the process of identifying raw data (images, text, videos) and adding meaningful labels for ML context.  \n- In supervised ML, labeling is essential to create training data, usually done by humans.  \n- Azure\u2019s data labeling service can assist labeling with ML-assisted labeling to reduce manual effort.  \n- In unsupervised ML, labels are generated by the machine and may not be human-readable.  \n- **Ground Truth**: A properly labeled dataset used as the objective standard for training and evaluating models.  \n- Model accuracy depends on the quality of the ground truth data.  \n\n**Definitions**  \n- **Data Labeling**: Adding informative labels to raw data to provide context for ML.  \n- **Supervised Machine Learning**: ML that requires labeled training data.  \n- **Unsupervised Machine Learning**: ML that finds patterns without labeled data.  \n- **Ground Truth**: The accurate, human-verified labeled data used for training and evaluation.  \n\n**Key Facts**  \n- Azure\u2019s data labeling service supports ML-assisted labeling to improve efficiency.  \n- The quality of ground truth directly impacts model performance.  \n\n**Examples**  \n- Labeling images with objects or categories for supervised learning.  \n\n**Exam Tips \ud83c\udfaf**  \n- Understand the difference between supervised and unsupervised labeling.  \n- Know the importance of ground truth in ML model training and evaluation.  \n- Be familiar with Azure\u2019s data labeling capabilities and ML-assisted labeling."
  },
  {
    "section_title": "\ud83c\udfa4 [00:17:43] Supervised and Unsupervised Reinforcement",
    "chunk_id": 2,
    "timestamp_range": "00:17:35 \u2013 00:18:57",
    "key_concepts": [
      "**Supervised Learning**: Uses labeled data for training; task-driven aiming for precise outcomes such as classification and regression.",
      "**Unsupervised Learning**: Uses unlabeled data; data-driven aiming to recognize patterns or structures without precise outcomes. Includes clustering, dimensionality reduction, and association.",
      "**Reinforcement Learning**: No labeled data; model interacts with an environment, generates data, and learns by trial and error to reach goals. Decision-driven, used in game AI and robot navigation.",
      "Classical machine learning mainly refers to supervised and unsupervised learning relying on statistics and math."
    ],
    "definitions": {
      "Supervised Learning": "Learning from labeled data to predict specific values or categories.",
      "Unsupervised Learning": "Learning from unlabeled data to find patterns or groupings.",
      "Reinforcement Learning": "Learning by interacting with an environment and receiving feedback to improve decisions."
    },
    "key_facts": [
      "Supervised learning requires known labels; unsupervised does not.",
      "Reinforcement learning involves an environment and iterative attempts to improve.",
      "Supervised and unsupervised learning are considered classical machine learning."
    ],
    "examples": [
      "Supervised: Classification (e.g., spam detection), regression (e.g., price prediction).",
      "Unsupervised: Clustering customers by behavior, dimensionality reduction to simplify data.",
      "Reinforcement: Video game AI that learns to play itself, robot navigation."
    ],
    "exam_tips": [],
    "raw_markdown": "### \ud83c\udfa4 [00:17:43] Supervised and Unsupervised Reinforcement  \n**Timestamp**: 00:17:35 \u2013 00:18:57\n\n**Key Concepts**  \n- **Supervised Learning**: Uses labeled data for training; task-driven aiming for precise outcomes such as classification and regression.  \n- **Unsupervised Learning**: Uses unlabeled data; data-driven aiming to recognize patterns or structures without precise outcomes. Includes clustering, dimensionality reduction, and association.  \n- **Reinforcement Learning**: No labeled data; model interacts with an environment, generates data, and learns by trial and error to reach goals. Decision-driven, used in game AI and robot navigation.  \n- Classical machine learning mainly refers to supervised and unsupervised learning relying on statistics and math.\n\n**Definitions**  \n- **Supervised Learning**: Learning from labeled data to predict specific values or categories.  \n- **Unsupervised Learning**: Learning from unlabeled data to find patterns or groupings.  \n- **Reinforcement Learning**: Learning by interacting with an environment and receiving feedback to improve decisions.\n\n**Key Facts**  \n- Supervised learning requires known labels; unsupervised does not.  \n- Reinforcement learning involves an environment and iterative attempts to improve.  \n- Supervised and unsupervised learning are considered classical machine learning.\n\n**Examples**  \n- Supervised: Classification (e.g., spam detection), regression (e.g., price prediction).  \n- Unsupervised: Clustering customers by behavior, dimensionality reduction to simplify data.  \n- Reinforcement: Video game AI that learns to play itself, robot navigation.\n\n**Exam Tips \ud83c\udfaf**  \n- Understand the differences in data labeling and goals between supervised, unsupervised, and reinforcement learning.  \n- Know typical use cases for each learning type.  \n- Remember supervised learning is task-driven, unsupervised is data-driven, reinforcement is decision-driven.\n\n---\n\n"
  },
  {
    "section_title": "\ud83c\udfa4 [00:19:09] Netural Networks and Deep Learning",
    "chunk_id": 2,
    "timestamp_range": "00:18:57 \u2013 00:21:25",
    "key_concepts": [
      "Neural networks mimic the brain with interconnected neurons (nodes) organized in layers: input, hidden (one or more), and output.",
      "Connections between neurons are weighted, influencing data flow.",
      "Deep learning refers to neural networks with three or more hidden layers, making internal processes less interpretable.",
      "Forward feed neural networks (FNN) have connections moving only forward, no cycles.",
      "Backpropagation is the process of moving backward through the network to adjust weights based on error (loss function).",
      "Activation functions apply algorithms to nodes in hidden layers to influence outputs and learning.",
      "Dimensionality reduction in neural nets occurs when moving from dense (more nodes) to sparse (fewer nodes) layers."
    ],
    "definitions": {
      "Neural Network": "A set of algorithms modeled after the human brain to recognize patterns.",
      "Deep Learning": "Neural networks with multiple hidden layers enabling complex pattern recognition.",
      "Forward Feed Neural Network (FNN)": "Network where data flows in one direction, from input to output.",
      "Backpropagation": "Algorithm to update weights by propagating error backward through the network.",
      "Activation Function": "Function applied to neurons to introduce non-linearity and influence learning.",
      "Dimensionality Reduction": "Reducing the number of nodes (dimensions) in a layer to simplify data representation."
    },
    "key_facts": [
      "Weighted connections are crucial for learning.",
      "Loss function compares ground truth to prediction to calculate error.",
      "Activation functions affect how the network learns during backpropagation.",
      "Moving from dense to sparse layers reduces dimensions."
    ],
    "examples": [
      "Simple neural network diagram with input, hidden, and output layers.",
      "Deep learning networks with multiple hidden layers are not human-readable."
    ],
    "exam_tips": [],
    "raw_markdown": "### \ud83c\udfa4 [00:19:09] Netural Networks and Deep Learning  \n**Timestamp**: 00:18:57 \u2013 00:21:25\n\n**Key Concepts**  \n- Neural networks mimic the brain with interconnected neurons (nodes) organized in layers: input, hidden (one or more), and output.  \n- Connections between neurons are weighted, influencing data flow.  \n- Deep learning refers to neural networks with three or more hidden layers, making internal processes less interpretable.  \n- Forward feed neural networks (FNN) have connections moving only forward, no cycles.  \n- Backpropagation is the process of moving backward through the network to adjust weights based on error (loss function).  \n- Activation functions apply algorithms to nodes in hidden layers to influence outputs and learning.  \n- Dimensionality reduction in neural nets occurs when moving from dense (more nodes) to sparse (fewer nodes) layers.\n\n**Definitions**  \n- **Neural Network**: A set of algorithms modeled after the human brain to recognize patterns.  \n- **Deep Learning**: Neural networks with multiple hidden layers enabling complex pattern recognition.  \n- **Forward Feed Neural Network (FNN)**: Network where data flows in one direction, from input to output.  \n- **Backpropagation**: Algorithm to update weights by propagating error backward through the network.  \n- **Activation Function**: Function applied to neurons to introduce non-linearity and influence learning.  \n- **Dimensionality Reduction**: Reducing the number of nodes (dimensions) in a layer to simplify data representation.\n\n**Key Facts**  \n- Weighted connections are crucial for learning.  \n- Loss function compares ground truth to prediction to calculate error.  \n- Activation functions affect how the network learns during backpropagation.  \n- Moving from dense to sparse layers reduces dimensions.\n\n**Examples**  \n- Simple neural network diagram with input, hidden, and output layers.  \n- Deep learning networks with multiple hidden layers are not human-readable.\n\n**Exam Tips \ud83c\udfaf**  \n- Know the structure and terminology of neural networks (neurons, layers, weights).  \n- Understand the role of forward feed and backpropagation in training.  \n- Be familiar with activation functions and dimensionality reduction concepts.\n\n---\n\n"
  },
  {
    "section_title": "\ud83c\udfa4 [00:21:25] GPU",
    "chunk_id": 2,
    "timestamp_range": "00:21:10 \u2013 00:21:39",
    "key_concepts": [
      "GPU (Graphics Processing Unit) is designed for fast parallel processing, originally for rendering images and videos.",
      "GPUs excel at performing parallel operations on multiple data sets simultaneously.",
      "GPUs are widely used for non-graphical tasks like machine learning and scientific computation."
    ],
    "definitions": {
      "GPU": "Specialized processor with thousands of cores optimized for parallel tasks."
    },
    "key_facts": [
      "CPUs typically have 4 to 16 cores; GPUs can have thousands (e.g., 40 GPUs could have ~40,000 cores).",
      "GPUs are ideal for repetitive, parallel computing tasks such as deep learning."
    ],
    "examples": [
      "Nvidia GPUs used in gaming and professional markets.",
      "Parallel processing of neural network nodes."
    ],
    "exam_tips": [],
    "raw_markdown": "### \ud83c\udfa4 [00:21:25] GPU  \n**Timestamp**: 00:21:10 \u2013 00:21:39\n\n**Key Concepts**  \n- GPU (Graphics Processing Unit) is designed for fast parallel processing, originally for rendering images and videos.  \n- GPUs excel at performing parallel operations on multiple data sets simultaneously.  \n- GPUs are widely used for non-graphical tasks like machine learning and scientific computation.\n\n**Definitions**  \n- **GPU**: Specialized processor with thousands of cores optimized for parallel tasks.\n\n**Key Facts**  \n- CPUs typically have 4 to 16 cores; GPUs can have thousands (e.g., 40 GPUs could have ~40,000 cores).  \n- GPUs are ideal for repetitive, parallel computing tasks such as deep learning.\n\n**Examples**  \n- Nvidia GPUs used in gaming and professional markets.  \n- Parallel processing of neural network nodes.\n\n**Exam Tips \ud83c\udfaf**  \n- Understand why GPUs are preferred over CPUs for deep learning tasks.  \n- Remember the scale difference in cores between CPUs and GPUs.\n\n---\n\n"
  },
  {
    "section_title": "\ud83c\udfa4 [00:22:21] CUDA",
    "chunk_id": 2,
    "timestamp_range": "00:21:39 \u2013 00:23:29",
    "key_concepts": [
      "Nvidia manufactures GPUs for gaming and professional use.",
      "CUDA (Compute Unified Device Architecture) is Nvidia\u2019s parallel computing platform and API.",
      "CUDA enables developers to use GPUs for general-purpose computing (GPGPU).",
      "Major deep learning frameworks integrate with Nvidia\u2019s deep learning SDK, which includes CUDA libraries.",
      "CUDA Deep Neural Network library (cuDNN) provides optimized implementations for convolution, pooling, normalization, and activation layers."
    ],
    "definitions": {
      "CUDA": "Nvidia\u2019s platform/API for parallel computing on GPUs.",
      "cuDNN": "CUDA Deep Neural Network library for optimized deep learning operations."
    },
    "key_facts": [
      "CUDA is essential for accelerating deep learning tasks on Nvidia GPUs.",
      "Azure AI-900 exam may not cover CUDA in detail but understanding its role helps grasp GPU importance."
    ],
    "examples": [
      "Use of CUDA for convolutional neural networks in computer vision."
    ],
    "exam_tips": [],
    "raw_markdown": "### \ud83c\udfa4 [00:22:21] CUDA  \n**Timestamp**: 00:21:39 \u2013 00:23:29\n\n**Key Concepts**  \n- Nvidia manufactures GPUs for gaming and professional use.  \n- CUDA (Compute Unified Device Architecture) is Nvidia\u2019s parallel computing platform and API.  \n- CUDA enables developers to use GPUs for general-purpose computing (GPGPU).  \n- Major deep learning frameworks integrate with Nvidia\u2019s deep learning SDK, which includes CUDA libraries.  \n- CUDA Deep Neural Network library (cuDNN) provides optimized implementations for convolution, pooling, normalization, and activation layers.\n\n**Definitions**  \n- **CUDA**: Nvidia\u2019s platform/API for parallel computing on GPUs.  \n- **cuDNN**: CUDA Deep Neural Network library for optimized deep learning operations.\n\n**Key Facts**  \n- CUDA is essential for accelerating deep learning tasks on Nvidia GPUs.  \n- Azure AI-900 exam may not cover CUDA in detail but understanding its role helps grasp GPU importance.\n\n**Examples**  \n- Use of CUDA for convolutional neural networks in computer vision.\n\n**Exam Tips \ud83c\udfaf**  \n- Know that CUDA enables GPU acceleration for deep learning.  \n- Understand the relationship between Nvidia, CUDA, and deep learning frameworks.\n\n---\n\n"
  },
  {
    "section_title": "\ud83c\udfa4 [00:23:29] Simple ML Pipeline",
    "chunk_id": 2,
    "timestamp_range": "00:23:29 \u2013 00:25:39",
    "key_concepts": [
      "ML pipeline stages: data labeling, feature engineering, training, hyperparameter tuning, serving (deployment), and inference.",
      "Data labeling and feature engineering are preprocessing steps preparing data for training.",
      "ML models require numerical data; feature engineering extracts relevant features.",
      "Training involves multiple iterations to improve model accuracy.",
      "Hyperparameter tuning optimizes model parameters, especially important in deep learning where manual tuning is impractical.",
      "Serving (deployment) makes the model accessible, often via Azure Kubernetes Service or Azure Container Instances.",
      "Inference is the process of making predictions using the trained model, either real-time or batch."
    ],
    "definitions": {
      "Data Labeling": "Assigning labels to data for supervised learning.",
      "Feature Engineering": "Transforming raw data into numerical features usable by ML models.",
      "Hyperparameter Tuning": "Adjusting model parameters to optimize performance.",
      "Serving": "Hosting the model for access by applications.",
      "Inference": "Using the model to predict outcomes on new data."
    },
    "key_facts": [
      "Preprocessing includes labeling and feature engineering.",
      "Deployment can be on Azure Kubernetes Service or Container Instances.",
      "Inference can be real-time (single prediction) or batch (multiple predictions)."
    ],
    "examples": [
      "Using CSV payloads for inference requests."
    ],
    "exam_tips": [],
    "raw_markdown": "### \ud83c\udfa4 [00:23:29] Simple ML Pipeline  \n**Timestamp**: 00:23:29 \u2013 00:25:39\n\n**Key Concepts**  \n- ML pipeline stages: data labeling, feature engineering, training, hyperparameter tuning, serving (deployment), and inference.  \n- Data labeling and feature engineering are preprocessing steps preparing data for training.  \n- ML models require numerical data; feature engineering extracts relevant features.  \n- Training involves multiple iterations to improve model accuracy.  \n- Hyperparameter tuning optimizes model parameters, especially important in deep learning where manual tuning is impractical.  \n- Serving (deployment) makes the model accessible, often via Azure Kubernetes Service or Azure Container Instances.  \n- Inference is the process of making predictions using the trained model, either real-time or batch.\n\n**Definitions**  \n- **Data Labeling**: Assigning labels to data for supervised learning.  \n- **Feature Engineering**: Transforming raw data into numerical features usable by ML models.  \n- **Hyperparameter Tuning**: Adjusting model parameters to optimize performance.  \n- **Serving**: Hosting the model for access by applications.  \n- **Inference**: Using the model to predict outcomes on new data.\n\n**Key Facts**  \n- Preprocessing includes labeling and feature engineering.  \n- Deployment can be on Azure Kubernetes Service or Container Instances.  \n- Inference can be real-time (single prediction) or batch (multiple predictions).\n\n**Examples**  \n- Using CSV payloads for inference requests.\n\n**Exam Tips \ud83c\udfaf**  \n- Understand each step of the ML pipeline and its purpose.  \n- Know the difference between serving and inference.  \n- Be familiar with Azure services used for deployment.\n\n---\n\n"
  },
  {
    "section_title": "\ud83c\udfa4 [00:25:39] Forecast vs Prediction",
    "chunk_id": 2,
    "timestamp_range": "00:25:39 \u2013 00:26:24",
    "key_concepts": [
      "Forecasting uses relevant data to make informed predictions, often for trend analysis.",
      "Prediction can be made without relevant data, relying on statistics and decision theory, often considered guessing.",
      "Forecasting is more data-driven and analytical; prediction is more speculative."
    ],
    "definitions": {
      "Forecasting": "Predicting future outcomes based on relevant historical data.",
      "Prediction": "Estimating outcomes without sufficient relevant data, often using statistical inference."
    },
    "key_facts": [
      "Forecasting is not guessing; prediction may involve guessing.",
      "Forecasting is useful for trend analysis."
    ],
    "examples": [
      "Forecasting temperature next week using historical weather data.",
      "Prediction without relevant data using decision theory."
    ],
    "exam_tips": [],
    "raw_markdown": "### \ud83c\udfa4 [00:25:39] Forecast vs Prediction  \n**Timestamp**: 00:25:39 \u2013 00:26:24\n\n**Key Concepts**  \n- Forecasting uses relevant data to make informed predictions, often for trend analysis.  \n- Prediction can be made without relevant data, relying on statistics and decision theory, often considered guessing.  \n- Forecasting is more data-driven and analytical; prediction is more speculative.\n\n**Definitions**  \n- **Forecasting**: Predicting future outcomes based on relevant historical data.  \n- **Prediction**: Estimating outcomes without sufficient relevant data, often using statistical inference.\n\n**Key Facts**  \n- Forecasting is not guessing; prediction may involve guessing.  \n- Forecasting is useful for trend analysis.\n\n**Examples**  \n- Forecasting temperature next week using historical weather data.  \n- Prediction without relevant data using decision theory.\n\n**Exam Tips \ud83c\udfaf**  \n- Distinguish between forecasting and prediction in exam questions.  \n- Remember forecasting requires relevant data; prediction may not.\n\n---\n\n"
  },
  {
    "section_title": "\ud83c\udfa4 [00:26:24] Metrics",
    "chunk_id": 2,
    "timestamp_range": "00:26:24 \u2013 00:28:04",
    "key_concepts": [
      "Evaluation metrics assess ML model performance and accuracy.",
      "Different problem types require different metrics.",
      "Metrics are categorized as internal (evaluate model internals) and external (evaluate final predictions)."
    ],
    "definitions": {
      "Internal Evaluation Metrics": "Metrics like accuracy, precision, recall, F1 score used to evaluate model training performance.",
      "External Evaluation Metrics": "Metrics used to evaluate the quality of model predictions."
    },
    "key_facts": [
      "Classification metrics: accuracy, precision, recall, F1 score, ROC AUC.",
      "Regression metrics: MSE (Mean Squared Error), RMSE (Root Mean Squared Error), MAE (Mean Absolute Error).",
      "Ranking metrics: MMR, DCG.",
      "Statistical metrics: correlation.",
      "Computer vision metrics: PSNR, SSIM, IOU.",
      "NLP metrics: perplexity, BLEU, METEOR, ROUGE.",
      "Deep learning metrics: Inception score, Inception distance."
    ],
    "examples": [
      "Accuracy and F1 score commonly used for classification problems."
    ],
    "exam_tips": [],
    "raw_markdown": "### \ud83c\udfa4 [00:26:24] Metrics  \n**Timestamp**: 00:26:24 \u2013 00:28:04\n\n**Key Concepts**  \n- Evaluation metrics assess ML model performance and accuracy.  \n- Different problem types require different metrics.  \n- Metrics are categorized as internal (evaluate model internals) and external (evaluate final predictions).\n\n**Definitions**  \n- **Internal Evaluation Metrics**: Metrics like accuracy, precision, recall, F1 score used to evaluate model training performance.  \n- **External Evaluation Metrics**: Metrics used to evaluate the quality of model predictions.\n\n**Key Facts**  \n- Classification metrics: accuracy, precision, recall, F1 score, ROC AUC.  \n- Regression metrics: MSE (Mean Squared Error), RMSE (Root Mean Squared Error), MAE (Mean Absolute Error).  \n- Ranking metrics: MMR, DCG.  \n- Statistical metrics: correlation.  \n- Computer vision metrics: PSNR, SSIM, IOU.  \n- NLP metrics: perplexity, BLEU, METEOR, ROUGE.  \n- Deep learning metrics: Inception score, Inception distance.\n\n**Examples**  \n- Accuracy and F1 score commonly used for classification problems.\n\n**Exam Tips \ud83c\udfaf**  \n- Focus on classification metrics (accuracy, precision, recall, F1) as they are frequently tested.  \n- Understand which metrics apply to classification vs regression.  \n- Know the difference between internal and external evaluation metrics.\n\n---\n\n"
  },
  {
    "section_title": "\ud83c\udfa4 [00:27:58] Juypter Notebooks",
    "chunk_id": 2,
    "timestamp_range": "00:27:58 \u2013 00:28:55",
    "key_concepts": [
      "Jupyter Notebooks are web-based applications combining live code, narrative text, equations, and visualizations.",
      "Widely used in data science and ML for interactive development.",
      "Originated from IPython, which is now the Python kernel used in notebooks.",
      "Jupyter Labs is the next-generation interface replacing classic Jupyter Notebooks, offering a more flexible and powerful UI."
    ],
    "definitions": {
      "Jupyter Notebook": "Interactive web app for coding and documentation.",
      "Jupyter Labs": "Enhanced IDE-like interface for Jupyter notebooks.",
      "IPython": "Interactive Python kernel powering Jupyter notebooks."
    },
    "key_facts": [
      "Jupyter Labs includes notebooks, terminals, text editors, file browsers, and rich outputs.",
      "Classic Jupyter Notebooks are still available but being phased out."
    ],
    "examples": [
      "Using Jupyter Notebooks for ML model development and data analysis."
    ],
    "exam_tips": [],
    "raw_markdown": "### \ud83c\udfa4 [00:27:58] Juypter Notebooks  \n**Timestamp**: 00:27:58 \u2013 00:28:55\n\n**Key Concepts**  \n- Jupyter Notebooks are web-based applications combining live code, narrative text, equations, and visualizations.  \n- Widely used in data science and ML for interactive development.  \n- Originated from IPython, which is now the Python kernel used in notebooks.  \n- Jupyter Labs is the next-generation interface replacing classic Jupyter Notebooks, offering a more flexible and powerful UI.\n\n**Definitions**  \n- **Jupyter Notebook**: Interactive web app for coding and documentation.  \n- **Jupyter Labs**: Enhanced IDE-like interface for Jupyter notebooks.  \n- **IPython**: Interactive Python kernel powering Jupyter notebooks.\n\n**Key Facts**  \n- Jupyter Labs includes notebooks, terminals, text editors, file browsers, and rich outputs.  \n- Classic Jupyter Notebooks are still available but being phased out.\n\n**Examples**  \n- Using Jupyter Notebooks for ML model development and data analysis.\n\n**Exam Tips \ud83c\udfaf**  \n- Know the purpose and features of Jupyter Notebooks and Jupyter Labs.  \n- Understand that Jupyter Labs is the preferred modern interface.\n\n---\n\n"
  },
  {
    "section_title": "\ud83c\udfa4 [00:29:13] Regression",
    "chunk_id": 2,
    "timestamp_range": "00:29:13 \u2013 00:30:50",
    "key_concepts": [
      "Regression predicts a continuous variable from labeled data (supervised learning).",
      "It involves finding a function that fits the data points, often visualized as a regression line.",
      "Error is the distance between data points and the regression line, used to optimize the model.",
      "Common regression error metrics include MSE, RMSE, and MAE."
    ],
    "definitions": {
      "Regression": "Predicting continuous outcomes based on input features.",
      "Error": "Distance between actual data points and predicted regression line."
    },
    "key_facts": [
      "Regression can involve multiple dimensions (features).",
      "Error metrics quantify prediction accuracy."
    ],
    "examples": [
      "Predicting temperature next week using regression line fitted to historical data."
    ],
    "exam_tips": [],
    "raw_markdown": "### \ud83c\udfa4 [00:29:13] Regression  \n**Timestamp**: 00:29:13 \u2013 00:30:50\n\n**Key Concepts**  \n- Regression predicts a continuous variable from labeled data (supervised learning).  \n- It involves finding a function that fits the data points, often visualized as a regression line.  \n- Error is the distance between data points and the regression line, used to optimize the model.  \n- Common regression error metrics include MSE, RMSE, and MAE.\n\n**Definitions**  \n- **Regression**: Predicting continuous outcomes based on input features.  \n- **Error**: Distance between actual data points and predicted regression line.\n\n**Key Facts**  \n- Regression can involve multiple dimensions (features).  \n- Error metrics quantify prediction accuracy.\n\n**Examples**  \n- Predicting temperature next week using regression line fitted to historical data.\n\n**Exam Tips \ud83c\udfaf**  \n- Understand the concept of regression and how error is calculated.  \n- Know common regression metrics and their meanings.\n\n---\n\n"
  },
  {
    "section_title": "\ud83c\udfa4 [00:30:50] Classification",
    "chunk_id": 2,
    "timestamp_range": "00:30:50 \u2013 00:31:44",
    "key_concepts": [
      "Classification assigns input data into discrete categories or classes (supervised learning).",
      "It involves finding a decision boundary (classification line) to separate classes.",
      "Algorithms include logistic regression, decision trees, random forests, neural networks, Naive Bayes, KNN, and SVM."
    ],
    "definitions": {
      "Classification": "Predicting categorical labels for input data.",
      "Decision Boundary": "Line or surface separating classes in feature space."
    },
    "key_facts": [
      "Classification is about which side of the boundary a data point falls on.",
      "Many algorithms exist for classification tasks."
    ],
    "examples": [
      "Predicting weather as sunny or rainy based on input features."
    ],
    "exam_tips": [],
    "raw_markdown": "### \ud83c\udfa4 [00:30:50] Classification  \n**Timestamp**: 00:30:50 \u2013 00:31:44\n\n**Key Concepts**  \n- Classification assigns input data into discrete categories or classes (supervised learning).  \n- It involves finding a decision boundary (classification line) to separate classes.  \n- Algorithms include logistic regression, decision trees, random forests, neural networks, Naive Bayes, KNN, and SVM.\n\n**Definitions**  \n- **Classification**: Predicting categorical labels for input data.  \n- **Decision Boundary**: Line or surface separating classes in feature space.\n\n**Key Facts**  \n- Classification is about which side of the boundary a data point falls on.  \n- Many algorithms exist for classification tasks.\n\n**Examples**  \n- Predicting weather as sunny or rainy based on input features.\n\n**Exam Tips \ud83c\udfaf**  \n- Know the difference between classification and regression.  \n- Be familiar with common classification algorithms.\n\n---\n\n"
  },
  {
    "section_title": "\ud83c\udfa4 [00:31:44] Clustering",
    "chunk_id": 2,
    "timestamp_range": "00:31:44 \u2013 00:32:29",
    "key_concepts": [
      "Clustering groups unlabeled data based on similarity or differences (unsupervised learning).",
      "The goal is to identify natural groupings without predefined labels.",
      "Common clustering algorithms include K-means, K-medoids, density-based, and hierarchical clustering."
    ],
    "definitions": {
      "Clustering": "Grouping data points into clusters based on similarity.",
      "Unlabeled Data": "Data without predefined categories."
    },
    "key_facts": [
      "Clustering infers labels or groups from data structure.",
      "Useful for recommendation systems and exploratory data analysis."
    ],
    "examples": [
      "Grouping customers by purchasing behavior without prior labels."
    ],
    "exam_tips": [],
    "raw_markdown": "### \ud83c\udfa4 [00:31:44] Clustering  \n**Timestamp**: 00:31:44 \u2013 00:32:29\n\n**Key Concepts**  \n- Clustering groups unlabeled data based on similarity or differences (unsupervised learning).  \n- The goal is to identify natural groupings without predefined labels.  \n- Common clustering algorithms include K-means, K-medoids, density-based, and hierarchical clustering.\n\n**Definitions**  \n- **Clustering**: Grouping data points into clusters based on similarity.  \n- **Unlabeled Data**: Data without predefined categories.\n\n**Key Facts**  \n- Clustering infers labels or groups from data structure.  \n- Useful for recommendation systems and exploratory data analysis.\n\n**Examples**  \n- Grouping customers by purchasing behavior without prior labels.\n\n**Exam Tips \ud83c\udfaf**  \n- Understand clustering is unsupervised and differs from classification.  \n- Know common clustering algorithms and their purposes.\n\n---\n\n"
  },
  {
    "section_title": "\ud83c\udfa4 [00:32:29] Confusion Matrix",
    "chunk_id": 2,
    "timestamp_range": "00:32:29 \u2013 00:34:06",
    "key_concepts": [
      "Confusion matrix visualizes classification model predictions vs actual labels (ground truth).",
      "It helps evaluate model performance by showing true positives, false positives, true negatives, and false negatives.",
      "Size of the confusion matrix depends on the number of classes (e.g., binary classification has 2x2 matrix).",
      "Useful for calculating metrics like accuracy, precision, recall."
    ],
    "definitions": {
      "Confusion Matrix": "Table comparing predicted labels to actual labels.",
      "True Positive (TP)": "Correct positive prediction.",
      "False Negative (FN)": "Incorrect negative prediction."
    },
    "key_facts": [
      "For binary classification, confusion matrix is 2x2; for multi-class, size increases accordingly.",
      "Exam questions may ask to identify TP, FN, or matrix size."
    ],
    "examples": [
      "Predicting number of bananas eaten and comparing predicted vs actual counts."
    ],
    "exam_tips": [],
    "raw_markdown": "### \ud83c\udfa4 [00:32:29] Confusion Matrix  \n**Timestamp**: 00:32:29 \u2013 00:34:06\n\n**Key Concepts**  \n- Confusion matrix visualizes classification model predictions vs actual labels (ground truth).  \n- It helps evaluate model performance by showing true positives, false positives, true negatives, and false negatives.  \n- Size of the confusion matrix depends on the number of classes (e.g., binary classification has 2x2 matrix).  \n- Useful for calculating metrics like accuracy, precision, recall.\n\n**Definitions**  \n- **Confusion Matrix**: Table comparing predicted labels to actual labels.  \n- **True Positive (TP)**: Correct positive prediction.  \n- **False Negative (FN)**: Incorrect negative prediction.\n\n**Key Facts**  \n- For binary classification, confusion matrix is 2x2; for multi-class, size increases accordingly.  \n- Exam questions may ask to identify TP, FN, or matrix size.\n\n**Examples**  \n- Predicting number of bananas eaten and comparing predicted vs actual counts.\n\n**Exam Tips \ud83c\udfaf**  \n- Be able to interpret confusion matrices and identify TP, FP, TN, FN.  \n- Understand how matrix size relates to number of classes.\n\n---\n\n"
  },
  {
    "section_title": "\ud83c\udfa4 [00:34:06] Anomaly Detection AI",
    "chunk_id": 2,
    "timestamp_range": "00:34:06 \u2013 00:35:05",
    "key_concepts": [
      "Anomaly detection identifies data points or patterns that deviate significantly from the norm.",
      "Used to detect outliers, suspicious or malicious activity, and unusual events.",
      "Applications include data cleaning, intrusion detection, fraud detection, system health monitoring, event detection, sensor networks, and ecosystem disturbance detection.",
      "Manual anomaly detection is tedious; ML automates and improves accuracy.",
      "Azure provides an Anomaly Detector service for quick anomaly identification."
    ],
    "definitions": {
      "Anomaly": "Data point or pattern deviating from expected behavior.",
      "Anomaly Detection": "Process of finding anomalies in data."
    },
    "key_facts": [
      "Anomaly detection is critical for security and system monitoring.",
      "Azure Anomaly Detector is a managed service for this purpose."
    ],
    "examples": [
      "Detecting fraudulent transactions or system faults."
    ],
    "exam_tips": [],
    "raw_markdown": "### \ud83c\udfa4 [00:34:06] Anomaly Detection AI  \n**Timestamp**: 00:34:06 \u2013 00:35:05\n\n**Key Concepts**  \n- Anomaly detection identifies data points or patterns that deviate significantly from the norm.  \n- Used to detect outliers, suspicious or malicious activity, and unusual events.  \n- Applications include data cleaning, intrusion detection, fraud detection, system health monitoring, event detection, sensor networks, and ecosystem disturbance detection.  \n- Manual anomaly detection is tedious; ML automates and improves accuracy.  \n- Azure provides an Anomaly Detector service for quick anomaly identification.\n\n**Definitions**  \n- **Anomaly**: Data point or pattern deviating from expected behavior.  \n- **Anomaly Detection**: Process of finding anomalies in data.\n\n**Key Facts**  \n- Anomaly detection is critical for security and system monitoring.  \n- Azure Anomaly Detector is a managed service for this purpose.\n\n**Examples**  \n- Detecting fraudulent transactions or system faults.\n\n**Exam Tips \ud83c\udfaf**  \n- Know what anomaly detection is and typical use cases.  \n- Be aware of Azure\u2019s Anomaly Detector service.\n\n---\n\n"
  },
  {
    "section_title": "\ud83c\udfa4 [00:34:59] Computer Vision AI",
    "chunk_id": 2,
    "timestamp_range": "00:35:05 \u2013 00:35:32",
    "key_concepts": [
      "Computer vision uses ML and neural networks to interpret digital images and videos.",
      "Deep learning algorithms for computer vision include convolutional neural networks (CNNs) and recurrent neural networks (RNNs).",
      "CNNs are inspired by human visual processing and are used for image and video recognition.",
      "RNNs are typically used for handwriting and speech recognition but have other applications.",
      "Types of computer vision tasks: image classification, object detection, semantic segmentation, and image analysis."
    ],
    "definitions": {
      "Computer Vision": "Technology enabling machines to interpret visual data.",
      "CNN": "Neural network specialized for processing grid-like data such as images.",
      "RNN": "Neural network suited for sequential data like handwriting or speech."
    },
    "key_facts": [
      "CNNs excel at recognizing objects and patterns in images/videos.",
      "Semantic segmentation involves pixel-level labeling.",
      "Image analysis applies descriptive labels to images or videos."
    ],
    "examples": [
      "Classifying images into categories.",
      "Detecting objects and drawing bounding boxes.",
      "Segmenting objects with pixel masks."
    ],
    "exam_tips": [],
    "raw_markdown": "### \ud83c\udfa4 [00:34:59] Computer Vision AI  \n**Timestamp**: 00:35:05 \u2013 00:35:32\n\n**Key Concepts**  \n- Computer vision uses ML and neural networks to interpret digital images and videos.  \n- Deep learning algorithms for computer vision include convolutional neural networks (CNNs) and recurrent neural networks (RNNs).  \n- CNNs are inspired by human visual processing and are used for image and video recognition.  \n- RNNs are typically used for handwriting and speech recognition but have other applications.  \n- Types of computer vision tasks: image classification, object detection, semantic segmentation, and image analysis.\n\n**Definitions**  \n- **Computer Vision**: Technology enabling machines to interpret visual data.  \n- **CNN**: Neural network specialized for processing grid-like data such as images.  \n- **RNN**: Neural network suited for sequential data like handwriting or speech.\n\n**Key Facts**  \n- CNNs excel at recognizing objects and patterns in images/videos.  \n- Semantic segmentation involves pixel-level labeling.  \n- Image analysis applies descriptive labels to images or videos.\n\n**Examples**  \n- Classifying images into categories.  \n- Detecting objects and drawing bounding boxes.  \n- Segmenting objects with pixel masks.\n\n**Exam Tips \ud83c\udfaf**  \n- Understand different computer vision tasks and their purposes.  \n- Know the role of CNNs and RNNs in computer vision.\n\n"
  },
  {
    "section_title": "\ud83c\udfa4 [00:34:59] Computer Vision AI",
    "chunk_id": 3,
    "timestamp_range": "00:36:31 \u2013 00:37:01",
    "key_concepts": [
      "Computer Vision AI analyzes images and videos to extract information such as descriptions, tags, objects, and text.",
      "Key Azure Computer Vision services include:"
    ],
    "definitions": {
      "OCR (Optical Character Recognition)": "Technology to find and extract text from images or videos into editable digital text.",
      "Face Detection": "Identifying faces in photos or videos, drawing boundaries, and labeling expressions."
    },
    "key_facts": [
      "Seeing AI is a free Microsoft app for iOS devices designed to assist visually impaired users by describing objects and people.",
      "Form Recognizer translates scanned documents into editable structured data."
    ],
    "examples": [
      "Seeing AI app audibly describes objects and people for visually impaired users.",
      "Form Recognizer extracts data from forms into key-value pairs or tables."
    ],
    "exam_tips": [],
    "raw_markdown": "### \ud83c\udfa4 [00:34:59] Computer Vision AI  \n**Timestamp**: 00:36:31 \u2013 00:37:01  \n\n**Key Concepts**  \n- Computer Vision AI analyzes images and videos to extract information such as descriptions, tags, objects, and text.  \n- Key Azure Computer Vision services include:  \n  - **Computer Vision**: General image and video analysis.  \n  - **Custom Vision**: Build custom image classification and object detection models using your own images.  \n  - **Face Service**: Detect and identify people and emotions in images.  \n  - **Form Recognizer**: Extract key-value pairs or tabular data from scanned documents for editing.  \n- Microsoft Seeing AI app (iOS) uses device camera to identify people and objects and audibly describes them for visually impaired users.  \n\n**Definitions**  \n- **OCR (Optical Character Recognition)**: Technology to find and extract text from images or videos into editable digital text.  \n- **Face Detection**: Identifying faces in photos or videos, drawing boundaries, and labeling expressions.  \n\n**Key Facts**  \n- Seeing AI is a free Microsoft app for iOS devices designed to assist visually impaired users by describing objects and people.  \n- Form Recognizer translates scanned documents into editable structured data.  \n\n**Examples**  \n- Seeing AI app audibly describes objects and people for visually impaired users.  \n- Form Recognizer extracts data from forms into key-value pairs or tables.  \n\n**Exam Tips \ud83c\udfaf**  \n- Know the different Azure Computer Vision services and their purposes.  \n- Understand OCR as a key capability of Computer Vision.  \n- Be aware of Microsoft\u2019s Seeing AI app as an example of applied computer vision for accessibility.  \n\n---\n\n"
  },
  {
    "section_title": "\ud83c\udfa4 [00:37:05] Natural Language Processing AI",
    "chunk_id": 3,
    "timestamp_range": "00:37:01 \u2013 00:38:00",
    "key_concepts": [
      "Natural Language Processing (NLP) enables machines to understand, analyze, and interpret human language in text and speech.",
      "NLP tasks include:"
    ],
    "definitions": {
      "Corpus": "A body of related text used for NLP analysis.",
      "Sentiment Analysis": "Determining the emotional tone behind text.",
      "Named Entity Recognition (NER)": "Identifying and categorizing key entities (people, places, organizations) in text."
    },
    "key_facts": [
      "Cortana uses Bing search engine to assist users and is integrated into Windows 10.",
      "Azure NLP offerings include Text Analytics, Translator, Speech Service, and Language Understanding (LUIS)."
    ],
    "examples": [
      "Sentiment analysis to assess customer satisfaction.",
      "Voice assistants translating spoken commands into actions.",
      "Cortana setting reminders or answering questions."
    ],
    "exam_tips": [],
    "raw_markdown": "### \ud83c\udfa4 [00:37:05] Natural Language Processing AI  \n**Timestamp**: 00:37:01 \u2013 00:38:00  \n\n**Key Concepts**  \n- Natural Language Processing (NLP) enables machines to understand, analyze, and interpret human language in text and speech.  \n- NLP tasks include:  \n  - Sentiment analysis (detecting customer emotions).  \n  - Key phrase extraction (finding important topics).  \n  - Language detection.  \n  - Named entity recognition (categorizing entities in text).  \n  - Speech synthesis and translation.  \n  - Understanding spoken or written commands.  \n- Microsoft\u2019s Cortana is an example of a voice assistant using NLP to perform tasks like setting reminders and answering questions.  \n\n**Definitions**  \n- **Corpus**: A body of related text used for NLP analysis.  \n- **Sentiment Analysis**: Determining the emotional tone behind text.  \n- **Named Entity Recognition (NER)**: Identifying and categorizing key entities (people, places, organizations) in text.  \n\n**Key Facts**  \n- Cortana uses Bing search engine to assist users and is integrated into Windows 10.  \n- Azure NLP offerings include Text Analytics, Translator, Speech Service, and Language Understanding (LUIS).  \n\n**Examples**  \n- Sentiment analysis to assess customer satisfaction.  \n- Voice assistants translating spoken commands into actions.  \n- Cortana setting reminders or answering questions.  \n\n**Exam Tips \ud83c\udfaf**  \n- Understand the core NLP capabilities and Azure services that provide them.  \n- Know the role of LUIS in enabling applications to understand human language.  \n- Recognize common NLP use cases like sentiment analysis and language translation.  \n\n---\n\n"
  },
  {
    "section_title": "\ud83c\udfa4 [00:38:42] Conversational AI",
    "chunk_id": 3,
    "timestamp_range": "00:38:29 \u2013 00:39:52",
    "key_concepts": [
      "Conversational AI enables machines to participate in human-like conversations using chatbots, voice assistants, and interactive voice recognition systems.",
      "Interactive Voice Recognition (IVR) systems respond to keypad inputs; Interactive Voice Response systems interpret spoken commands.",
      "Use cases include:"
    ],
    "definitions": {
      "Conversational AI": "Technology that enables machines to engage in dialogue with humans.",
      "QnA Maker": "Azure service to build question-answering bots from content.",
      "Azure Bot Service": "Platform to build, deploy, and manage intelligent bots."
    },
    "key_facts": [
      "Conversational AI often overlaps with NLP technologies.",
      "Azure Bot Service is serverless and scales on demand."
    ],
    "examples": [
      "Customer support bots answering shipping or FAQ questions.",
      "Voice assistants like Cortana, Alexa, Siri.",
      "QnA Maker bots built from company FAQs or manuals."
    ],
    "exam_tips": [],
    "raw_markdown": "### \ud83c\udfa4 [00:38:42] Conversational AI  \n**Timestamp**: 00:38:29 \u2013 00:39:52  \n\n**Key Concepts**  \n- Conversational AI enables machines to participate in human-like conversations using chatbots, voice assistants, and interactive voice recognition systems.  \n- Interactive Voice Recognition (IVR) systems respond to keypad inputs; Interactive Voice Response systems interpret spoken commands.  \n- Use cases include:  \n  - Online customer support replacing human agents for FAQs.  \n  - Accessibility via voice-operated UIs for visually impaired users.  \n  - HR processes like employee training and onboarding.  \n  - Healthcare claims processing.  \n  - Internet of Things (IoT) devices like Alexa, Siri, Google Home.  \n  - Computer software autocomplete and search assistance.  \n- Azure services for conversational AI:  \n  - **QnA Maker**: Create Q&A bots from existing knowledge bases.  \n  - **Azure Bot Service**: Serverless, scalable bot creation and deployment platform.  \n\n**Definitions**  \n- **Conversational AI**: Technology that enables machines to engage in dialogue with humans.  \n- **QnA Maker**: Azure service to build question-answering bots from content.  \n- **Azure Bot Service**: Platform to build, deploy, and manage intelligent bots.  \n\n**Key Facts**  \n- Conversational AI often overlaps with NLP technologies.  \n- Azure Bot Service is serverless and scales on demand.  \n\n**Examples**  \n- Customer support bots answering shipping or FAQ questions.  \n- Voice assistants like Cortana, Alexa, Siri.  \n- QnA Maker bots built from company FAQs or manuals.  \n\n**Exam Tips \ud83c\udfaf**  \n- Know the difference between IVR and interactive voice recognition.  \n- Understand common use cases for conversational AI.  \n- Be familiar with Azure services QnA Maker and Azure Bot Service for building conversational AI solutions.  \n\n---\n\n"
  },
  {
    "section_title": "\ud83c\udfa4 [00:40:16] Responsible AI",
    "chunk_id": 3,
    "timestamp_range": "00:40:23 \u2013 00:40:51",
    "key_concepts": [
      "Responsible AI focuses on ethical, transparent, and accountable use of AI technologies.",
      "Microsoft\u2019s six AI principles guide the development and deployment of AI systems:"
    ],
    "definitions": {
      "Responsible AI": "Ethical and accountable design, development, and use of AI systems."
    },
    "key_facts": [
      "Microsoft actively promotes adoption of these principles in AI development."
    ],
    "examples": [
      "None in this chunk (general overview)."
    ],
    "exam_tips": [],
    "raw_markdown": "### \ud83c\udfa4 [00:40:16] Responsible AI  \n**Timestamp**: 00:40:23 \u2013 00:40:51  \n\n**Key Concepts**  \n- Responsible AI focuses on ethical, transparent, and accountable use of AI technologies.  \n- Microsoft\u2019s six AI principles guide the development and deployment of AI systems:  \n  1. Fairness  \n  2. Reliability and Safety  \n  3. Privacy and Security  \n  4. Inclusiveness  \n  5. Transparency  \n  6. Accountability  \n- These principles are Microsoft\u2019s framework and not necessarily industry standards but are widely promoted by Microsoft.  \n\n**Definitions**  \n- **Responsible AI**: Ethical and accountable design, development, and use of AI systems.  \n\n**Key Facts**  \n- Microsoft actively promotes adoption of these principles in AI development.  \n\n**Examples**  \n- None in this chunk (general overview).  \n\n**Exam Tips \ud83c\udfaf**  \n- Memorize Microsoft\u2019s six AI principles as a framework for responsible AI.  \n- Understand that these principles aim to ensure ethical AI use.  \n\n---\n\n"
  },
  {
    "section_title": "\ud83c\udfa4 [00:41:09] Fairness",
    "chunk_id": 3,
    "timestamp_range": "00:40:51 \u2013 00:41:52",
    "key_concepts": [
      "AI systems should treat all people fairly and avoid reinforcing social biases or stereotypes.",
      "Bias can be introduced during data collection, model training, or pipeline development.",
      "Fairness is critical in sensitive domains like criminal justice, hiring, finance, and credit.",
      "Azure ML tools can analyze feature influence on model predictions to detect bias.",
      "**Fairlearn** is an open-source Python toolkit to improve fairness in AI systems (still in preview)."
    ],
    "definitions": {
      "Fairness": "AI systems providing equitable treatment without bias based on gender, ethnicity, or other protected attributes."
    },
    "key_facts": [
      "Bias in AI can lead to unfair advantages or disadvantages in decision-making.",
      "Fairlearn helps data scientists mitigate bias during model development."
    ],
    "examples": [
      "Hiring model selecting applicants without gender or ethnicity bias."
    ],
    "exam_tips": [],
    "raw_markdown": "### \ud83c\udfa4 [00:41:09] Fairness  \n**Timestamp**: 00:40:51 \u2013 00:41:52  \n\n**Key Concepts**  \n- AI systems should treat all people fairly and avoid reinforcing social biases or stereotypes.  \n- Bias can be introduced during data collection, model training, or pipeline development.  \n- Fairness is critical in sensitive domains like criminal justice, hiring, finance, and credit.  \n- Azure ML tools can analyze feature influence on model predictions to detect bias.  \n- **Fairlearn** is an open-source Python toolkit to improve fairness in AI systems (still in preview).  \n\n**Definitions**  \n- **Fairness**: AI systems providing equitable treatment without bias based on gender, ethnicity, or other protected attributes.  \n\n**Key Facts**  \n- Bias in AI can lead to unfair advantages or disadvantages in decision-making.  \n- Fairlearn helps data scientists mitigate bias during model development.  \n\n**Examples**  \n- Hiring model selecting applicants without gender or ethnicity bias.  \n\n**Exam Tips \ud83c\udfaf**  \n- Understand the importance of fairness and bias mitigation in AI.  \n- Be aware of tools like Fairlearn for fairness evaluation.  \n- Know examples of bias impact in real-world AI applications.  \n\n---\n\n"
  },
  {
    "section_title": "\ud83c\udfa4 [00:42:08] Reliability and safety",
    "chunk_id": 3,
    "timestamp_range": "00:41:52 \u2013 00:42:47",
    "key_concepts": [
      "AI systems must perform reliably and safely, especially in critical applications.",
      "Rigorous testing is required before AI release to ensure expected behavior.",
      "Risks and harms from AI errors must be quantified and communicated to users.",
      "Reliability and safety are crucial in autonomous vehicles, health diagnosis, prescription suggestions, and autonomous weapons."
    ],
    "definitions": {
      "Reliability": "Consistent and correct performance of AI systems.",
      "Safety": "Ensuring AI does not cause harm to users or society."
    },
    "key_facts": [
      "Microsoft emphasizes reporting AI limitations and risks to end users.",
      "Autonomous systems require high reliability to avoid catastrophic errors."
    ],
    "examples": [
      "Autonomous vehicle decision-making.",
      "AI health diagnosis and prescription recommendations."
    ],
    "exam_tips": [],
    "raw_markdown": "### \ud83c\udfa4 [00:42:08] Reliability and safety  \n**Timestamp**: 00:41:52 \u2013 00:42:47  \n\n**Key Concepts**  \n- AI systems must perform reliably and safely, especially in critical applications.  \n- Rigorous testing is required before AI release to ensure expected behavior.  \n- Risks and harms from AI errors must be quantified and communicated to users.  \n- Reliability and safety are crucial in autonomous vehicles, health diagnosis, prescription suggestions, and autonomous weapons.  \n\n**Definitions**  \n- **Reliability**: Consistent and correct performance of AI systems.  \n- **Safety**: Ensuring AI does not cause harm to users or society.  \n\n**Key Facts**  \n- Microsoft emphasizes reporting AI limitations and risks to end users.  \n- Autonomous systems require high reliability to avoid catastrophic errors.  \n\n**Examples**  \n- Autonomous vehicle decision-making.  \n- AI health diagnosis and prescription recommendations.  \n\n**Exam Tips \ud83c\udfaf**  \n- Know the importance of testing and risk reporting for AI safety.  \n- Be able to cite examples where reliability is critical.  \n\n---\n\n"
  },
  {
    "section_title": "\ud83c\udfa4 [00:43:00] Privacy and security",
    "chunk_id": 3,
    "timestamp_range": "00:42:47 \u2013 00:43:45",
    "key_concepts": [
      "AI systems often require large datasets, including personally identifiable information (PII).",
      "Protecting user data privacy and security is essential to prevent leaks or misuse.",
      "Some ML models can run locally on user devices (Edge Computing) to keep PII private.",
      "AI security principles include data origin, lineage, use of internal vs external data, corruption, and anomaly detection."
    ],
    "definitions": {
      "PII (Personally Identifiable Information)": "Data that can identify an individual.",
      "Edge Computing": "Running AI models locally on devices to enhance privacy and reduce data exposure."
    },
    "key_facts": [
      "Edge Computing helps avoid vulnerabilities by keeping sensitive data on the device.",
      "AI security involves protecting data integrity and preventing malicious attacks."
    ],
    "examples": [
      "Running ML models on user devices to keep PII private."
    ],
    "exam_tips": [],
    "raw_markdown": "### \ud83c\udfa4 [00:43:00] Privacy and security  \n**Timestamp**: 00:42:47 \u2013 00:43:45  \n\n**Key Concepts**  \n- AI systems often require large datasets, including personally identifiable information (PII).  \n- Protecting user data privacy and security is essential to prevent leaks or misuse.  \n- Some ML models can run locally on user devices (Edge Computing) to keep PII private.  \n- AI security principles include data origin, lineage, use of internal vs external data, corruption, and anomaly detection.  \n\n**Definitions**  \n- **PII (Personally Identifiable Information)**: Data that can identify an individual.  \n- **Edge Computing**: Running AI models locally on devices to enhance privacy and reduce data exposure.  \n\n**Key Facts**  \n- Edge Computing helps avoid vulnerabilities by keeping sensitive data on the device.  \n- AI security involves protecting data integrity and preventing malicious attacks.  \n\n**Examples**  \n- Running ML models on user devices to keep PII private.  \n\n**Exam Tips \ud83c\udfaf**  \n- Understand privacy risks in AI and how Edge Computing mitigates them.  \n- Know key AI security considerations like data lineage and anomaly detection.  \n\n---\n\n"
  },
  {
    "section_title": "\ud83c\udfa4 [00:43:45] Inclusiveness",
    "chunk_id": 3,
    "timestamp_range": "00:43:45 \u2013 00:44:12",
    "key_concepts": [
      "AI systems should empower and engage everyone, including minority groups.",
      "Designing AI solutions for minority users often benefits the majority as well.",
      "Minority groups include people with disabilities, different genders, sexual orientations, ethnicities, etc.",
      "Specialized solutions may be needed for some groups (e.g., deaf or blind users)."
    ],
    "definitions": {
      "Inclusiveness": "Designing AI to be accessible and beneficial to diverse populations."
    },
    "key_facts": [
      "Designing for minorities can improve overall usability and accessibility."
    ],
    "examples": [
      "Specialized technologies for deaf and blind users."
    ],
    "exam_tips": [],
    "raw_markdown": "### \ud83c\udfa4 [00:43:45] Inclusiveness  \n**Timestamp**: 00:43:45 \u2013 00:44:12  \n\n**Key Concepts**  \n- AI systems should empower and engage everyone, including minority groups.  \n- Designing AI solutions for minority users often benefits the majority as well.  \n- Minority groups include people with disabilities, different genders, sexual orientations, ethnicities, etc.  \n- Specialized solutions may be needed for some groups (e.g., deaf or blind users).  \n\n**Definitions**  \n- **Inclusiveness**: Designing AI to be accessible and beneficial to diverse populations.  \n\n**Key Facts**  \n- Designing for minorities can improve overall usability and accessibility.  \n\n**Examples**  \n- Specialized technologies for deaf and blind users.  \n\n**Exam Tips \ud83c\udfaf**  \n- Know the importance of inclusiveness in AI design.  \n- Recognize that inclusiveness can require specialized solutions.  \n\n---\n\n"
  },
  {
    "section_title": "\ud83c\udfa4 [00:44:24] Transparency",
    "chunk_id": 3,
    "timestamp_range": "00:44:12 \u2013 00:45:00",
    "key_concepts": [
      "AI systems should be understandable and interpretable by end users and developers.",
      "Transparency helps mitigate unfairness, aids debugging, and builds user trust.",
      "Developers should disclose why AI is used and its limitations.",
      "Open source AI frameworks can increase transparency by exposing internal workings."
    ],
    "definitions": {
      "Transparency": "Clarity about AI system behavior and decision-making processes.",
      "Interpretability": "The ability to explain how AI arrives at decisions."
    },
    "key_facts": [
      "Transparency is key to user trust and ethical AI deployment."
    ],
    "examples": [
      "Open source AI projects providing insight into AI algorithms."
    ],
    "exam_tips": [],
    "raw_markdown": "### \ud83c\udfa4 [00:44:24] Transparency  \n**Timestamp**: 00:44:12 \u2013 00:45:00  \n\n**Key Concepts**  \n- AI systems should be understandable and interpretable by end users and developers.  \n- Transparency helps mitigate unfairness, aids debugging, and builds user trust.  \n- Developers should disclose why AI is used and its limitations.  \n- Open source AI frameworks can increase transparency by exposing internal workings.  \n\n**Definitions**  \n- **Transparency**: Clarity about AI system behavior and decision-making processes.  \n- **Interpretability**: The ability to explain how AI arrives at decisions.  \n\n**Key Facts**  \n- Transparency is key to user trust and ethical AI deployment.  \n\n**Examples**  \n- Open source AI projects providing insight into AI algorithms.  \n\n**Exam Tips \ud83c\udfaf**  \n- Understand the role of transparency in responsible AI.  \n- Be able to explain why interpretability matters for fairness and trust.  \n\n---\n\n"
  },
  {
    "section_title": "\ud83c\udfa4 [00:45:00] Accountability",
    "chunk_id": 3,
    "timestamp_range": "00:45:00 \u2013 00:45:39",
    "key_concepts": [
      "People and organizations should be accountable for AI systems they develop and deploy.",
      "AI systems must comply with government, organizational, ethical, and legal standards.",
      "Microsoft advocates for clear frameworks and regulations to enforce accountability.",
      "Accountability ensures consistent application of AI principles and responsible use."
    ],
    "definitions": {
      "Accountability": "Responsibility for AI system outcomes and adherence to standards."
    },
    "key_facts": [
      "Microsoft pushes for adoption of accountability frameworks in AI development."
    ],
    "examples": [
      "AI systems operating within legal and ethical guidelines."
    ],
    "exam_tips": [],
    "raw_markdown": "### \ud83c\udfa4 [00:45:00] Accountability  \n**Timestamp**: 00:45:00 \u2013 00:45:39  \n\n**Key Concepts**  \n- People and organizations should be accountable for AI systems they develop and deploy.  \n- AI systems must comply with government, organizational, ethical, and legal standards.  \n- Microsoft advocates for clear frameworks and regulations to enforce accountability.  \n- Accountability ensures consistent application of AI principles and responsible use.  \n\n**Definitions**  \n- **Accountability**: Responsibility for AI system outcomes and adherence to standards.  \n\n**Key Facts**  \n- Microsoft pushes for adoption of accountability frameworks in AI development.  \n\n**Examples**  \n- AI systems operating within legal and ethical guidelines.  \n\n**Exam Tips \ud83c\udfaf**  \n- Know the importance of accountability in AI governance.  \n- Understand that accountability involves compliance with laws and ethical standards.  \n\n---\n\n"
  },
  {
    "section_title": "\ud83c\udfa4 [00:45:45] Guidelines for Human AI Interaction",
    "chunk_id": 3,
    "timestamp_range": "00:45:39 \u2013 00:53:53",
    "key_concepts": [
      "Microsoft provides practical guidelines (18 cards) for implementing responsible AI principles in human-AI interaction.",
      "Key guidelines include:"
    ],
    "definitions": {
      "Disambiguation": "Clarifying uncertain user intent by offering multiple options.",
      "Graceful degradation": "Reducing functionality smoothly when AI is uncertain or limited."
    },
    "key_facts": [
      "These guidelines help build user trust and improve usability of AI systems.",
      "Examples often drawn from Microsoft, Apple, Google, Amazon products."
    ],
    "examples": [
      "PowerPoint Quick Start Builder shows suggested topics to clarify capabilities.",
      "Apple Music uses language like \u201cWe think you\u2019ll like\u201d to communicate uncertainty.",
      "Outlook sends \u201ctime to leave\u201d notifications based on real-time traffic and location.",
      "Google Photos recognizes pets as family members, reflecting social norms.",
      "Bing search shows diverse images for CEO or doctor to mitigate bias.",
      "Microsoft Forms allows easy dismissal of AI suggestions.",
      "Siri lets users easily dismiss or edit reminders.",
      "AutoCorrect in Word offers multiple correction options when uncertain.",
      "Facebook explains why specific ads are shown.",
      "Outlook remembers recent files and contacts for efficient referencing.",
      "Amazon personalizes product recommendations based on past purchases."
    ],
    "exam_tips": [],
    "raw_markdown": "### \ud83c\udfa4 [00:45:45] Guidelines for Human AI Interaction  \n**Timestamp**: 00:45:39 \u2013 00:53:53  \n\n**Key Concepts**  \n- Microsoft provides practical guidelines (18 cards) for implementing responsible AI principles in human-AI interaction.  \n- Key guidelines include:  \n  1. Make clear what the system can do (set user expectations).  \n  2. Make clear how well the system can do what it does (communicate capabilities and limitations).  \n  3. Time services based on context (act or interrupt at appropriate times).  \n  4. Show contextually relevant information (personalize based on user context).  \n  5. Match relevant social norms (politeness, cultural appropriateness).  \n  6. Mitigate social biases (avoid reinforcing stereotypes).  \n  7. Support efficient invocation (easy to request AI services).  \n  8. Support efficient dismissal (easy to ignore or dismiss AI suggestions).  \n  9. Support efficient correction (easy to edit or recover from AI errors).  \n  10. Scope services when in doubt (disambiguate or gracefully degrade).  \n  11. Make clear why the system did what it did (explain AI decisions).  \n  12. Remember recent interactions (maintain short-term memory for context).  \n  13. Learn from user behavior (personalize experience over time).  \n  14. Update and adapt cautiously (limit disruptive changes).  \n\n**Definitions**  \n- **Disambiguation**: Clarifying uncertain user intent by offering multiple options.  \n- **Graceful degradation**: Reducing functionality smoothly when AI is uncertain or limited.  \n\n**Key Facts**  \n- These guidelines help build user trust and improve usability of AI systems.  \n- Examples often drawn from Microsoft, Apple, Google, Amazon products.  \n\n**Examples**  \n- PowerPoint Quick Start Builder shows suggested topics to clarify capabilities.  \n- Apple Music uses language like \u201cWe think you\u2019ll like\u201d to communicate uncertainty.  \n- Outlook sends \u201ctime to leave\u201d notifications based on real-time traffic and location.  \n- Google Photos recognizes pets as family members, reflecting social norms.  \n- Bing search shows diverse images for CEO or doctor to mitigate bias.  \n- Microsoft Forms allows easy dismissal of AI suggestions.  \n- Siri lets users easily dismiss or edit reminders.  \n- AutoCorrect in Word offers multiple correction options when uncertain.  \n- Facebook explains why specific ads are shown.  \n- Outlook remembers recent files and contacts for efficient referencing.  \n- Amazon personalizes product recommendations based on past purchases.  \n\n**Exam Tips \ud83c\udfaf**  \n- Be familiar with Microsoft\u2019s practical guidelines for human-AI interaction.  \n- Understand how transparency, bias mitigation, and user control improve AI trust.  \n- Know examples of how major tech products implement these guidelines.  \n- Expect exam questions on how to apply responsible AI principles in real scenarios."
  },
  {
    "section_title": "\ud83c\udfa4 [00:57:33] Azure Cognitive Services",
    "chunk_id": 4,
    "timestamp_range": "00:54:55 \u2013 01:00:08",
    "key_concepts": [
      "Azure Cognitive Services is a comprehensive family of AI services and APIs to build intelligent applications.",
      "Offers customizable pre-trained models built on advanced AI research.",
      "Can be deployed anywhere: cloud, edge, containers.",
      "Designed for quick start with no required machine learning expertise, but background knowledge is helpful.",
      "Emphasizes responsible AI with ethical standards and tools."
    ],
    "definitions": {
      "Azure Cognitive Services": "A suite of AI services and APIs that enable developers to add AI capabilities such as vision, speech, language, and decision-making to applications."
    },
    "key_facts": [
      "Services grouped into categories: Decision, Language, Speech, Vision.",
      "Authentication via API key and endpoint generated when creating a Cognitive Service resource."
    ],
    "examples": [
      "PowerPoint Designer uses AI to suggest slide designs.",
      "Excel Ideas feature provides visual summaries and asks for feedback on suggestions.",
      "Instagram solicits feedback on ads to improve relevance.",
      "Apple Music uses like/dislike buttons to tailor recommendations."
    ],
    "exam_tips": [],
    "raw_markdown": "### \ud83c\udfa4 [00:57:33] Azure Cognitive Services  \n**Timestamp**: 00:54:55 \u2013 01:00:08  \n\n**Key Concepts**  \n- Azure Cognitive Services is a comprehensive family of AI services and APIs to build intelligent applications.  \n- Offers customizable pre-trained models built on advanced AI research.  \n- Can be deployed anywhere: cloud, edge, containers.  \n- Designed for quick start with no required machine learning expertise, but background knowledge is helpful.  \n- Emphasizes responsible AI with ethical standards and tools.  \n\n**Definitions**  \n- **Azure Cognitive Services**: A suite of AI services and APIs that enable developers to add AI capabilities such as vision, speech, language, and decision-making to applications.  \n\n**Key Facts**  \n- Services grouped into categories: Decision, Language, Speech, Vision.  \n- Authentication via API key and endpoint generated when creating a Cognitive Service resource.  \n\n**Examples**  \n- PowerPoint Designer uses AI to suggest slide designs.  \n- Excel Ideas feature provides visual summaries and asks for feedback on suggestions.  \n- Instagram solicits feedback on ads to improve relevance.  \n- Apple Music uses like/dislike buttons to tailor recommendations.  \n\n**Exam Tips \ud83c\udfaf**  \n- Know the main categories of Cognitive Services: Decision, Language, Speech, Vision.  \n- Understand the authentication mechanism: API key and endpoint.  \n- Be aware of responsible AI principles integrated into Azure Cognitive Services.  \n\n---\n\n"
  },
  {
    "section_title": "\ud83c\udfa4 [00:59:41] Congitive API Key and Endpoint",
    "chunk_id": 4,
    "timestamp_range": "00:59:59 \u2013 01:00:08",
    "key_concepts": [
      "To use Azure Cognitive Services programmatically, you create a Cognitive Service resource in Azure.",
      "This generates two API keys and an endpoint URL.",
      "These credentials are used for authentication when calling the various AI service APIs."
    ],
    "definitions": {
      "API Key": "A secret token used to authenticate requests to Azure Cognitive Services.",
      "Endpoint": "The URL address of the deployed Cognitive Service instance."
    },
    "key_facts": [
      "One API key and endpoint pair can be used for multiple Cognitive Service APIs under the same resource."
    ],
    "examples": [
      "After creating a Cognitive Service resource, you retrieve keys and endpoint from the Azure portal to integrate into your app."
    ],
    "exam_tips": [],
    "raw_markdown": "### \ud83c\udfa4 [00:59:41] Congitive API Key and Endpoint  \n**Timestamp**: 00:59:59 \u2013 01:00:08  \n\n**Key Concepts**  \n- To use Azure Cognitive Services programmatically, you create a Cognitive Service resource in Azure.  \n- This generates two API keys and an endpoint URL.  \n- These credentials are used for authentication when calling the various AI service APIs.  \n\n**Definitions**  \n- **API Key**: A secret token used to authenticate requests to Azure Cognitive Services.  \n- **Endpoint**: The URL address of the deployed Cognitive Service instance.  \n\n**Key Facts**  \n- One API key and endpoint pair can be used for multiple Cognitive Service APIs under the same resource.  \n\n**Examples**  \n- After creating a Cognitive Service resource, you retrieve keys and endpoint from the Azure portal to integrate into your app.  \n\n**Exam Tips \ud83c\udfaf**  \n- Remember that API keys and endpoints are essential for accessing Azure Cognitive Services APIs.  \n- Understand that these credentials are generated per Cognitive Service resource.  \n\n---\n\n"
  },
  {
    "section_title": "\ud83c\udfa4 [01:00:08] Knowledge Mining",
    "chunk_id": 4,
    "timestamp_range": "01:00:08 \u2013 01:04:43",
    "key_concepts": [
      "Knowledge mining uses AI services to extract insights from large volumes of structured and unstructured data.",
      "The process involves three main steps: Ingest, Enrich, and Explore.",
      "Ingest: Collect data from various sources (databases, CSVs, PDFs, images, audio, video).",
      "Enrich: Use AI capabilities (vision, language, speech, decision, search) to extract information and find patterns.",
      "Explore: Use search indexes and visualization tools (e.g., Power BI) to analyze and interact with the data."
    ],
    "definitions": {
      "Knowledge Mining": "The AI-driven process of extracting useful information and insights from diverse data sources."
    },
    "key_facts": [
      "Supports structured, semi-structured, and unstructured data.",
      "Uses connectors for first- and third-party data stores.",
      "Enables building search indexes to facilitate fast data retrieval."
    ],
    "examples": [
      "Content Research: Extract key phrases, perform printed text recognition, and create searchable libraries for technical documents.",
      "Audit Risk Compliance: Extract clauses, classify documents, detect GDPR risks, and automate translation for legal documents.",
      "Business Process Management: Use document processor AI and custom models for real-time decision making in industries like drilling.",
      "Customer Support: Quickly find answers and analyze customer sentiment at scale.",
      "Digital Asset Management: Tag images with metadata and enable fast search.",
      "Contract Management: Extract risk, key phrases, and organizational info from RFPs to improve bid accuracy."
    ],
    "exam_tips": [],
    "raw_markdown": "### \ud83c\udfa4 [01:00:08] Knowledge Mining  \n**Timestamp**: 01:00:08 \u2013 01:04:43  \n\n**Key Concepts**  \n- Knowledge mining uses AI services to extract insights from large volumes of structured and unstructured data.  \n- The process involves three main steps: Ingest, Enrich, and Explore.  \n- Ingest: Collect data from various sources (databases, CSVs, PDFs, images, audio, video).  \n- Enrich: Use AI capabilities (vision, language, speech, decision, search) to extract information and find patterns.  \n- Explore: Use search indexes and visualization tools (e.g., Power BI) to analyze and interact with the data.  \n\n**Definitions**  \n- **Knowledge Mining**: The AI-driven process of extracting useful information and insights from diverse data sources.  \n\n**Key Facts**  \n- Supports structured, semi-structured, and unstructured data.  \n- Uses connectors for first- and third-party data stores.  \n- Enables building search indexes to facilitate fast data retrieval.  \n\n**Examples**  \n- Content Research: Extract key phrases, perform printed text recognition, and create searchable libraries for technical documents.  \n- Audit Risk Compliance: Extract clauses, classify documents, detect GDPR risks, and automate translation for legal documents.  \n- Business Process Management: Use document processor AI and custom models for real-time decision making in industries like drilling.  \n- Customer Support: Quickly find answers and analyze customer sentiment at scale.  \n- Digital Asset Management: Tag images with metadata and enable fast search.  \n- Contract Management: Extract risk, key phrases, and organizational info from RFPs to improve bid accuracy.  \n\n**Exam Tips \ud83c\udfaf**  \n- Understand the three steps of knowledge mining: ingest, enrich, explore.  \n- Know common use cases like content research, compliance, customer support, and contract management.  \n- Recognize that knowledge mining leverages multiple Cognitive Services to avoid reinventing solutions.  \n\n---\n\n"
  },
  {
    "section_title": "\ud83c\udfa4 [01:04:42] Face Service",
    "chunk_id": 4,
    "timestamp_range": "01:04:43 \u2013 01:06:30",
    "key_concepts": [
      "Azure Face Service detects, recognizes, and analyzes human faces in images.",
      "Provides bounding boxes and unique IDs for each detected face.",
      "Supports face landmarks detection (up to 27 predefined points).",
      "Extracts face attributes such as age, gender, facial hair, glasses, makeup, emotion, head pose, occlusion, and whether the person is smiling.",
      "Can identify similar faces and match faces across a gallery."
    ],
    "definitions": {
      "Face Landmarks": "Specific points on a face (e.g., eyes, nose, mouth) used for detailed analysis.",
      "Face Attributes": "Characteristics detected on a face, including accessories, emotions, and image quality factors."
    },
    "key_facts": [
      "Unique face IDs can be used to track faces across multiple images.",
      "Attributes include Boolean values for smile detection and mask wearing.",
      "Can detect image quality issues like blurriness and noise."
    ],
    "examples": [
      "Detecting faces in a photo and drawing bounding boxes with unique IDs.",
      "Identifying if a person is wearing glasses or smiling."
    ],
    "exam_tips": [],
    "raw_markdown": "### \ud83c\udfa4 [01:04:42] Face Service  \n**Timestamp**: 01:04:43 \u2013 01:06:30  \n\n**Key Concepts**  \n- Azure Face Service detects, recognizes, and analyzes human faces in images.  \n- Provides bounding boxes and unique IDs for each detected face.  \n- Supports face landmarks detection (up to 27 predefined points).  \n- Extracts face attributes such as age, gender, facial hair, glasses, makeup, emotion, head pose, occlusion, and whether the person is smiling.  \n- Can identify similar faces and match faces across a gallery.  \n\n**Definitions**  \n- **Face Landmarks**: Specific points on a face (e.g., eyes, nose, mouth) used for detailed analysis.  \n- **Face Attributes**: Characteristics detected on a face, including accessories, emotions, and image quality factors.  \n\n**Key Facts**  \n- Unique face IDs can be used to track faces across multiple images.  \n- Attributes include Boolean values for smile detection and mask wearing.  \n- Can detect image quality issues like blurriness and noise.  \n\n**Examples**  \n- Detecting faces in a photo and drawing bounding boxes with unique IDs.  \n- Identifying if a person is wearing glasses or smiling.  \n\n**Exam Tips \ud83c\udfaf**  \n- Know the capabilities of Face Service: detection, recognition, landmarks, and attributes.  \n- Understand how unique IDs help in face matching across images.  \n\n---\n\n"
  },
  {
    "section_title": "\ud83c\udfa4 [01:06:30] Speech and Translate Service",
    "chunk_id": 4,
    "timestamp_range": "01:06:30 \u2013 01:08:04",
    "key_concepts": [
      "Azure Speech and Translate Service provides speech-to-text, text-to-speech, and speech translation capabilities.",
      "Supports over 90 languages and dialects, including fictional languages like Klingon.",
      "Uses Neural Machine Translation (NMT), which is more accurate than legacy Statistical Machine Translation (SMT).",
      "Supports custom translators to fine-tune translations for specific business domains.",
      "Speech service features include real-time and batch transcription, multi-device conversation transcription, custom speech models, speech synthesis markup language (SSML) for voice customization, voice assistants, speaker recognition, and verification."
    ],
    "definitions": {
      "Neural Machine Translation (NMT)": "A deep learning-based approach to language translation that improves accuracy over traditional statistical methods.",
      "Speech Synthesis Markup Language (SSML)": "A markup language used to control aspects of speech synthesis like pitch, rate, and pronunciation."
    },
    "key_facts": [
      "Speech-to-text supports real-time and batch processing.",
      "Text-to-speech can create lifelike custom voices.",
      "Speech translation integrates real-time speech translation into applications."
    ],
    "examples": [
      "Translating spoken language in real-time during a conversation.",
      "Creating a custom voice for a virtual assistant."
    ],
    "exam_tips": [],
    "raw_markdown": "### \ud83c\udfa4 [01:06:30] Speech and Translate Service  \n**Timestamp**: 01:06:30 \u2013 01:08:04  \n\n**Key Concepts**  \n- Azure Speech and Translate Service provides speech-to-text, text-to-speech, and speech translation capabilities.  \n- Supports over 90 languages and dialects, including fictional languages like Klingon.  \n- Uses Neural Machine Translation (NMT), which is more accurate than legacy Statistical Machine Translation (SMT).  \n- Supports custom translators to fine-tune translations for specific business domains.  \n- Speech service features include real-time and batch transcription, multi-device conversation transcription, custom speech models, speech synthesis markup language (SSML) for voice customization, voice assistants, speaker recognition, and verification.  \n\n**Definitions**  \n- **Neural Machine Translation (NMT)**: A deep learning-based approach to language translation that improves accuracy over traditional statistical methods.  \n- **Speech Synthesis Markup Language (SSML)**: A markup language used to control aspects of speech synthesis like pitch, rate, and pronunciation.  \n\n**Key Facts**  \n- Speech-to-text supports real-time and batch processing.  \n- Text-to-speech can create lifelike custom voices.  \n- Speech translation integrates real-time speech translation into applications.  \n\n**Examples**  \n- Translating spoken language in real-time during a conversation.  \n- Creating a custom voice for a virtual assistant.  \n\n**Exam Tips \ud83c\udfaf**  \n- Understand the difference between NMT and SMT in translation services.  \n- Know the main capabilities of Azure Speech Service: speech-to-text, text-to-speech, and speech translation.  \n- Be aware of customization options like custom translators and custom speech models.  \n\n---\n\n"
  },
  {
    "section_title": "\ud83c\udfa4 [01:08:04] Text Analytics",
    "chunk_id": 4,
    "timestamp_range": "01:08:04 \u2013 01:11:02",
    "key_concepts": [
      "Text Analytics is an NLP service for mining and analyzing text data.",
      "Provides sentiment analysis with labels: positive, neutral, negative.",
      "Opinion mining offers aspect-based sentiment analysis for granular insights.",
      "Key phrase extraction identifies main concepts in large text documents.",
      "Language detection identifies the language of input text.",
      "Named Entity Recognition (NER) detects and categorizes entities such as people, places, objects, and quantities.",
      "Specialized NER can detect Personally Identifiable Information (PII)."
    ],
    "definitions": {
      "Sentiment Analysis": "Classifying text based on emotional tone or attitude.",
      "Opinion Mining": "Aspect-based sentiment analysis that associates opinions with specific subjects.",
      "Named Entity Recognition (NER)": "Identifying and classifying key entities in text."
    },
    "key_facts": [
      "Key phrase extraction works best on larger documents (up to 5,000 characters).",
      "Sentiment analysis is more effective on smaller text snippets.",
      "Sentiment analysis provides confidence scores (0 to 1).",
      "Opinion mining can distinguish mixed sentiments within the same text.",
      "NER semantic types include diagnosis, medication, location, event, person, age, etc."
    ],
    "examples": [
      "Extracting key phrases like \"Borg ship Enterprise\" from a movie review.",
      "Detecting medical terms and categorizing them as diagnosis or medication.",
      "Opinion mining example: \"The room was great but the staff was unfriendly\" shows positive and negative sentiments."
    ],
    "exam_tips": [],
    "raw_markdown": "### \ud83c\udfa4 [01:08:04] Text Analytics  \n**Timestamp**: 01:08:04 \u2013 01:11:02  \n\n**Key Concepts**  \n- Text Analytics is an NLP service for mining and analyzing text data.  \n- Provides sentiment analysis with labels: positive, neutral, negative.  \n- Opinion mining offers aspect-based sentiment analysis for granular insights.  \n- Key phrase extraction identifies main concepts in large text documents.  \n- Language detection identifies the language of input text.  \n- Named Entity Recognition (NER) detects and categorizes entities such as people, places, objects, and quantities.  \n- Specialized NER can detect Personally Identifiable Information (PII).  \n\n**Definitions**  \n- **Sentiment Analysis**: Classifying text based on emotional tone or attitude.  \n- **Opinion Mining**: Aspect-based sentiment analysis that associates opinions with specific subjects.  \n- **Named Entity Recognition (NER)**: Identifying and classifying key entities in text.  \n\n**Key Facts**  \n- Key phrase extraction works best on larger documents (up to 5,000 characters).  \n- Sentiment analysis is more effective on smaller text snippets.  \n- Sentiment analysis provides confidence scores (0 to 1).  \n- Opinion mining can distinguish mixed sentiments within the same text.  \n- NER semantic types include diagnosis, medication, location, event, person, age, etc.  \n\n**Examples**  \n- Extracting key phrases like \"Borg ship Enterprise\" from a movie review.  \n- Detecting medical terms and categorizing them as diagnosis or medication.  \n- Opinion mining example: \"The room was great but the staff was unfriendly\" shows positive and negative sentiments.  \n\n**Exam Tips \ud83c\udfaf**  \n- Know the difference between sentiment analysis and opinion mining.  \n- Understand when to use key phrase extraction vs sentiment analysis.  \n- Be familiar with NER and its applications, including PII detection.  \n\n---\n\n"
  },
  {
    "section_title": "\ud83c\udfa4 [01:11:02] OCR Computer Vision",
    "chunk_id": 4,
    "timestamp_range": "01:11:02 \u2013 01:12:17",
    "key_concepts": [
      "Optical Character Recognition (OCR) extracts printed or handwritten text into digital, editable formats.",
      "Applicable to photos of signs, products, documents, invoices, bills, reports, articles, etc.",
      "Azure offers two OCR APIs: OCR API (older model) and Read API (newer model).",
      "OCR API supports images only, synchronous execution, more languages, easier to implement, suited for less text.",
      "Read API supports images and PDFs, asynchronous execution, faster line-by-line processing, suited for large text volumes, fewer languages, more complex implementation.",
      "Typically used via the Computer Vision SDK."
    ],
    "definitions": {
      "OCR": "Technology that converts different types of documents, such as scanned paper documents or images, into editable and searchable data."
    },
    "key_facts": [
      "OCR API is synchronous; Read API is asynchronous.",
      "Read API better for large documents and PDFs."
    ],
    "examples": [
      "Extracting nutritional facts from a food product label image."
    ],
    "exam_tips": [],
    "raw_markdown": "### \ud83c\udfa4 [01:11:02] OCR Computer Vision  \n**Timestamp**: 01:11:02 \u2013 01:12:17  \n\n**Key Concepts**  \n- Optical Character Recognition (OCR) extracts printed or handwritten text into digital, editable formats.  \n- Applicable to photos of signs, products, documents, invoices, bills, reports, articles, etc.  \n- Azure offers two OCR APIs: OCR API (older model) and Read API (newer model).  \n- OCR API supports images only, synchronous execution, more languages, easier to implement, suited for less text.  \n- Read API supports images and PDFs, asynchronous execution, faster line-by-line processing, suited for large text volumes, fewer languages, more complex implementation.  \n- Typically used via the Computer Vision SDK.  \n\n**Definitions**  \n- **OCR**: Technology that converts different types of documents, such as scanned paper documents or images, into editable and searchable data.  \n\n**Key Facts**  \n- OCR API is synchronous; Read API is asynchronous.  \n- Read API better for large documents and PDFs.  \n\n**Examples**  \n- Extracting nutritional facts from a food product label image.  \n\n**Exam Tips \ud83c\udfaf**  \n- Know the difference between OCR API and Read API in Azure.  \n- Understand when to use each based on document size and format.  \n- Be aware that OCR is part of the Computer Vision service.  \n\n---\n\n"
  },
  {
    "section_title": "\ud83c\udfa4 [01:12:22] Form Recognizer",
    "chunk_id": 4,
    "timestamp_range": "01:12:17 \u2013 01:12:17 (start only, content cut off)",
    "key_concepts": [
      "Form Recognizer is a specialized OCR service that converts printed text into digital, editable content while preserving the structure and relationships of form data.",
      "Used to automate data entry and enhance document search capabilities."
    ],
    "definitions": {
      "Form Recognizer": "Azure service that extracts text, key-value pairs, and tables from forms, maintaining their layout and relationships."
    },
    "key_facts": [
      "None fully detailed in this chunk (content cuts off)."
    ],
    "examples": [
      "None fully detailed in this chunk."
    ],
    "exam_tips": [],
    "raw_markdown": "### \ud83c\udfa4 [01:12:22] Form Recognizer  \n**Timestamp**: 01:12:17 \u2013 01:12:17 (start only, content cut off)  \n\n**Key Concepts**  \n- Form Recognizer is a specialized OCR service that converts printed text into digital, editable content while preserving the structure and relationships of form data.  \n- Used to automate data entry and enhance document search capabilities.  \n\n**Definitions**  \n- **Form Recognizer**: Azure service that extracts text, key-value pairs, and tables from forms, maintaining their layout and relationships.  \n\n**Key Facts**  \n- None fully detailed in this chunk (content cuts off).  \n\n**Examples**  \n- None fully detailed in this chunk.  \n\n**Exam Tips \ud83c\udfaf**  \n- Understand that Form Recognizer goes beyond basic OCR by preserving form structure.  \n- Know its primary use case is automating data extraction from forms."
  },
  {
    "section_title": "\ud83c\udfa4 [01:14:48] Form Recognizer",
    "chunk_id": 5,
    "timestamp_range": "01:12:49 \u2013 01:14:57",
    "key_concepts": [
      "Form Recognizer is a specialized OCR service that converts printed text into digital, editable content while preserving the structure and relationships of form-like data.",
      "It can identify key-value pairs, selection marks, table structures, bounding box coordinates, confidence scores, and relationships within documents.",
      "The service includes custom document processing models and pre-built models for invoices, receipts, IDs, and business cards.",
      "The layout model extracts text, selection marks, and table structures along with row and column numbers using high-definition optical character recognition.",
      "It automates data entry and enriches document search capabilities by preserving the original file\u2019s structure."
    ],
    "definitions": {
      "Form Recognizer": "An Azure Cognitive Service that extracts structured data from forms and documents, maintaining the relationships and layout of the original content."
    },
    "key_facts": [
      "Can output structured data including relationships, bounding boxes, and confidence scores.",
      "Supports custom document processing models and pre-built models for common document types."
    ],
    "examples": [
      "Extracting invoice data with magenta lines highlighting form-like data areas.",
      "Extracting tables and selection marks from scanned documents."
    ],
    "exam_tips": [],
    "raw_markdown": "### \ud83c\udfa4 [01:14:48] Form Recognizer  \n**Timestamp**: 01:12:49 \u2013 01:14:57\n\n**Key Concepts**  \n- Form Recognizer is a specialized OCR service that converts printed text into digital, editable content while preserving the structure and relationships of form-like data.  \n- It can identify key-value pairs, selection marks, table structures, bounding box coordinates, confidence scores, and relationships within documents.  \n- The service includes custom document processing models and pre-built models for invoices, receipts, IDs, and business cards.  \n- The layout model extracts text, selection marks, and table structures along with row and column numbers using high-definition optical character recognition.  \n- It automates data entry and enriches document search capabilities by preserving the original file\u2019s structure.\n\n**Definitions**  \n- **Form Recognizer**: An Azure Cognitive Service that extracts structured data from forms and documents, maintaining the relationships and layout of the original content.\n\n**Key Facts**  \n- Can output structured data including relationships, bounding boxes, and confidence scores.  \n- Supports custom document processing models and pre-built models for common document types.\n\n**Examples**  \n- Extracting invoice data with magenta lines highlighting form-like data areas.  \n- Extracting tables and selection marks from scanned documents.\n\n**Exam Tips \ud83c\udfaf**  \n- Understand that Form Recognizer is more than OCR; it preserves the structure and relationships in forms.  \n- Know the types of data it can extract: key-value pairs, tables, selection marks, and bounding boxes.\n\n---\n\n"
  },
  {
    "section_title": "\ud83c\udfa4 [01:14:57] Form Recognizer Custom Models",
    "chunk_id": 5,
    "timestamp_range": "01:14:57 \u2013 01:15:52",
    "key_concepts": [
      "Custom models allow extraction of text, key-value pairs, selection marks, and tabular data tailored to your specific forms.",
      "Custom models require training with your own data; only five sample forms are needed to start training.",
      "Trained models output structured data including relationships in the original document.",
      "Models can be tested and retrained to improve accuracy.",
      "Two learning options:"
    ],
    "definitions": {
      "Custom Models": "User-trained Form Recognizer models tailored to specific document types or layouts.",
      "Unsupervised Learning": "Learning layout and field relationships without labeled data.",
      "Supervised Learning": "Learning to extract specific values using labeled data."
    },
    "key_facts": [
      "Minimum of five sample forms needed to train a custom model.",
      "Supports retraining and testing to improve model accuracy."
    ],
    "examples": [
      "Training a model on a specific invoice format to extract custom fields."
    ],
    "exam_tips": [],
    "raw_markdown": "### \ud83c\udfa4 [01:14:57] Form Recognizer Custom Models  \n**Timestamp**: 01:14:57 \u2013 01:15:52\n\n**Key Concepts**  \n- Custom models allow extraction of text, key-value pairs, selection marks, and tabular data tailored to your specific forms.  \n- Custom models require training with your own data; only five sample forms are needed to start training.  \n- Trained models output structured data including relationships in the original document.  \n- Models can be tested and retrained to improve accuracy.  \n- Two learning options:  \n  - **Unsupervised learning**: Understands layout and relationships between fields without labeled data.  \n  - **Supervised learning**: Extracts specific values of interest using labeled forms.\n\n**Definitions**  \n- **Custom Models**: User-trained Form Recognizer models tailored to specific document types or layouts.  \n- **Unsupervised Learning**: Learning layout and field relationships without labeled data.  \n- **Supervised Learning**: Learning to extract specific values using labeled data.\n\n**Key Facts**  \n- Minimum of five sample forms needed to train a custom model.  \n- Supports retraining and testing to improve model accuracy.\n\n**Examples**  \n- Training a model on a specific invoice format to extract custom fields.\n\n**Exam Tips \ud83c\udfaf**  \n- Know the difference between supervised and unsupervised learning in Form Recognizer.  \n- Remember that custom models require sample data for training.\n\n---\n\n"
  },
  {
    "section_title": "\ud83c\udfa4 [01:15:34] Form Recognizer Prebuilt Models",
    "chunk_id": 5,
    "timestamp_range": "01:15:52 \u2013 01:17:17",
    "key_concepts": [
      "Prebuilt models are ready-to-use models for common document types: receipts, business cards, invoices, and IDs.",
      "These models extract predefined fields without requiring training.",
      "They support multiple countries and document formats depending on the model."
    ],
    "definitions": {
      "Prebuilt Models": "Out-of-the-box Form Recognizer models trained by Microsoft for common document types.",
      "Receipts": "Supported countries include Australia, Canada, Great Britain, India, and the United States. Extracted fields include receipt type, merchant name, phone, address, transaction date/time, total, subtotal, tax, tip, items (name, quantity, price, total price).",
      "Business Cards": "English only; extracts contact names, company, department, job titles, emails, websites, phone numbers (mobile, fax, work, others).",
      "Invoices": "Extracts customer name/ID, purchase order, invoice ID/date, due date, vendor/customer/billing/shipping addresses, subtotal, total, tax, invoice total, amount due, service/remittance addresses, service start/end dates, previous unpaid balance, line items (amount, description, quantity, unit price, product code, unit date, tax).",
      "IDs": "Supports passports, US driver licenses, etc. Extracted fields include country, region, DOB, expiration date, document name/type, nationality, sex, machine-readable zone, address, and region."
    },
    "key_facts": [
      "**Receipts**: Supported countries include Australia, Canada, Great Britain, India, and the United States. Extracted fields include receipt type, merchant name, phone, address, transaction date/time, total, subtotal, tax, tip, items (name, quantity, price, total price).",
      "**Business Cards**: English only; extracts contact names, company, department, job titles, emails, websites, phone numbers (mobile, fax, work, others).",
      "**Invoices**: Extracts customer name/ID, purchase order, invoice ID/date, due date, vendor/customer/billing/shipping addresses, subtotal, total, tax, invoice total, amount due, service/remittance addresses, service start/end dates, previous unpaid balance, line items (amount, description, quantity, unit price, product code, unit date, tax).",
      "**IDs**: Supports passports, US driver licenses, etc. Extracted fields include country, region, DOB, expiration date, document name/type, nationality, sex, machine-readable zone, address, and region."
    ],
    "examples": [
      "Extracting line items from invoices with detailed fields.",
      "Extracting contact details from English business cards."
    ],
    "exam_tips": [],
    "raw_markdown": "### \ud83c\udfa4 [01:15:34] Form Recognizer Prebuilt Models  \n**Timestamp**: 01:15:52 \u2013 01:17:17\n\n**Key Concepts**  \n- Prebuilt models are ready-to-use models for common document types: receipts, business cards, invoices, and IDs.  \n- These models extract predefined fields without requiring training.  \n- They support multiple countries and document formats depending on the model.\n\n**Definitions**  \n- **Prebuilt Models**: Out-of-the-box Form Recognizer models trained by Microsoft for common document types.\n\n**Key Facts**  \n- **Receipts**: Supported countries include Australia, Canada, Great Britain, India, and the United States. Extracted fields include receipt type, merchant name, phone, address, transaction date/time, total, subtotal, tax, tip, items (name, quantity, price, total price).  \n- **Business Cards**: English only; extracts contact names, company, department, job titles, emails, websites, phone numbers (mobile, fax, work, others).  \n- **Invoices**: Extracts customer name/ID, purchase order, invoice ID/date, due date, vendor/customer/billing/shipping addresses, subtotal, total, tax, invoice total, amount due, service/remittance addresses, service start/end dates, previous unpaid balance, line items (amount, description, quantity, unit price, product code, unit date, tax).  \n- **IDs**: Supports passports, US driver licenses, etc. Extracted fields include country, region, DOB, expiration date, document name/type, nationality, sex, machine-readable zone, address, and region.\n\n**Examples**  \n- Extracting line items from invoices with detailed fields.  \n- Extracting contact details from English business cards.\n\n**Exam Tips \ud83c\udfaf**  \n- Be familiar with the types of documents supported by prebuilt models and the key fields extracted.  \n- Know that prebuilt models require no training and are ready to use.\n\n---\n\n"
  },
  {
    "section_title": "\ud83c\udfa4 [01:17:33] LUIS",
    "chunk_id": 5,
    "timestamp_range": "01:17:17 \u2013 01:19:48",
    "key_concepts": [
      "LUIS (Language Understanding Intelligent Service) is a no-code ML service to build natural language understanding into apps, bots, and IoT devices.",
      "It provides enterprise-ready custom models that continuously improve.",
      "LUIS is accessed via its own isolated domain (luis.ai).",
      "Utilizes NLP (Natural Language Processing) and NLU (Natural Language Understanding) to transform user input into structured data focusing on user intent and entity extraction.",
      "A LUIS app schema defines:"
    ],
    "definitions": {
      "Intent": "The goal or action the user wants to perform.",
      "Entity": "Specific data or parameters extracted from the user\u2019s utterance.",
      "Utterance": "A sample user input used to train the model."
    },
    "key_facts": [
      "Intents classify user utterances; entities extract data from them.",
      "The schema is autogenerated but can be programmatically accessed for advanced use."
    ],
    "examples": [
      "Utterance example with entities: \"Book a flight from Seattle to Toronto\" where \"Seattle\" and \"Toronto\" are entities, and the intent is \"BookFlight.\""
    ],
    "exam_tips": [],
    "raw_markdown": "### \ud83c\udfa4 [01:17:33] LUIS  \n**Timestamp**: 01:17:17 \u2013 01:19:48\n\n**Key Concepts**  \n- LUIS (Language Understanding Intelligent Service) is a no-code ML service to build natural language understanding into apps, bots, and IoT devices.  \n- It provides enterprise-ready custom models that continuously improve.  \n- LUIS is accessed via its own isolated domain (luis.ai).  \n- Utilizes NLP (Natural Language Processing) and NLU (Natural Language Understanding) to transform user input into structured data focusing on user intent and entity extraction.  \n- A LUIS app schema defines:  \n  - **Intents**: What the user wants (actions).  \n  - **Entities**: Data extracted from user input relevant to the intent.  \n  - **Utterances**: Example user inputs labeled with intents and entities for training.  \n- Every LUIS app includes a **None** intent to handle irrelevant or unrecognized utterances.  \n- Recommended to have 15-30 example utterances per intent for effective training.\n\n**Definitions**  \n- **Intent**: The goal or action the user wants to perform.  \n- **Entity**: Specific data or parameters extracted from the user\u2019s utterance.  \n- **Utterance**: A sample user input used to train the model.\n\n**Key Facts**  \n- Intents classify user utterances; entities extract data from them.  \n- The schema is autogenerated but can be programmatically accessed for advanced use.\n\n**Examples**  \n- Utterance example with entities: \"Book a flight from Seattle to Toronto\" where \"Seattle\" and \"Toronto\" are entities, and the intent is \"BookFlight.\"\n\n**Exam Tips \ud83c\udfaf**  \n- Understand the difference between intents and entities.  \n- Know the purpose of the None intent.  \n- Remember the recommended number of example utterances for training.\n\n---\n\n"
  },
  {
    "section_title": "\ud83c\udfa4 [01:19:58] QnA Maker",
    "chunk_id": 5,
    "timestamp_range": "01:19:48 \u2013 01:24:19",
    "key_concepts": [
      "QnA Maker is a cloud-based NLP service to create a conversational layer over custom data.",
      "Hosted on its own isolated domain (qnamaker.ai).",
      "Helps find the most appropriate answer from a custom knowledge base built from documents like PDFs, URLs, and manuals.",
      "Commonly used to build chatbots, social apps, speech-enabled apps, and desktop applications.",
      "Does not store customer data outside the deployed region.",
      "Supports static information answering repeated questions with consistent answers.",
      "Supports metadata filtering to refine answers based on tags like content type, freshness, purpose, etc.",
      "Manages multi-turn conversations with follow-up prompts to handle complex dialogs.",
      "Imports content automatically extracting question-answer pairs using ML, including alternate question forms and metadata tags.",
      "Allows fine-tuning of imported Q&A pairs.",
      "Includes a chat box interface for testing and interacting with the bot.",
      "Chitchat feature provides prepopulated conversational responses for casual interactions.",
      "Uses layered ranking: Azure Search provides initial ranking, followed by QnA Maker\u2019s NLP reranking for final results and confidence scores.",
      "Active learning suggests improvements to the knowledge base based on user interactions."
    ],
    "definitions": {
      "QnA Maker": "Azure service to build a question-answer conversational layer from custom documents.",
      "Multi-turn Conversation": "Handling follow-up questions and context across multiple dialog turns.",
      "Chitchat": "Prebuilt casual conversation responses to handle informal user inputs."
    },
    "key_facts": [
      "Supports importing from DOCX, PDF, and URLs.",
      "Metadata tags help filter and refine answers.",
      "Multi-turn conversations enable complex dialog flows.",
      "Active learning improves the knowledge base over time."
    ],
    "examples": [
      "Bot answering repeated questions with consistent answers.",
      "Multi-turn example: User asks a generic question, bot asks clarifying follow-up questions."
    ],
    "exam_tips": [],
    "raw_markdown": "### \ud83c\udfa4 [01:19:58] QnA Maker  \n**Timestamp**: 01:19:48 \u2013 01:24:19\n\n**Key Concepts**  \n- QnA Maker is a cloud-based NLP service to create a conversational layer over custom data.  \n- Hosted on its own isolated domain (qnamaker.ai).  \n- Helps find the most appropriate answer from a custom knowledge base built from documents like PDFs, URLs, and manuals.  \n- Commonly used to build chatbots, social apps, speech-enabled apps, and desktop applications.  \n- Does not store customer data outside the deployed region.  \n- Supports static information answering repeated questions with consistent answers.  \n- Supports metadata filtering to refine answers based on tags like content type, freshness, purpose, etc.  \n- Manages multi-turn conversations with follow-up prompts to handle complex dialogs.  \n- Imports content automatically extracting question-answer pairs using ML, including alternate question forms and metadata tags.  \n- Allows fine-tuning of imported Q&A pairs.  \n- Includes a chat box interface for testing and interacting with the bot.  \n- Chitchat feature provides prepopulated conversational responses for casual interactions.  \n- Uses layered ranking: Azure Search provides initial ranking, followed by QnA Maker\u2019s NLP reranking for final results and confidence scores.  \n- Active learning suggests improvements to the knowledge base based on user interactions.\n\n**Definitions**  \n- **QnA Maker**: Azure service to build a question-answer conversational layer from custom documents.  \n- **Multi-turn Conversation**: Handling follow-up questions and context across multiple dialog turns.  \n- **Chitchat**: Prebuilt casual conversation responses to handle informal user inputs.\n\n**Key Facts**  \n- Supports importing from DOCX, PDF, and URLs.  \n- Metadata tags help filter and refine answers.  \n- Multi-turn conversations enable complex dialog flows.  \n- Active learning improves the knowledge base over time.\n\n**Examples**  \n- Bot answering repeated questions with consistent answers.  \n- Multi-turn example: User asks a generic question, bot asks clarifying follow-up questions.\n\n**Exam Tips \ud83c\udfaf**  \n- Know the purpose and capabilities of QnA Maker.  \n- Understand multi-turn conversation and chitchat features.  \n- Remember that QnA Maker builds knowledge bases from documents automatically extracting Q&A pairs.\n\n---\n\n"
  },
  {
    "section_title": "\ud83c\udfa4 [01:24:19] Azure Bot Service",
    "chunk_id": 5,
    "timestamp_range": "01:24:19 \u2013 01:26:45",
    "key_concepts": [
      "Azure Bot Service is an intelligent, scalable service for creating, publishing, and managing bots.",
      "Bots can be registered and published via the Azure portal.",
      "Supports integration with multiple channels including Direct Line, Alexa, Office 365, Facebook, Kik, Line, Microsoft Teams, Skype, Twilio, and more.",
      "Commonly associated with Bot Framework SDK and Bot Framework Composer.",
      "**Bot Framework SDK (v4)**: Open-source SDK for building sophisticated conversational bots supporting speech, natural language understanding, Q&A, and more.",
      "Provides end-to-end workflow: design, build, test, publish, connect, and evaluate bots.",
      "Includes tools, templates, and AI services integration.",
      "**Bot Framework Composer**: Open-source IDE built on top of the SDK for authoring, testing, provisioning, and managing conversational experiences.",
      "Composer supports Windows, macOS, and Linux.",
      "Features include template bots (QnA Maker bot, Enterprise assistant, language bot, calendar bot, people bot), testing/debugging with Bot Framework Emulator, and built-in package management.",
      "Bots can be deployed to Azure Web Apps or Azure Functions."
    ],
    "definitions": {
      "Bot Framework SDK (v4)": "Open-source SDK for building sophisticated conversational bots supporting speech, natural language understanding, Q&A, and more.",
      "Bot Framework Composer": "Visual IDE for bot development and management.",
      "Azure Bot Service": "Managed service for bot lifecycle management and scaling.",
      "Bot Framework SDK": "Developer toolkit for building conversational bots."
    },
    "key_facts": [
      "Supports multiple communication channels.",
      "Composer is cross-platform and open source.",
      "SDK version 4 is current and open source."
    ],
    "examples": [
      "Using Bot Framework Composer to build a QnA Maker bot.",
      "Deploying bots to Azure Web Apps or Functions."
    ],
    "exam_tips": [],
    "raw_markdown": "### \ud83c\udfa4 [01:24:19] Azure Bot Service  \n**Timestamp**: 01:24:19 \u2013 01:26:45\n\n**Key Concepts**  \n- Azure Bot Service is an intelligent, scalable service for creating, publishing, and managing bots.  \n- Bots can be registered and published via the Azure portal.  \n- Supports integration with multiple channels including Direct Line, Alexa, Office 365, Facebook, Kik, Line, Microsoft Teams, Skype, Twilio, and more.  \n- Commonly associated with Bot Framework SDK and Bot Framework Composer.  \n- **Bot Framework SDK (v4)**: Open-source SDK for building sophisticated conversational bots supporting speech, natural language understanding, Q&A, and more.  \n- Provides end-to-end workflow: design, build, test, publish, connect, and evaluate bots.  \n- Includes tools, templates, and AI services integration.  \n- **Bot Framework Composer**: Open-source IDE built on top of the SDK for authoring, testing, provisioning, and managing conversational experiences.  \n- Composer supports Windows, macOS, and Linux.  \n- Features include template bots (QnA Maker bot, Enterprise assistant, language bot, calendar bot, people bot), testing/debugging with Bot Framework Emulator, and built-in package management.  \n- Bots can be deployed to Azure Web Apps or Azure Functions.\n\n**Definitions**  \n- **Azure Bot Service**: Managed service for bot lifecycle management and scaling.  \n- **Bot Framework SDK**: Developer toolkit for building conversational bots.  \n- **Bot Framework Composer**: Visual IDE for bot development and management.\n\n**Key Facts**  \n- Supports multiple communication channels.  \n- Composer is cross-platform and open source.  \n- SDK version 4 is current and open source.\n\n**Examples**  \n- Using Bot Framework Composer to build a QnA Maker bot.  \n- Deploying bots to Azure Web Apps or Functions.\n\n**Exam Tips \ud83c\udfaf**  \n- Know the relationship between Azure Bot Service, Bot Framework SDK, and Bot Framework Composer.  \n- Understand the multi-channel integration capability.  \n- Remember Composer is a no-code/low-code IDE for bot development.\n\n---\n\n"
  },
  {
    "section_title": "\ud83c\udfa4 [01:26:45] Azure Machine Learning Service",
    "chunk_id": 5,
    "timestamp_range": "01:26:45 \u2013 01:30:47",
    "key_concepts": [
      "Azure Machine Learning Service is the modern, fully featured service for running AI/ML workloads on Azure.",
      "The classic version exists but is deprecated and not exam relevant.",
      "The service simplifies building, training, and deploying ML models including automated ML pipelines and deep learning workloads (e.g., TensorFlow).",
      "Supports Jupyter notebooks for model development and documentation.",
      "Provides an SDK for Python to interact with the service.",
      "Supports ML Ops for end-to-end automation of ML pipelines including CI/CD, training, and inference.",
      "Includes Azure Machine Learning Designer, a drag-and-drop interface for visually building ML pipelines.",
      "Offers data labeling services with human-in-the-loop and ML-assisted labeling for supervised learning.",
      "Supports responsible ML practices including fairness metrics and mitigation (though currently limited).",
      "Azure Machine Learning Studio UI includes:"
    ],
    "definitions": {
      "Azure Machine Learning Service": "Cloud service for building, training, and deploying ML models with full lifecycle management.",
      "ML Ops": "Practices for automating ML workflows including CI/CD for models.",
      "Designer": "Visual drag-and-drop tool for building ML pipelines."
    },
    "key_facts": [
      "Classic ML service is deprecated and not exam relevant.",
      "AutoML supports only three model types.",
      "Compute categories include:"
    ],
    "examples": [
      "Using notebooks to build and document ML models.",
      "Creating data labeling jobs with human-in-the-loop or ML-assisted labeling."
    ],
    "exam_tips": [],
    "raw_markdown": "### \ud83c\udfa4 [01:26:45] Azure Machine Learning Service  \n**Timestamp**: 01:26:45 \u2013 01:30:47\n\n**Key Concepts**  \n- Azure Machine Learning Service is the modern, fully featured service for running AI/ML workloads on Azure.  \n- The classic version exists but is deprecated and not exam relevant.  \n- The service simplifies building, training, and deploying ML models including automated ML pipelines and deep learning workloads (e.g., TensorFlow).  \n- Supports Jupyter notebooks for model development and documentation.  \n- Provides an SDK for Python to interact with the service.  \n- Supports ML Ops for end-to-end automation of ML pipelines including CI/CD, training, and inference.  \n- Includes Azure Machine Learning Designer, a drag-and-drop interface for visually building ML pipelines.  \n- Offers data labeling services with human-in-the-loop and ML-assisted labeling for supervised learning.  \n- Supports responsible ML practices including fairness metrics and mitigation (though currently limited).  \n- Azure Machine Learning Studio UI includes:  \n  - Notebooks (Jupyter) for authoring code.  \n  - Automated ML (AutoML) for automated model building (limited to 3 model types).  \n  - Designer for drag-and-drop pipeline creation.  \n  - Datasets for data upload and management.  \n  - Experiments to track training jobs.  \n  - Pipelines for ML workflows.  \n  - Model registry for storing trained models.  \n  - Endpoints for deploying models as REST APIs.  \n  - Compute resources for development, training, and inference.  \n  - Data stores for data repositories.  \n  - Data labeling for supervised learning preparation.  \n  - Linked services to connect external Azure resources (e.g., Synapse Analytics).\n\n**Definitions**  \n- **Azure Machine Learning Service**: Cloud service for building, training, and deploying ML models with full lifecycle management.  \n- **ML Ops**: Practices for automating ML workflows including CI/CD for models.  \n- **Designer**: Visual drag-and-drop tool for building ML pipelines.\n\n**Key Facts**  \n- Classic ML service is deprecated and not exam relevant.  \n- AutoML supports only three model types.  \n- Compute categories include:  \n  - Compute instances (development workstations).  \n  - Compute clusters (scalable VM clusters for training).  \n  - Deployment targets (for inference).  \n  - Attached compute (existing Azure compute resources).  \n- Development environments supported include Jupyter Labs, VS Code, R Studio, and terminal within the studio.  \n- Inference typically uses Azure Kubernetes Service or Azure Container Instances (not clearly listed in compute options).\n\n**Examples**  \n- Using notebooks to build and document ML models.  \n- Creating data labeling jobs with human-in-the-loop or ML-assisted labeling.\n\n**Exam Tips \ud83c\udfaf**  \n- Focus on the new Azure Machine Learning Service, not the classic version.  \n- Know the main components of the Azure ML Studio interface and their purposes.  \n- Understand the types of compute resources and their roles.  \n- Be aware of data labeling options and their importance for supervised learning."
  },
  {
    "section_title": "\ud83c\udfa4 [01:31:45] Data Stores",
    "chunk_id": 6,
    "timestamp_range": "01:31:43 \u2013 01:32:45",
    "key_concepts": [
      "Azure ML Data Store securely connects Azure Machine Learning to various Azure storage services without exposing authentication credentials or risking data integrity.",
      "Data Stores act as abstractions over storage services to simplify data access for ML workloads."
    ],
    "definitions": {
      "Azure Blob Storage": "Object storage for unstructured data distributed across many machines.",
      "Azure File Share": "Mountable file share accessible via SMB and NFS protocols.",
      "Azure Data Lake Storage Gen2": "Blob storage optimized for big data analytics.",
      "Azure SQL": "Fully managed Microsoft SQL Server relational database.",
      "Azure PostgreSQL": "Open source relational database, often considered object-relational, preferred by developers.",
      "Azure MySQL": "Popular open source pure relational database."
    },
    "key_facts": [
      "Data Stores enable secure, credential-free access to data sources for Azure ML.",
      "Multiple storage types supported to accommodate different data needs and formats."
    ],
    "examples": [
      "Using Azure Blob Storage for storing images or datasets for training.",
      "Mounting Azure File Share for shared file access in ML experiments."
    ],
    "exam_tips": [],
    "raw_markdown": "### \ud83c\udfa4 [01:31:45] Data Stores  \n**Timestamp**: 01:31:43 \u2013 01:32:45\n\n**Key Concepts**  \n- Azure ML Data Store securely connects Azure Machine Learning to various Azure storage services without exposing authentication credentials or risking data integrity.  \n- Data Stores act as abstractions over storage services to simplify data access for ML workloads.\n\n**Definitions**  \n- **Azure Blob Storage**: Object storage for unstructured data distributed across many machines.  \n- **Azure File Share**: Mountable file share accessible via SMB and NFS protocols.  \n- **Azure Data Lake Storage Gen2**: Blob storage optimized for big data analytics.  \n- **Azure SQL**: Fully managed Microsoft SQL Server relational database.  \n- **Azure PostgreSQL**: Open source relational database, often considered object-relational, preferred by developers.  \n- **Azure MySQL**: Popular open source pure relational database.\n\n**Key Facts**  \n- Data Stores enable secure, credential-free access to data sources for Azure ML.  \n- Multiple storage types supported to accommodate different data needs and formats.\n\n**Examples**  \n- Using Azure Blob Storage for storing images or datasets for training.  \n- Mounting Azure File Share for shared file access in ML experiments.\n\n**Exam Tips \ud83c\udfaf**  \n- Know the types of Azure storage services supported by Azure ML Data Stores.  \n- Understand that Data Stores abstract storage access securely without exposing credentials.\n\n---\n\n"
  },
  {
    "section_title": "\ud83c\udfa4 [01:32:34] Datasets",
    "chunk_id": 6,
    "timestamp_range": "01:32:45 \u2013 01:33:37",
    "key_concepts": [
      "Azure ML Datasets simplify registering and managing data for ML workloads.",
      "Datasets include metadata and support versioning (current and latest versions).",
      "Sample code is available via Azure ML SDK to import datasets into Jupyter notebooks.",
      "Dataset profiling generates summary statistics and data distribution insights.",
      "Open Datasets are curated, publicly available datasets for learning and experimentation."
    ],
    "definitions": {
      "Dataset Profile": "A generated report providing statistics and data distribution to understand dataset characteristics.",
      "Open Datasets": "Publicly hosted datasets curated for ML learning and experimentation."
    },
    "key_facts": [
      "Dataset profiles require a compute instance to generate.",
      "Open datasets like MNIST and COCO are commonly used for ML practice.",
      "Multiple dataset versions can be maintained for iterative model training."
    ],
    "examples": [
      "Using MNIST dataset for digit recognition experiments.",
      "Generating a profile to check data distribution before training."
    ],
    "exam_tips": [],
    "raw_markdown": "### \ud83c\udfa4 [01:32:34] Datasets  \n**Timestamp**: 01:32:45 \u2013 01:33:37\n\n**Key Concepts**  \n- Azure ML Datasets simplify registering and managing data for ML workloads.  \n- Datasets include metadata and support versioning (current and latest versions).  \n- Sample code is available via Azure ML SDK to import datasets into Jupyter notebooks.  \n- Dataset profiling generates summary statistics and data distribution insights.  \n- Open Datasets are curated, publicly available datasets for learning and experimentation.\n\n**Definitions**  \n- **Dataset Profile**: A generated report providing statistics and data distribution to understand dataset characteristics.  \n- **Open Datasets**: Publicly hosted datasets curated for ML learning and experimentation.\n\n**Key Facts**  \n- Dataset profiles require a compute instance to generate.  \n- Open datasets like MNIST and COCO are commonly used for ML practice.  \n- Multiple dataset versions can be maintained for iterative model training.\n\n**Examples**  \n- Using MNIST dataset for digit recognition experiments.  \n- Generating a profile to check data distribution before training.\n\n**Exam Tips \ud83c\udfaf**  \n- Understand the purpose of dataset registration and versioning in Azure ML.  \n- Know that dataset profiling helps in exploratory data analysis.  \n- Be aware of open datasets as a resource for ML model training and testing.\n\n---\n\n"
  },
  {
    "section_title": "\ud83c\udfa4 [01:33:44] Experiments",
    "chunk_id": 6,
    "timestamp_range": "01:33:37 \u2013 01:34:08",
    "key_concepts": [
      "Azure ML Experiments logically group ML runs (executions of ML tasks).",
      "Runs represent execution of tasks like preprocessing, AutoML, or training pipelines.",
      "Inference (model deployment and prediction) is not tracked under experiments."
    ],
    "definitions": {
      "Run": "An execution instance of an ML task on a compute resource (VM or container).",
      "Experiment": "A logical container grouping related runs."
    },
    "key_facts": [
      "Experiments track training and pipeline runs but exclude inference calls.",
      "Runs can be scripts, AutoML jobs, or pipeline executions."
    ],
    "examples": [
      "Running a training script as a run within an experiment.",
      "Grouping multiple training runs under one experiment for comparison."
    ],
    "exam_tips": [],
    "raw_markdown": "### \ud83c\udfa4 [01:33:44] Experiments  \n**Timestamp**: 01:33:37 \u2013 01:34:08\n\n**Key Concepts**  \n- Azure ML Experiments logically group ML runs (executions of ML tasks).  \n- Runs represent execution of tasks like preprocessing, AutoML, or training pipelines.  \n- Inference (model deployment and prediction) is not tracked under experiments.\n\n**Definitions**  \n- **Run**: An execution instance of an ML task on a compute resource (VM or container).  \n- **Experiment**: A logical container grouping related runs.\n\n**Key Facts**  \n- Experiments track training and pipeline runs but exclude inference calls.  \n- Runs can be scripts, AutoML jobs, or pipeline executions.\n\n**Examples**  \n- Running a training script as a run within an experiment.  \n- Grouping multiple training runs under one experiment for comparison.\n\n**Exam Tips \ud83c\udfaf**  \n- Know that experiments organize and track training runs, not inference.  \n- Understand the difference between runs and experiments in Azure ML.\n\n---\n\n"
  },
  {
    "section_title": "\ud83c\udfa4 [01:34:16] Pipelines",
    "chunk_id": 6,
    "timestamp_range": "01:34:08 \u2013 01:36:10",
    "key_concepts": [
      "Azure ML Pipelines are executable workflows for complete ML tasks (training, preprocessing, etc.).",
      "Pipelines are distinct from Azure DevOps or Data Factory pipelines.",
      "Pipelines consist of independent steps (sub-pipelines) allowing parallel work and resource optimization.",
      "Steps can use different compute resources and only rerun if updated.",
      "Pipelines can be published and exposed as REST endpoints for rerunning from any platform.",
      "Pipelines can be built visually with Azure ML Designer or programmatically via Python SDK."
    ],
    "definitions": {
      "Pipeline Step": "An independent task within a pipeline (e.g., data preprocessing, model training).",
      "Pipeline Endpoint": "REST endpoint to trigger pipeline execution remotely."
    },
    "key_facts": [
      "Rerunning a pipeline skips unchanged steps to save compute.",
      "Pipeline endpoints support parameterization for batch scoring and retraining.",
      "Azure ML Designer provides a no-code visual interface for pipeline creation."
    ],
    "examples": [
      "Creating a pipeline with steps for data cleaning, feature engineering, and model training.",
      "Publishing a pipeline and invoking it via REST API for automated retraining."
    ],
    "exam_tips": [],
    "raw_markdown": "### \ud83c\udfa4 [01:34:16] Pipelines  \n**Timestamp**: 01:34:08 \u2013 01:36:10\n\n**Key Concepts**  \n- Azure ML Pipelines are executable workflows for complete ML tasks (training, preprocessing, etc.).  \n- Pipelines are distinct from Azure DevOps or Data Factory pipelines.  \n- Pipelines consist of independent steps (sub-pipelines) allowing parallel work and resource optimization.  \n- Steps can use different compute resources and only rerun if updated.  \n- Pipelines can be published and exposed as REST endpoints for rerunning from any platform.  \n- Pipelines can be built visually with Azure ML Designer or programmatically via Python SDK.\n\n**Definitions**  \n- **Pipeline Step**: An independent task within a pipeline (e.g., data preprocessing, model training).  \n- **Pipeline Endpoint**: REST endpoint to trigger pipeline execution remotely.\n\n**Key Facts**  \n- Rerunning a pipeline skips unchanged steps to save compute.  \n- Pipeline endpoints support parameterization for batch scoring and retraining.  \n- Azure ML Designer provides a no-code visual interface for pipeline creation.\n\n**Examples**  \n- Creating a pipeline with steps for data cleaning, feature engineering, and model training.  \n- Publishing a pipeline and invoking it via REST API for automated retraining.\n\n**Exam Tips \ud83c\udfaf**  \n- Understand the purpose and structure of Azure ML Pipelines.  \n- Know the difference between Azure ML Pipelines and Azure DevOps/Data Factory pipelines.  \n- Be aware of pipeline reuse and step skipping on reruns.\n\n---\n\n"
  },
  {
    "section_title": "\ud83c\udfa4 [01:35:23] ML Designer",
    "chunk_id": 6,
    "timestamp_range": "01:35:06 \u2013 01:36:10",
    "key_concepts": [
      "Azure ML Designer is a drag-and-drop visual tool to build ML pipelines without coding.",
      "Provides pre-built assets/components to quickly assemble workflows.",
      "Requires understanding of end-to-end ML pipeline concepts to use effectively.",
      "Supports creating inference pipelines toggling between real-time and batch modes."
    ],
    "definitions": {
      "Inference Pipeline": "Pipeline configured for deploying models to make predictions (real-time or batch)."
    },
    "key_facts": [
      "Visual interface accelerates pipeline creation for users less familiar with coding.",
      "Can toggle inference pipeline modes after creation."
    ],
    "examples": [
      "Dragging data input, transformation, and training modules to build a pipeline.",
      "Switching inference pipeline from batch scoring to real-time endpoint."
    ],
    "exam_tips": [],
    "raw_markdown": "### \ud83c\udfa4 [01:35:23] ML Designer  \n**Timestamp**: 01:35:06 \u2013 01:36:10\n\n**Key Concepts**  \n- Azure ML Designer is a drag-and-drop visual tool to build ML pipelines without coding.  \n- Provides pre-built assets/components to quickly assemble workflows.  \n- Requires understanding of end-to-end ML pipeline concepts to use effectively.  \n- Supports creating inference pipelines toggling between real-time and batch modes.\n\n**Definitions**  \n- **Inference Pipeline**: Pipeline configured for deploying models to make predictions (real-time or batch).\n\n**Key Facts**  \n- Visual interface accelerates pipeline creation for users less familiar with coding.  \n- Can toggle inference pipeline modes after creation.\n\n**Examples**  \n- Dragging data input, transformation, and training modules to build a pipeline.  \n- Switching inference pipeline from batch scoring to real-time endpoint.\n\n**Exam Tips \ud83c\udfaf**  \n- Know that ML Designer is a no-code alternative to Python SDK for pipeline creation.  \n- Understand the difference between training and inference pipelines.\n\n---\n\n"
  },
  {
    "section_title": "\ud83c\udfa4 [01:36:07] Model Registry",
    "chunk_id": 6,
    "timestamp_range": "01:36:10 \u2013 01:36:41",
    "key_concepts": [
      "Azure ML Model Registry manages registered models and tracks versions under the same model name.",
      "Supports metadata tagging for easier search and management.",
      "Facilitates sharing, deployment, and downloading of models."
    ],
    "definitions": {
      "Model Registry": "Central repository for managing ML models and their versions."
    },
    "key_facts": [
      "Registering a model with an existing name creates a new version.",
      "Metadata tags improve model discoverability."
    ],
    "examples": [
      "Registering version 1 and version 2 of a fraud detection model.",
      "Searching models by tags like \"image-classification\" or \"production-ready\"."
    ],
    "exam_tips": [],
    "raw_markdown": "### \ud83c\udfa4 [01:36:07] Model Registry  \n**Timestamp**: 01:36:10 \u2013 01:36:41\n\n**Key Concepts**  \n- Azure ML Model Registry manages registered models and tracks versions under the same model name.  \n- Supports metadata tagging for easier search and management.  \n- Facilitates sharing, deployment, and downloading of models.\n\n**Definitions**  \n- **Model Registry**: Central repository for managing ML models and their versions.\n\n**Key Facts**  \n- Registering a model with an existing name creates a new version.  \n- Metadata tags improve model discoverability.\n\n**Examples**  \n- Registering version 1 and version 2 of a fraud detection model.  \n- Searching models by tags like \"image-classification\" or \"production-ready\".\n\n**Exam Tips \ud83c\udfaf**  \n- Understand the purpose of the model registry in version control and model lifecycle management.\n\n---\n\n"
  },
  {
    "section_title": "\ud83c\udfa4 [01:36:34] Endpoints",
    "chunk_id": 6,
    "timestamp_range": "01:36:41 \u2013 01:37:50",
    "key_concepts": [
      "Azure ML Endpoints deploy ML models as web services for real-time or batch inference.",
      "Deployment workflow: register model \u2192 prepare entry script \u2192 prepare inference config \u2192 deploy locally \u2192 choose compute target \u2192 deploy to cloud \u2192 test service.",
      "Two endpoint types:"
    ],
    "definitions": {
      "Real-time Endpoint": "Web service providing immediate model inference.",
      "Pipeline Endpoint": "REST endpoint to invoke ML pipelines with parameterization."
    },
    "key_facts": [
      "Deployed endpoints appear under AKS or ACI resources in Azure Portal, not consolidated in ML Studio.",
      "Testing supports CSV batch input or single request formats."
    ],
    "examples": [
      "Deploying a model to AKS for real-time fraud detection.",
      "Sending batch CSV data to test endpoint predictions."
    ],
    "exam_tips": [],
    "raw_markdown": "### \ud83c\udfa4 [01:36:34] Endpoints  \n**Timestamp**: 01:36:41 \u2013 01:37:50\n\n**Key Concepts**  \n- Azure ML Endpoints deploy ML models as web services for real-time or batch inference.  \n- Deployment workflow: register model \u2192 prepare entry script \u2192 prepare inference config \u2192 deploy locally \u2192 choose compute target \u2192 deploy to cloud \u2192 test service.  \n- Two endpoint types:  \n  - Real-time endpoints (hosted on Azure Kubernetes Service (AKS) or Azure Container Instances (ACI))  \n  - Pipeline endpoints (invoke entire ML pipelines remotely).  \n- Real-time endpoints can be tested with single or batch requests via UI.\n\n**Definitions**  \n- **Real-time Endpoint**: Web service providing immediate model inference.  \n- **Pipeline Endpoint**: REST endpoint to invoke ML pipelines with parameterization.\n\n**Key Facts**  \n- Deployed endpoints appear under AKS or ACI resources in Azure Portal, not consolidated in ML Studio.  \n- Testing supports CSV batch input or single request formats.\n\n**Examples**  \n- Deploying a model to AKS for real-time fraud detection.  \n- Sending batch CSV data to test endpoint predictions.\n\n**Exam Tips \ud83c\udfaf**  \n- Know the two types of endpoints and their use cases.  \n- Understand the deployment and testing workflow for ML models.\n\n---\n\n"
  },
  {
    "section_title": "\ud83c\udfa4 [01:37:50] Notebooks",
    "chunk_id": 6,
    "timestamp_range": "01:37:50 \u2013 01:38:35",
    "key_concepts": [
      "Azure ML Studio includes a built-in Jupyter-like notebook editor for building and training ML models.",
      "Users select compute instances and kernels (programming languages and libraries) to run notebooks.",
      "Notebooks can be opened in familiar environments like VS Code, classic Jupyter Notebook, or Jupyter Lab for enhanced experience."
    ],
    "definitions": {
      "Kernel": "Programming language environment and libraries loaded for notebook execution."
    },
    "key_facts": [
      "VS Code integration provides the same experience as Azure ML Studio notebooks.",
      "Multiple notebook environments supported for user preference."
    ],
    "examples": [
      "Running Python ML training scripts in Azure ML notebooks.",
      "Opening notebooks in VS Code for debugging."
    ],
    "exam_tips": [],
    "raw_markdown": "### \ud83c\udfa4 [01:37:50] Notebooks  \n**Timestamp**: 01:37:50 \u2013 01:38:35\n\n**Key Concepts**  \n- Azure ML Studio includes a built-in Jupyter-like notebook editor for building and training ML models.  \n- Users select compute instances and kernels (programming languages and libraries) to run notebooks.  \n- Notebooks can be opened in familiar environments like VS Code, classic Jupyter Notebook, or Jupyter Lab for enhanced experience.\n\n**Definitions**  \n- **Kernel**: Programming language environment and libraries loaded for notebook execution.\n\n**Key Facts**  \n- VS Code integration provides the same experience as Azure ML Studio notebooks.  \n- Multiple notebook environments supported for user preference.\n\n**Examples**  \n- Running Python ML training scripts in Azure ML notebooks.  \n- Opening notebooks in VS Code for debugging.\n\n**Exam Tips \ud83c\udfaf**  \n- Be aware of notebook options and kernel selection in Azure ML Studio.  \n- Understand notebooks are a key tool for interactive ML development.\n\n---\n\n"
  },
  {
    "section_title": "\ud83c\udfa4 [01:38:41] Introduction to AutoML",
    "chunk_id": 6,
    "timestamp_range": "01:38:35 \u2013 01:39:29",
    "key_concepts": [
      "Azure Automated Machine Learning (AutoML) automates model creation by training and tuning models based on supplied datasets and task types.",
      "Supported task types include classification, regression, and time series forecasting."
    ],
    "definitions": {
      "AutoML": "Automated process of selecting, training, and tuning ML models with minimal manual intervention."
    },
    "key_facts": [
      "AutoML simplifies ML model development for users with less expertise.",
      "Task types guide AutoML on the kind of prediction problem to solve."
    ],
    "examples": [
      "Using AutoML to train a binary classification model for fraud detection.",
      "Applying AutoML for time series forecasting of sales data."
    ],
    "exam_tips": [],
    "raw_markdown": "### \ud83c\udfa4 [01:38:41] Introduction to AutoML  \n**Timestamp**: 01:38:35 \u2013 01:39:29\n\n**Key Concepts**  \n- Azure Automated Machine Learning (AutoML) automates model creation by training and tuning models based on supplied datasets and task types.  \n- Supported task types include classification, regression, and time series forecasting.\n\n**Definitions**  \n- **AutoML**: Automated process of selecting, training, and tuning ML models with minimal manual intervention.\n\n**Key Facts**  \n- AutoML simplifies ML model development for users with less expertise.  \n- Task types guide AutoML on the kind of prediction problem to solve.\n\n**Examples**  \n- Using AutoML to train a binary classification model for fraud detection.  \n- Applying AutoML for time series forecasting of sales data.\n\n**Exam Tips \ud83c\udfaf**  \n- Know the main task types supported by Azure AutoML.  \n- Understand AutoML\u2019s role in simplifying model training and tuning.\n\n---\n\n"
  },
  {
    "section_title": "\ud83c\udfa4 [01:39:29] Classification",
    "chunk_id": 6,
    "timestamp_range": "01:39:29 \u2013 01:39:58",
    "key_concepts": [
      "Classification is supervised learning where the model predicts categorical labels based on training data.",
      "Types of classification:"
    ],
    "definitions": {
      "Binary Classification": "Predicting one of two classes.",
      "Multiclass Classification": "Predicting one class from multiple categories."
    },
    "key_facts": [
      "Deep learning can be applied to classification tasks, often requiring GPU compute.",
      "Classification models learn from labeled data to assign categories to new data."
    ],
    "examples": [
      "Binary classification for spam detection (spam or not spam).",
      "Multiclass classification for sentiment analysis (positive, neutral, negative)."
    ],
    "exam_tips": [],
    "raw_markdown": "### \ud83c\udfa4 [01:39:29] Classification  \n**Timestamp**: 01:39:29 \u2013 01:39:58\n\n**Key Concepts**  \n- Classification is supervised learning where the model predicts categorical labels based on training data.  \n- Types of classification:  \n  - Binary classification: two possible labels (e.g., true/false).  \n  - Multiclass classification: multiple possible labels (e.g., happy, sad, mad).\n\n**Definitions**  \n- **Binary Classification**: Predicting one of two classes.  \n- **Multiclass Classification**: Predicting one class from multiple categories.\n\n**Key Facts**  \n- Deep learning can be applied to classification tasks, often requiring GPU compute.  \n- Classification models learn from labeled data to assign categories to new data.\n\n**Examples**  \n- Binary classification for spam detection (spam or not spam).  \n- Multiclass classification for sentiment analysis (positive, neutral, negative).\n\n**Exam Tips \ud83c\udfaf**  \n- Understand the difference between binary and multiclass classification.  \n- Know that deep learning classification benefits from GPU compute.\n\n---\n\n"
  },
  {
    "section_title": "\ud83c\udfa4 [01:39:58] Regression",
    "chunk_id": 6,
    "timestamp_range": "01:39:58 \u2013 01:40:28",
    "key_concepts": [
      "Regression is supervised learning where the model predicts continuous numeric values.",
      "Goal is to predict future variable values based on training data."
    ],
    "definitions": {
      "Regression": "Predicting a continuous output variable."
    },
    "key_facts": [
      "Regression differs from classification in output type (continuous vs categorical).",
      "Common use cases include price prediction, salary estimation."
    ],
    "examples": [
      "Predicting house prices based on features like size and location.",
      "Estimating employee salaries from experience and education."
    ],
    "exam_tips": [],
    "raw_markdown": "### \ud83c\udfa4 [01:39:58] Regression  \n**Timestamp**: 01:39:58 \u2013 01:40:28\n\n**Key Concepts**  \n- Regression is supervised learning where the model predicts continuous numeric values.  \n- Goal is to predict future variable values based on training data.\n\n**Definitions**  \n- **Regression**: Predicting a continuous output variable.\n\n**Key Facts**  \n- Regression differs from classification in output type (continuous vs categorical).  \n- Common use cases include price prediction, salary estimation.\n\n**Examples**  \n- Predicting house prices based on features like size and location.  \n- Estimating employee salaries from experience and education.\n\n**Exam Tips \ud83c\udfaf**  \n- Know regression predicts continuous values, unlike classification.  \n- Understand typical regression use cases.\n\n---\n\n"
  },
  {
    "section_title": "\ud83c\udfa4 [01:40:28] Time series forecasting",
    "chunk_id": 6,
    "timestamp_range": "01:40:28 \u2013 01:40:59",
    "key_concepts": [
      "Time series forecasting predicts future values based on time-dependent data.",
      "Treated as a multivariate regression problem with past time values as features.",
      "Supports advanced configurations like holiday detection, deep learning, and cross-validation."
    ],
    "definitions": {
      "Time Series Forecasting": "Predicting future data points based on historical time-stamped data."
    },
    "key_facts": [
      "Incorporates multiple contextual variables and their relationships during training.",
      "Supports models like Auto ARIMA, Prophet, TCN, and neural networks."
    ],
    "examples": [
      "Forecasting sales, inventory, or customer demand over time.",
      "Using holiday detection to improve forecast accuracy."
    ],
    "exam_tips": [],
    "raw_markdown": "### \ud83c\udfa4 [01:40:28] Time series forecasting  \n**Timestamp**: 01:40:28 \u2013 01:40:59\n\n**Key Concepts**  \n- Time series forecasting predicts future values based on time-dependent data.  \n- Treated as a multivariate regression problem with past time values as features.  \n- Supports advanced configurations like holiday detection, deep learning, and cross-validation.\n\n**Definitions**  \n- **Time Series Forecasting**: Predicting future data points based on historical time-stamped data.\n\n**Key Facts**  \n- Incorporates multiple contextual variables and their relationships during training.  \n- Supports models like Auto ARIMA, Prophet, TCN, and neural networks.\n\n**Examples**  \n- Forecasting sales, inventory, or customer demand over time.  \n- Using holiday detection to improve forecast accuracy.\n\n**Exam Tips \ud83c\udfaf**  \n- Understand time series forecasting as a specialized regression task.  \n- Be aware of advanced features like holiday detection and deep learning support.\n\n---\n\n"
  },
  {
    "section_title": "\ud83c\udfa4 [01:41:15] Data Guard Rails",
    "chunk_id": 6,
    "timestamp_range": "01:40:59 \u2013 01:41:37",
    "key_concepts": [
      "Data Guard Rails are automated checks run by AutoML to ensure high-quality input data.",
      "Checks include validation split, missing value imputation, and high cardinality feature detection."
    ],
    "definitions": {
      "Data Guard Rails": "Automated data validation and quality checks during AutoML training."
    },
    "key_facts": [
      "Validation split improves model performance by separating training and validation data.",
      "Missing feature values are imputed to avoid training issues.",
      "High cardinality features (too many unique values) are detected to prevent model complexity."
    ],
    "examples": [
      "AutoML detecting no missing values and no high cardinality features in input data."
    ],
    "exam_tips": [],
    "raw_markdown": "### \ud83c\udfa4 [01:41:15] Data Guard Rails  \n**Timestamp**: 01:40:59 \u2013 01:41:37\n\n**Key Concepts**  \n- Data Guard Rails are automated checks run by AutoML to ensure high-quality input data.  \n- Checks include validation split, missing value imputation, and high cardinality feature detection.\n\n**Definitions**  \n- **Data Guard Rails**: Automated data validation and quality checks during AutoML training.\n\n**Key Facts**  \n- Validation split improves model performance by separating training and validation data.  \n- Missing feature values are imputed to avoid training issues.  \n- High cardinality features (too many unique values) are detected to prevent model complexity.\n\n**Examples**  \n- AutoML detecting no missing values and no high cardinality features in input data.\n\n**Exam Tips \ud83c\udfaf**  \n- Know that AutoML performs automatic data quality checks before training.  \n- Understand the importance of data guard rails for reliable model training.\n\n---\n\n"
  },
  {
    "section_title": "\ud83c\udfa4 [01:42:01] Automatic Featurization",
    "chunk_id": 6,
    "timestamp_range": "01:41:37 \u2013 01:43:42",
    "key_concepts": [
      "AutoML applies automatic feature scaling and normalization techniques during training.",
      "Techniques include StandardScaler, MinMaxScaler, MaxAbsScaler, RobustScaler, PCA, TruncatedSVD, and Sparse Normalization.",
      "Dimensionality reduction helps simplify complex data with many features."
    ],
    "definitions": {
      "StandardScaler": "Removes mean and scales to unit variance.",
      "MinMaxScaler": "Scales features to a fixed range.",
      "MaxAbsScaler": "Scales by maximum absolute value.",
      "RobustScaler": "Scales using quantile range, robust to outliers.",
      "PCA (Principal Component Analysis)": "Linear dimensionality reduction technique.",
      "TruncatedSVD": "Dimensionality reduction for sparse matrices without centering data.",
      "Sparse Normalization": "Rescales sparse data rows independently."
    },
    "key_facts": [
      "Dimensionality reduction is useful when datasets have many labels or features.",
      "AutoML handles complex preprocessing automatically."
    ],
    "examples": [
      "Using PCA to reduce 40-category labels to fewer dimensions for easier modeling."
    ],
    "exam_tips": [],
    "raw_markdown": "### \ud83c\udfa4 [01:42:01] Automatic Featurization  \n**Timestamp**: 01:41:37 \u2013 01:43:42\n\n**Key Concepts**  \n- AutoML applies automatic feature scaling and normalization techniques during training.  \n- Techniques include StandardScaler, MinMaxScaler, MaxAbsScaler, RobustScaler, PCA, TruncatedSVD, and Sparse Normalization.  \n- Dimensionality reduction helps simplify complex data with many features.\n\n**Definitions**  \n- **StandardScaler**: Removes mean and scales to unit variance.  \n- **MinMaxScaler**: Scales features to a fixed range.  \n- **MaxAbsScaler**: Scales by maximum absolute value.  \n- **RobustScaler**: Scales using quantile range, robust to outliers.  \n- **PCA (Principal Component Analysis)**: Linear dimensionality reduction technique.  \n- **TruncatedSVD**: Dimensionality reduction for sparse matrices without centering data.  \n- **Sparse Normalization**: Rescales sparse data rows independently.\n\n**Key Facts**  \n- Dimensionality reduction is useful when datasets have many labels or features.  \n- AutoML handles complex preprocessing automatically.\n\n**Examples**  \n- Using PCA to reduce 40-category labels to fewer dimensions for easier modeling.\n\n**Exam Tips \ud83c\udfaf**  \n- Understand that AutoML automates feature scaling and dimensionality reduction.  \n- Know common scaling techniques but detailed knowledge is not required for AI-900.\n\n---\n\n"
  },
  {
    "section_title": "\ud83c\udfa4 [01:43:53] Model Selection",
    "chunk_id": 6,
    "timestamp_range": "01:43:42 \u2013 01:44:57",
    "key_concepts": [
      "Model selection is choosing the best statistical model from many candidates.",
      "AutoML tests multiple algorithms (53+ models) and recommends the best performing one.",
      "Ensemble models like Voting Ensemble combine weak models for stronger performance."
    ],
    "definitions": {
      "Voting Ensemble": "An ensemble method combining multiple weak learners to improve accuracy."
    },
    "key_facts": [
      "AutoML ranks models by primary metric performance.",
      "Users can override AutoML\u2019s choice if knowledgeable."
    ],
    "examples": [
      "AutoML selecting Voting Ensemble as top candidate model."
    ],
    "exam_tips": [],
    "raw_markdown": "### \ud83c\udfa4 [01:43:53] Model Selection  \n**Timestamp**: 01:43:42 \u2013 01:44:57\n\n**Key Concepts**  \n- Model selection is choosing the best statistical model from many candidates.  \n- AutoML tests multiple algorithms (53+ models) and recommends the best performing one.  \n- Ensemble models like Voting Ensemble combine weak models for stronger performance.\n\n**Definitions**  \n- **Voting Ensemble**: An ensemble method combining multiple weak learners to improve accuracy.\n\n**Key Facts**  \n- AutoML ranks models by primary metric performance.  \n- Users can override AutoML\u2019s choice if knowledgeable.\n\n**Examples**  \n- AutoML selecting Voting Ensemble as top candidate model.\n\n**Exam Tips \ud83c\udfaf**  \n- Know AutoML performs extensive model selection automatically.  \n- Understand ensemble models improve prediction by combining multiple models.\n\n---\n\n"
  },
  {
    "section_title": "\ud83c\udfa4 [01:44:57] Explanation",
    "chunk_id": 6,
    "timestamp_range": "01:44:57 \u2013 01:45:51",
    "key_concepts": [
      "Machine Learning Explainability (MLX) interprets and explains model behavior and decisions.",
      "MLX provides insights into model performance, feature importance (aggregate and individual), and dataset exploration."
    ],
    "definitions": {
      "MLX (Machine Learning Explainability)": "Tools and processes to interpret ML model internals and outputs."
    },
    "key_facts": [
      "Explainability helps developers understand which features most influence predictions.",
      "Example dataset: Diabetes dataset where BMI is a key feature."
    ],
    "examples": [
      "Viewing aggregate feature importance to see BMI\u2019s impact on diabetes prediction."
    ],
    "exam_tips": [],
    "raw_markdown": "### \ud83c\udfa4 [01:44:57] Explanation  \n**Timestamp**: 01:44:57 \u2013 01:45:51\n\n**Key Concepts**  \n- Machine Learning Explainability (MLX) interprets and explains model behavior and decisions.  \n- MLX provides insights into model performance, feature importance (aggregate and individual), and dataset exploration.\n\n**Definitions**  \n- **MLX (Machine Learning Explainability)**: Tools and processes to interpret ML model internals and outputs.\n\n**Key Facts**  \n- Explainability helps developers understand which features most influence predictions.  \n- Example dataset: Diabetes dataset where BMI is a key feature.\n\n**Examples**  \n- Viewing aggregate feature importance to see BMI\u2019s impact on diabetes prediction.\n\n**Exam Tips \ud83c\udfaf**  \n- Be aware of explainability as a feature in Azure AutoML for model transparency.  \n- Understand the value of feature importance in interpreting models.\n\n---\n\n"
  },
  {
    "section_title": "\ud83c\udfa4 [01:45:51] Primary Metrics",
    "chunk_id": 6,
    "timestamp_range": "01:45:51 \u2013 01:46:34",
    "key_concepts": [
      "Primary metric is the optimization parameter used during model training.",
      "Different metrics apply depending on task type (classification, regression, time series).",
      "Users can override the auto-detected primary metric."
    ],
    "definitions": {
      "Primary Metric": "The key performance indicator used to evaluate and select models."
    },
    "key_facts": [
      "AutoML may sample data to auto-detect the best metric.",
      "Common metrics include accuracy, precision, recall for classification; R2, RMSE for regression."
    ],
    "examples": [
      "Using accuracy as primary metric for balanced classification datasets."
    ],
    "exam_tips": [],
    "raw_markdown": "### \ud83c\udfa4 [01:45:51] Primary Metrics  \n**Timestamp**: 01:45:51 \u2013 01:46:34\n\n**Key Concepts**  \n- Primary metric is the optimization parameter used during model training.  \n- Different metrics apply depending on task type (classification, regression, time series).  \n- Users can override the auto-detected primary metric.\n\n**Definitions**  \n- **Primary Metric**: The key performance indicator used to evaluate and select models.\n\n**Key Facts**  \n- AutoML may sample data to auto-detect the best metric.  \n- Common metrics include accuracy, precision, recall for classification; R2, RMSE for regression.\n\n**Examples**  \n- Using accuracy as primary metric for balanced classification datasets.\n\n**Exam Tips \ud83c\udfaf**  \n- Know that primary metrics guide model optimization in AutoML.  \n- Understand that metric choice depends on dataset balance and task type.\n\n---\n\n"
  },
  {
    "section_title": "\ud83c\udfa4 [01:46:04] Follow Along Guidelines for Human AI Interaction",
    "chunk_id": 6,
    "timestamp_range": "None in this chunk",
    "key_concepts": [
      "None in this chunk."
    ],
    "definitions": {},
    "key_facts": [],
    "examples": [],
    "exam_tips": [],
    "raw_markdown": "### \ud83c\udfa4 [01:46:04] Follow Along Guidelines for Human AI Interaction  \n**Timestamp**: None in this chunk\n\n**Key Concepts**  \n- None in this chunk.\n\n---\n\n"
  },
  {
    "section_title": "\ud83c\udfa4 [01:48:14] Introduction to Custom Vision",
    "chunk_id": 6,
    "timestamp_range": "01:48:30 \u2013 01:49:05",
    "key_concepts": [
      "Custom Vision is a fully managed, no-code service to build classification and object detection models quickly.",
      "Hosted on its own isolated domain (customvision.ai).",
      "Users upload labeled or unlabeled images and tag them to train models.",
      "Provides a simple REST API to tag images and evaluate models."
    ],
    "definitions": {
      "Custom Vision": "Azure service for building custom image classification and object detection models without coding."
    },
    "key_facts": [
      "Supports quick tagging and training workflows.",
      "Enables evaluation and deployment via REST API."
    ],
    "examples": [
      "Uploading images of cats and dogs, tagging them, and training a model to classify pets."
    ],
    "exam_tips": [],
    "raw_markdown": "### \ud83c\udfa4 [01:48:14] Introduction to Custom Vision  \n**Timestamp**: 01:48:30 \u2013 01:49:05\n\n**Key Concepts**  \n- Custom Vision is a fully managed, no-code service to build classification and object detection models quickly.  \n- Hosted on its own isolated domain (customvision.ai).  \n- Users upload labeled or unlabeled images and tag them to train models.  \n- Provides a simple REST API to tag images and evaluate models.\n\n**Definitions**  \n- **Custom Vision**: Azure service for building custom image classification and object detection models without coding.\n\n**Key Facts**  \n- Supports quick tagging and training workflows.  \n- Enables evaluation and deployment via REST API.\n\n**Examples**  \n- Uploading images of cats and dogs, tagging them, and training a model to classify pets.\n\n**Exam Tips \ud83c\udfaf**  \n- Know Custom Vision is a no-code, quick-start service for image classification and object detection.  \n- Understand the workflow: upload images \u2192 tag \u2192 train \u2192 evaluate \u2192 deploy.\n\n---\n\n"
  },
  {
    "section_title": "\ud83c\udfa4 [01:48:58] Project Types and Domains",
    "chunk_id": 6,
    "timestamp_range": "01:49:05 \u2013 01:49:05 (partial)",
    "key_concepts": [
      "When creating a Custom Vision project, you must select a project type: classification or object detection.",
      "Classification types:"
    ],
    "definitions": {
      "Multi-label Classification": "Assigning multiple tags to a single image.",
      "Multi-class Classification": "Assigning exactly one tag per image.",
      "Object Detection": "Detecting and localizing objects within images."
    },
    "key_facts": [
      "Project type selection determines training and evaluation approach."
    ],
    "examples": [
      "Multi-label: tagging an image containing both cat and dog.",
      "Multi-class: tagging an image as either apple, banana, or orange."
    ],
    "exam_tips": [],
    "raw_markdown": "### \ud83c\udfa4 [01:48:58] Project Types and Domains  \n**Timestamp**: 01:49:05 \u2013 01:49:05 (partial)\n\n**Key Concepts**  \n- When creating a Custom Vision project, you must select a project type: classification or object detection.  \n- Classification types:  \n  - Multi-label: multiple tags per image (e.g., image with both cat and dog).  \n  - Multi-class: single tag per image (e.g., apple, banana, or orange).  \n- Object detection identifies and locates multiple objects within an image.\n\n**Definitions**  \n- **Multi-label Classification**: Assigning multiple tags to a single image.  \n- **Multi-class Classification**: Assigning exactly one tag per image.  \n- **Object Detection**: Detecting and localizing objects within images.\n\n**Key Facts**  \n- Project type selection determines training and evaluation approach.\n\n**Examples**  \n- Multi-label: tagging an image containing both cat and dog.  \n- Multi-class: tagging an image as either apple, banana, or orange.\n\n**Exam Tips \ud83c\udfaf**  \n- Understand the difference between multi-label and multi-class classification in Custom Vision.  \n- Know object detection is for locating multiple objects in images.\n\n"
  },
  {
    "section_title": "\ud83c\udfa4 [01:48:14] Introduction to Custom Vision",
    "chunk_id": 7,
    "timestamp_range": "01:49:33 \u2013 01:54:17",
    "key_concepts": [
      "Custom Vision requires choosing a domain, which is a Microsoft-managed dataset optimized for specific use cases.",
      "Domains are tailored for different image classification or object detection scenarios.",
      "Image classification domains include General, A1, A2, Food, Landmark, Retail, and Compact.",
      "Object detection domains include General, A1, and Logo.",
      "Image classification involves uploading multiple images and applying single or multiple labels to entire images.",
      "Object detection involves tagging objects within images using bounding boxes, which can be assisted by ML-generated suggestions.",
      "Minimum of 50 images per tag is required for training.",
      "Two training modes: Quick Training (faster, less accurate) and Advanced Training (longer, more accurate).",
      "Training progress can be controlled via evaluation metrics (precision, recall) and probability threshold values.",
      "Evaluation metrics include Precision, Recall, and Average Precision.",
      "After training, models can be tested with a quick test feature and published to obtain prediction URLs.",
      "Smart Labeler feature provides ML-assisted labeling suggestions to speed up dataset labeling once some data is loaded."
    ],
    "definitions": {
      "Domain": "A Microsoft-managed dataset optimized for training ML models for specific use cases.",
      "Image Classification": "Assigning one or more labels to an entire image.",
      "Object Detection": "Identifying and tagging specific objects within an image using bounding boxes.",
      "Quick Training": "A faster training mode with lower accuracy.",
      "Advanced Training": "A slower training mode that improves accuracy by increasing compute time.",
      "Precision": "The accuracy of relevant item selection (exactness).",
      "Recall": "Sensitivity or true positive rate (how many relevant items are returned).",
      "Average Precision": "A combined metric important for evaluating object detection models.",
      "Smart Labeler": "ML-assisted labeling tool that suggests tags based on existing training data."
    },
    "key_facts": [
      "General domain is recommended when unsure which domain to choose.",
      "A1 domain offers better accuracy but requires more training time.",
      "A2 domain offers better accuracy with faster training than A1 and General.",
      "Food domain is optimized for photographs of dishes or individual fruits/vegetables.",
      "Landmark domain works best when landmarks are clearly visible, even if slightly obstructed.",
      "Retail domain is optimized for images found in shopping carts or websites, useful for distinguishing clothing items.",
      "Compact domain is optimized for real-time classification on edge devices.",
      "Object detection domains are fewer but include General, A1 (higher accuracy), and Logo (for brand/product detection).",
      "Minimum 50 images per tag required for training.",
      "Training stops when evaluation metric meets the probability threshold set by the user."
    ],
    "examples": [
      "Using Food domain to classify photographs of fruits or vegetables.",
      "Using Retail domain to classify between dresses, pants, and shirts.",
      "Object detection tagging with bounding boxes drawn manually or suggested by ML.",
      "Quick test feature used to verify model predictions (e.g., identifying a \"Warf\" in an image).",
      "Smart Labeler suggesting tags to speed up labeling large datasets."
    ],
    "exam_tips": [],
    "raw_markdown": "### \ud83c\udfa4 [01:48:14] Introduction to Custom Vision  \n**Timestamp**: 01:49:33 \u2013 01:54:17\n\n**Key Concepts**  \n- Custom Vision requires choosing a domain, which is a Microsoft-managed dataset optimized for specific use cases.  \n- Domains are tailored for different image classification or object detection scenarios.  \n- Image classification domains include General, A1, A2, Food, Landmark, Retail, and Compact.  \n- Object detection domains include General, A1, and Logo.  \n- Image classification involves uploading multiple images and applying single or multiple labels to entire images.  \n- Object detection involves tagging objects within images using bounding boxes, which can be assisted by ML-generated suggestions.  \n- Minimum of 50 images per tag is required for training.  \n- Two training modes: Quick Training (faster, less accurate) and Advanced Training (longer, more accurate).  \n- Training progress can be controlled via evaluation metrics (precision, recall) and probability threshold values.  \n- Evaluation metrics include Precision, Recall, and Average Precision.  \n- After training, models can be tested with a quick test feature and published to obtain prediction URLs.  \n- Smart Labeler feature provides ML-assisted labeling suggestions to speed up dataset labeling once some data is loaded.\n\n**Definitions**  \n- **Domain**: A Microsoft-managed dataset optimized for training ML models for specific use cases.  \n- **Image Classification**: Assigning one or more labels to an entire image.  \n- **Object Detection**: Identifying and tagging specific objects within an image using bounding boxes.  \n- **Quick Training**: A faster training mode with lower accuracy.  \n- **Advanced Training**: A slower training mode that improves accuracy by increasing compute time.  \n- **Precision**: The accuracy of relevant item selection (exactness).  \n- **Recall**: Sensitivity or true positive rate (how many relevant items are returned).  \n- **Average Precision**: A combined metric important for evaluating object detection models.  \n- **Smart Labeler**: ML-assisted labeling tool that suggests tags based on existing training data.\n\n**Key Facts**  \n- General domain is recommended when unsure which domain to choose.  \n- A1 domain offers better accuracy but requires more training time.  \n- A2 domain offers better accuracy with faster training than A1 and General.  \n- Food domain is optimized for photographs of dishes or individual fruits/vegetables.  \n- Landmark domain works best when landmarks are clearly visible, even if slightly obstructed.  \n- Retail domain is optimized for images found in shopping carts or websites, useful for distinguishing clothing items.  \n- Compact domain is optimized for real-time classification on edge devices.  \n- Object detection domains are fewer but include General, A1 (higher accuracy), and Logo (for brand/product detection).  \n- Minimum 50 images per tag required for training.  \n- Training stops when evaluation metric meets the probability threshold set by the user.\n\n**Examples**  \n- Using Food domain to classify photographs of fruits or vegetables.  \n- Using Retail domain to classify between dresses, pants, and shirts.  \n- Object detection tagging with bounding boxes drawn manually or suggested by ML.  \n- Quick test feature used to verify model predictions (e.g., identifying a \"Warf\" in an image).  \n- Smart Labeler suggesting tags to speed up labeling large datasets.\n\n**Exam Tips \ud83c\udfaf**  \n- Know the difference between image classification and object detection domains and their use cases.  \n- Remember the minimum number of images per tag (50) required for training.  \n- Understand the trade-offs between Quick Training and Advanced Training.  \n- Be familiar with evaluation metrics: Precision, Recall, and Average Precision, especially for object detection.  \n- Understand the purpose and benefits of the Smart Labeler (ML-assisted labeling).  \n- Know how to publish a model and obtain prediction URLs for invoking the service.\n\n---\n\n"
  },
  {
    "section_title": "\ud83c\udfa4 [01:54:32] AI vs Generative AI",
    "chunk_id": 7,
    "timestamp_range": "01:54:49 \u2013 01:57:22",
    "key_concepts": [
      "Traditional AI focuses on systems that perform tasks requiring human intelligence such as problem solving, decision-making, natural language understanding, speech and image recognition.",
      "AI aims to interpret, analyze, and respond to human actions or environmental changes efficiently and accurately.",
      "Generative AI is a subset of AI focused on creating new, novel, and realistic content or data (text, images, music, speech, etc.).",
      "Generative AI uses advanced machine learning techniques like deep learning, generative adversarial networks (GANs), variational autoencoders, and Transformer models (e.g., GPT).",
      "Applications of traditional AI include expert systems, chatbots, recommendation systems, autonomous vehicles, and medical diagnosis.",
      "Applications of generative AI include content creation, synthetic data generation, deep fakes, design, virtual environments, and drug discovery."
    ],
    "definitions": {
      "Traditional AI": "AI systems designed to interpret and analyze data to make decisions or perform tasks.",
      "Generative AI": "AI systems designed to generate new, original content based on learned data patterns."
    },
    "key_facts": [
      "Traditional AI focuses on understanding and decision-making.",
      "Generative AI focuses on creating new original outputs.",
      "Traditional AI analyzes existing data; generative AI generates new data from existing data.",
      "Generative AI models include GPT (text generation), DALL\u00b7E (image creation), and others for music and video."
    ],
    "examples": [
      "GPT for text generation.",
      "DALL\u00b7E for image creation.",
      "Deep learning models composing music.",
      "Use of generative AI in creating virtual environments and drug discovery."
    ],
    "exam_tips": [],
    "raw_markdown": "### \ud83c\udfa4 [01:54:32] AI vs Generative AI  \n**Timestamp**: 01:54:49 \u2013 01:57:22\n\n**Key Concepts**  \n- Traditional AI focuses on systems that perform tasks requiring human intelligence such as problem solving, decision-making, natural language understanding, speech and image recognition.  \n- AI aims to interpret, analyze, and respond to human actions or environmental changes efficiently and accurately.  \n- Generative AI is a subset of AI focused on creating new, novel, and realistic content or data (text, images, music, speech, etc.).  \n- Generative AI uses advanced machine learning techniques like deep learning, generative adversarial networks (GANs), variational autoencoders, and Transformer models (e.g., GPT).  \n- Applications of traditional AI include expert systems, chatbots, recommendation systems, autonomous vehicles, and medical diagnosis.  \n- Applications of generative AI include content creation, synthetic data generation, deep fakes, design, virtual environments, and drug discovery.\n\n**Definitions**  \n- **Traditional AI**: AI systems designed to interpret and analyze data to make decisions or perform tasks.  \n- **Generative AI**: AI systems designed to generate new, original content based on learned data patterns.\n\n**Key Facts**  \n- Traditional AI focuses on understanding and decision-making.  \n- Generative AI focuses on creating new original outputs.  \n- Traditional AI analyzes existing data; generative AI generates new data from existing data.  \n- Generative AI models include GPT (text generation), DALL\u00b7E (image creation), and others for music and video.\n\n**Examples**  \n- GPT for text generation.  \n- DALL\u00b7E for image creation.  \n- Deep learning models composing music.  \n- Use of generative AI in creating virtual environments and drug discovery.\n\n**Exam Tips \ud83c\udfaf**  \n- Be able to distinguish between traditional AI and generative AI in terms of functionality, data handling, and applications.  \n- Understand that generative AI is a subset of AI focused on content creation, not just analysis.  \n- Know examples of generative AI tools and their purposes.\n\n---\n\n"
  },
  {
    "section_title": "\ud83c\udfa4 [01:57:17] What is a LLM Large Language Model",
    "chunk_id": 7,
    "timestamp_range": "01:57:22 \u2013 01:58:44",
    "key_concepts": [
      "Large Language Models (LLMs) like GPT are complex systems trained on massive text datasets including books, articles, and websites.",
      "LLMs learn patterns in language such as grammar, word usage, sentence structure, style, and tone.",
      "They understand context by considering words in relation to surrounding words and sentences.",
      "Given a prompt, LLMs predict the next most likely word repeatedly to generate coherent text.",
      "The generated text length can vary based on instructions or model limits.",
      "LLMs can be refined and improved over time with feedback and additional data."
    ],
    "definitions": {
      "Large Language Model (LLM)": "A machine learning model trained on large text corpora to understand and generate human-like text.",
      "Prompt": "The initial input text given to an LLM to start text generation."
    },
    "key_facts": [
      "LLMs use pattern recognition and prediction to generate text.",
      "Context understanding is key to generating relevant and coherent text.",
      "Feedback and usage data help refine LLM performance."
    ],
    "examples": [
      "GPT generating text by predicting one word at a time based on the prompt and context."
    ],
    "exam_tips": [],
    "raw_markdown": "### \ud83c\udfa4 [01:57:17] What is a LLM Large Language Model  \n**Timestamp**: 01:57:22 \u2013 01:58:44\n\n**Key Concepts**  \n- Large Language Models (LLMs) like GPT are complex systems trained on massive text datasets including books, articles, and websites.  \n- LLMs learn patterns in language such as grammar, word usage, sentence structure, style, and tone.  \n- They understand context by considering words in relation to surrounding words and sentences.  \n- Given a prompt, LLMs predict the next most likely word repeatedly to generate coherent text.  \n- The generated text length can vary based on instructions or model limits.  \n- LLMs can be refined and improved over time with feedback and additional data.\n\n**Definitions**  \n- **Large Language Model (LLM)**: A machine learning model trained on large text corpora to understand and generate human-like text.  \n- **Prompt**: The initial input text given to an LLM to start text generation.\n\n**Key Facts**  \n- LLMs use pattern recognition and prediction to generate text.  \n- Context understanding is key to generating relevant and coherent text.  \n- Feedback and usage data help refine LLM performance.\n\n**Examples**  \n- GPT generating text by predicting one word at a time based on the prompt and context.\n\n**Exam Tips \ud83c\udfaf**  \n- Understand how LLMs are trained and how they generate text.  \n- Know the importance of context in LLM text generation.  \n- Be aware that LLMs improve over time with feedback.\n\n---\n\n"
  },
  {
    "section_title": "\ud83c\udfa4 [01:58:58] Transformer models",
    "chunk_id": 7,
    "timestamp_range": "01:59:14 \u2013 02:00:05",
    "key_concepts": [
      "Transformer models are a type of machine learning model designed for natural language processing tasks like translation and text generation.",
      "The Transformer architecture consists of two main components: the encoder and the decoder.",
      "The encoder reads and understands input text, capturing meanings and context.",
      "The decoder generates new text based on the encoder\u2019s understanding, producing coherent sentences.",
      "Different Transformer models specialize in different tasks:"
    ],
    "definitions": {
      "Transformer Model": "A neural network architecture effective for processing sequences of data, especially language.",
      "Encoder": "Part of the Transformer that processes and understands input text.",
      "Decoder": "Part of the Transformer that generates output text based on encoder input."
    },
    "key_facts": [
      "BERT is used by Google for search understanding.",
      "GPT is designed for generating human-like text."
    ],
    "examples": [
      "BERT acting like a librarian understanding the content of books.",
      "GPT acting like a skilled author writing stories or conversations."
    ],
    "exam_tips": [],
    "raw_markdown": "### \ud83c\udfa4 [01:58:58] Transformer models  \n**Timestamp**: 01:59:14 \u2013 02:00:05\n\n**Key Concepts**  \n- Transformer models are a type of machine learning model designed for natural language processing tasks like translation and text generation.  \n- The Transformer architecture consists of two main components: the encoder and the decoder.  \n- The encoder reads and understands input text, capturing meanings and context.  \n- The decoder generates new text based on the encoder\u2019s understanding, producing coherent sentences.  \n- Different Transformer models specialize in different tasks:  \n  - BERT is optimized for language understanding.  \n  - GPT is optimized for text generation.\n\n**Definitions**  \n- **Transformer Model**: A neural network architecture effective for processing sequences of data, especially language.  \n- **Encoder**: Part of the Transformer that processes and understands input text.  \n- **Decoder**: Part of the Transformer that generates output text based on encoder input.\n\n**Key Facts**  \n- BERT is used by Google for search understanding.  \n- GPT is designed for generating human-like text.\n\n**Examples**  \n- BERT acting like a librarian understanding the content of books.  \n- GPT acting like a skilled author writing stories or conversations.\n\n**Exam Tips \ud83c\udfaf**  \n- Know the roles of encoder and decoder in Transformer models.  \n- Understand the difference between BERT and GPT in terms of language understanding vs. generation.\n\n---\n\n"
  },
  {
    "section_title": "\ud83c\udfa4 [02:00:14] Tokenization",
    "chunk_id": 7,
    "timestamp_range": "02:00:14 \u2013 02:01:07",
    "key_concepts": [
      "Tokenization breaks down sentences into smaller pieces called tokens (words or subwords) for the model to process.",
      "Each token is assigned a unique number (token ID) to represent it numerically.",
      "Repeated words reuse the same token ID instead of creating new ones.",
      "The model builds a large dictionary of tokens and their IDs from the training data.",
      "Tokenization enables the model to convert text into a format suitable for machine learning."
    ],
    "definitions": {
      "Tokenization": "The process of splitting text into tokens and assigning each a unique numerical ID."
    },
    "key_facts": [
      "Tokens can be whole words or parts of words.",
      "Token IDs form a vocabulary that the model uses to understand and generate language."
    ],
    "examples": [
      "Sentence: \"I heard a dog bark loudly at a cat\" tokenized into individual words each assigned a number (e.g., I=1, heard=2, a=3, dog=4, bark=5, etc.)."
    ],
    "exam_tips": [],
    "raw_markdown": "### \ud83c\udfa4 [02:00:14] Tokenization  \n**Timestamp**: 02:00:14 \u2013 02:01:07\n\n**Key Concepts**  \n- Tokenization breaks down sentences into smaller pieces called tokens (words or subwords) for the model to process.  \n- Each token is assigned a unique number (token ID) to represent it numerically.  \n- Repeated words reuse the same token ID instead of creating new ones.  \n- The model builds a large dictionary of tokens and their IDs from the training data.  \n- Tokenization enables the model to convert text into a format suitable for machine learning.\n\n**Definitions**  \n- **Tokenization**: The process of splitting text into tokens and assigning each a unique numerical ID.\n\n**Key Facts**  \n- Tokens can be whole words or parts of words.  \n- Token IDs form a vocabulary that the model uses to understand and generate language.\n\n**Examples**  \n- Sentence: \"I heard a dog bark loudly at a cat\" tokenized into individual words each assigned a number (e.g., I=1, heard=2, a=3, dog=4, bark=5, etc.).\n\n**Exam Tips \ud83c\udfaf**  \n- Understand why tokenization is necessary for language models.  \n- Know that tokens are mapped to unique IDs reused for repeated words.\n\n---\n\n"
  },
  {
    "section_title": "\ud83c\udfa4 [02:01:26] Embeddings",
    "chunk_id": 7,
    "timestamp_range": "02:01:26 \u2013 02:02:36",
    "key_concepts": [
      "Embeddings convert tokens into numeric vectors that capture semantic meaning.",
      "Words with similar meanings have embeddings that are close in vector space.",
      "Embeddings allow the model to understand relationships between words beyond just token IDs.",
      "Real embeddings have many dimensions (more than the simple 3D example).",
      "Tools like word2vec or Transformer encoders help generate these embeddings."
    ],
    "definitions": {
      "Embedding": "A numeric vector representation of a token that encodes semantic meaning."
    },
    "key_facts": [
      "Similar words like \"dog\" and \"bark\" have similar embeddings.",
      "Dissimilar words like \"skateboard\" have very different embeddings."
    ],
    "examples": [
      "Example embeddings in 3D vector space: dog (10,3,2), bark (10,2,2), cat (10,3,1), skateboard (3,3,1)."
    ],
    "exam_tips": [],
    "raw_markdown": "### \ud83c\udfa4 [02:01:26] Embeddings  \n**Timestamp**: 02:01:26 \u2013 02:02:36\n\n**Key Concepts**  \n- Embeddings convert tokens into numeric vectors that capture semantic meaning.  \n- Words with similar meanings have embeddings that are close in vector space.  \n- Embeddings allow the model to understand relationships between words beyond just token IDs.  \n- Real embeddings have many dimensions (more than the simple 3D example).  \n- Tools like word2vec or Transformer encoders help generate these embeddings.\n\n**Definitions**  \n- **Embedding**: A numeric vector representation of a token that encodes semantic meaning.\n\n**Key Facts**  \n- Similar words like \"dog\" and \"bark\" have similar embeddings.  \n- Dissimilar words like \"skateboard\" have very different embeddings.\n\n**Examples**  \n- Example embeddings in 3D vector space: dog (10,3,2), bark (10,2,2), cat (10,3,1), skateboard (3,3,1).\n\n**Exam Tips \ud83c\udfaf**  \n- Know that embeddings capture semantic similarity between words.  \n- Understand embeddings are higher-dimensional in real models.\n\n---\n\n"
  },
  {
    "section_title": "\ud83c\udfa4 [02:02:46] Positional encoding",
    "chunk_id": 7,
    "timestamp_range": "02:02:46 \u2013 02:04:06",
    "key_concepts": [
      "Positional encoding adds information about the position of each token in a sequence to embeddings.",
      "This preserves word order, which is crucial for understanding meaning.",
      "Each token\u2019s embedding is modified by adding a unique positional vector corresponding to its position in the sentence.",
      "Without positional encoding, the model would lose sequence information.",
      "Sentences with the same words in different orders have different positional encodings and thus different representations."
    ],
    "definitions": {
      "Positional Encoding": "A technique to inject token position information into embeddings to preserve word order."
    },
    "key_facts": [
      "Positional vectors are added to each token embedding based on token position (e.g., I_1, heard_2, a_3, etc.).",
      "Repeated words reuse the same positional vector for their respective positions."
    ],
    "examples": [
      "Sentence: \"I heard a dog bark loudly at a cat\" represented as embeddings plus positional vectors for each word position."
    ],
    "exam_tips": [],
    "raw_markdown": "### \ud83c\udfa4 [02:02:46] Positional encoding  \n**Timestamp**: 02:02:46 \u2013 02:04:06\n\n**Key Concepts**  \n- Positional encoding adds information about the position of each token in a sequence to embeddings.  \n- This preserves word order, which is crucial for understanding meaning.  \n- Each token\u2019s embedding is modified by adding a unique positional vector corresponding to its position in the sentence.  \n- Without positional encoding, the model would lose sequence information.  \n- Sentences with the same words in different orders have different positional encodings and thus different representations.\n\n**Definitions**  \n- **Positional Encoding**: A technique to inject token position information into embeddings to preserve word order.\n\n**Key Facts**  \n- Positional vectors are added to each token embedding based on token position (e.g., I_1, heard_2, a_3, etc.).  \n- Repeated words reuse the same positional vector for their respective positions.\n\n**Examples**  \n- Sentence: \"I heard a dog bark loudly at a cat\" represented as embeddings plus positional vectors for each word position.\n\n**Exam Tips \ud83c\udfaf**  \n- Understand why positional encoding is necessary in Transformer models.  \n- Know that positional encoding differentiates sentences with same words but different orders.\n\n---\n\n"
  },
  {
    "section_title": "\ud83c\udfa4 [02:04:27] Attention",
    "chunk_id": 7,
    "timestamp_range": "02:04:27 \u2013 02:06:46",
    "key_concepts": [
      "Attention allows the model to weigh the importance of each word/token relative to others in a sentence.",
      "Self-attention is like each word shining a flashlight on other words to decide relevance.",
      "In the encoder, attention helps represent each word considering its context.",
      "In the decoder, attention helps decide which previous words are important for generating the next word.",
      "Multi-head attention uses multiple \"flashlights\" to focus on different aspects of words simultaneously.",
      "The decoder generates text one word at a time, using attention to guide predictions.",
      "Attention scores are calculated to assign weights to tokens influencing the next word prediction.",
      "The neural network uses these weighted vectors to select the most likely next word from the vocabulary."
    ],
    "definitions": {
      "Attention": "Mechanism to focus on relevant parts of input data when processing or generating language.",
      "Self-Attention": "Each token attends to other tokens in the same sequence to understand context.",
      "Multi-Head Attention": "Multiple attention mechanisms running in parallel to capture different relationships."
    },
    "key_facts": [
      "Attention scores determine influence of each token on the next prediction.",
      "Multi-head attention enriches understanding by looking at multiple perspectives.",
      "The output is built sequentially, with each new word influencing the next."
    ],
    "examples": [
      "In the sentence \"I heard a dog bark loudly at a cat,\" the word \"bark\" pays most attention to \"dog.\"",
      "Multi-head attention might focus on word meaning, grammatical role, and sentence position simultaneously."
    ],
    "exam_tips": [],
    "raw_markdown": "### \ud83c\udfa4 [02:04:27] Attention  \n**Timestamp**: 02:04:27 \u2013 02:06:46\n\n**Key Concepts**  \n- Attention allows the model to weigh the importance of each word/token relative to others in a sentence.  \n- Self-attention is like each word shining a flashlight on other words to decide relevance.  \n- In the encoder, attention helps represent each word considering its context.  \n- In the decoder, attention helps decide which previous words are important for generating the next word.  \n- Multi-head attention uses multiple \"flashlights\" to focus on different aspects of words simultaneously.  \n- The decoder generates text one word at a time, using attention to guide predictions.  \n- Attention scores are calculated to assign weights to tokens influencing the next word prediction.  \n- The neural network uses these weighted vectors to select the most likely next word from the vocabulary.\n\n**Definitions**  \n- **Attention**: Mechanism to focus on relevant parts of input data when processing or generating language.  \n- **Self-Attention**: Each token attends to other tokens in the same sequence to understand context.  \n- **Multi-Head Attention**: Multiple attention mechanisms running in parallel to capture different relationships.\n\n**Key Facts**  \n- Attention scores determine influence of each token on the next prediction.  \n- Multi-head attention enriches understanding by looking at multiple perspectives.  \n- The output is built sequentially, with each new word influencing the next.\n\n**Examples**  \n- In the sentence \"I heard a dog bark loudly at a cat,\" the word \"bark\" pays most attention to \"dog.\"  \n- Multi-head attention might focus on word meaning, grammatical role, and sentence position simultaneously.\n\n**Exam Tips \ud83c\udfaf**  \n- Understand the role of attention in both encoder and decoder.  \n- Know how multi-head attention improves model understanding.  \n- Be able to explain how attention scores influence next word prediction.  \n- Recognize attention as a core mechanism enabling Transformers to generate coherent text.\n\n"
  },
  {
    "section_title": "\ud83c\udfa4 [02:08:01] Introduction to Azure OpenAI Service",
    "chunk_id": 8,
    "timestamp_range": "02:07:43 \u2013 02:10:42",
    "key_concepts": [
      "Azure OpenAI Service is a cloud-based platform for deploying and managing advanced language models from OpenAI.",
      "Combines OpenAI\u2019s latest language model developments with Azure\u2019s security and scalability.",
      "Supports multiple model types for different purposes: GPT-4, GPT-3.5, embedding models, and DALL\u00b7E (image generation).",
      "GPT-4 and GPT-3.5 models generate text and programming code from natural language prompts.",
      "GPT-3.5 Turbo is optimized for conversational AI, ideal for chat applications.",
      "Embedding models convert text into numerical sequences for similarity analysis.",
      "DALL\u00b7E models generate images from text descriptions and are accessible via Azure OpenAI Studio without manual setup.",
      "Core concepts include prompts (user input), completions (model output), tokens (text chunks), resources (Azure subscriptions), deployments (model instances), and prompt engineering (crafting effective prompts).",
      "Tokens affect response latency, throughput, and cost; image tokens vary by image size and detail.",
      "Users create Azure resources and deploy models via APIs to use the service.",
      "Prompt engineering is critical to guide model output effectively.",
      "Different models have unique features and pricing suited to various tasks (e.g., Whisper for speech-to-text)."
    ],
    "definitions": {
      "Prompt": "Text command input by the user to the AI model.",
      "Completion": "Text output generated by the AI model in response to a prompt.",
      "Token": "A word or character chunk used internally by the model to process text.",
      "Deployment": "An instance of a model made available for use within Azure.",
      "Prompt Engineering": "The practice of designing prompts to optimize AI responses."
    },
    "key_facts": [
      "Azure OpenAI Service integrates OpenAI models with Azure\u2019s cloud infrastructure.",
      "DALL\u00b7E models are in preview and accessible via Azure OpenAI Studio.",
      "Tokens influence cost and performance; image tokens vary by detail level."
    ],
    "examples": [
      "Prompting GPT-3.5 or GPT-4 to generate code or text based on natural language input.",
      "Using embedding models to compare text similarity.",
      "DALL\u00b7E generating images from descriptive prompts without manual setup."
    ],
    "exam_tips": [],
    "raw_markdown": "### \ud83c\udfa4 [02:08:01] Introduction to Azure OpenAI Service  \n**Timestamp**: 02:07:43 \u2013 02:10:42\n\n**Key Concepts**  \n- Azure OpenAI Service is a cloud-based platform for deploying and managing advanced language models from OpenAI.  \n- Combines OpenAI\u2019s latest language model developments with Azure\u2019s security and scalability.  \n- Supports multiple model types for different purposes: GPT-4, GPT-3.5, embedding models, and DALL\u00b7E (image generation).  \n- GPT-4 and GPT-3.5 models generate text and programming code from natural language prompts.  \n- GPT-3.5 Turbo is optimized for conversational AI, ideal for chat applications.  \n- Embedding models convert text into numerical sequences for similarity analysis.  \n- DALL\u00b7E models generate images from text descriptions and are accessible via Azure OpenAI Studio without manual setup.  \n- Core concepts include prompts (user input), completions (model output), tokens (text chunks), resources (Azure subscriptions), deployments (model instances), and prompt engineering (crafting effective prompts).  \n- Tokens affect response latency, throughput, and cost; image tokens vary by image size and detail.  \n- Users create Azure resources and deploy models via APIs to use the service.  \n- Prompt engineering is critical to guide model output effectively.  \n- Different models have unique features and pricing suited to various tasks (e.g., Whisper for speech-to-text).  \n\n**Definitions**  \n- **Prompt**: Text command input by the user to the AI model.  \n- **Completion**: Text output generated by the AI model in response to a prompt.  \n- **Token**: A word or character chunk used internally by the model to process text.  \n- **Deployment**: An instance of a model made available for use within Azure.  \n- **Prompt Engineering**: The practice of designing prompts to optimize AI responses.  \n\n**Key Facts**  \n- Azure OpenAI Service integrates OpenAI models with Azure\u2019s cloud infrastructure.  \n- DALL\u00b7E models are in preview and accessible via Azure OpenAI Studio.  \n- Tokens influence cost and performance; image tokens vary by detail level.  \n\n**Examples**  \n- Prompting GPT-3.5 or GPT-4 to generate code or text based on natural language input.  \n- Using embedding models to compare text similarity.  \n- DALL\u00b7E generating images from descriptive prompts without manual setup.  \n\n**Exam Tips \ud83c\udfaf**  \n- Understand the different model types and their primary use cases within Azure OpenAI Service.  \n- Know the role of tokens in cost and performance.  \n- Be familiar with core concepts like prompts, completions, deployments, and prompt engineering.  \n- Recognize that Azure OpenAI Service leverages Azure\u2019s security and scalability features.  \n\n---\n\n"
  },
  {
    "section_title": "\ud83c\udfa4 [02:10:42] Azure OpenAI Studio",
    "chunk_id": 8,
    "timestamp_range": "02:10:42 \u2013 02:11:40",
    "key_concepts": [
      "Azure OpenAI Studio is a web-based environment for deploying, testing, and managing large language models (LLMs) on Azure.",
      "Access is currently limited due to high demand and Microsoft\u2019s responsible AI commitments.",
      "Priority access is given to partners, low-risk use cases, and those implementing safeguards.",
      "Studio allows deployment of LLMs, providing few-shot examples and testing in a chat playground.",
      "The chat playground interface includes:"
    ],
    "definitions": {
      "Few-shot examples": "Providing a small number of examples in prompts to guide model responses.",
      "Chat playground": "Interactive interface to test and configure AI chatbots."
    },
    "key_facts": [
      "Azure OpenAI Studio supports generative AI app development on Azure.",
      "Adjustable parameters help tailor AI response behavior."
    ],
    "examples": [
      "Testing an AI chatbot\u2019s responses and tweaking parameters to improve output quality."
    ],
    "exam_tips": [],
    "raw_markdown": "### \ud83c\udfa4 [02:10:42] Azure OpenAI Studio  \n**Timestamp**: 02:10:42 \u2013 02:11:40\n\n**Key Concepts**  \n- Azure OpenAI Studio is a web-based environment for deploying, testing, and managing large language models (LLMs) on Azure.  \n- Access is currently limited due to high demand and Microsoft\u2019s responsible AI commitments.  \n- Priority access is given to partners, low-risk use cases, and those implementing safeguards.  \n- Studio allows deployment of LLMs, providing few-shot examples and testing in a chat playground.  \n- The chat playground interface includes:  \n  - A chat area for user input and AI responses.  \n  - Navigation menu on the left.  \n  - Assistant setup section with save reminders.  \n  - Adjustable parameters on the right to control response length, randomness, and repetition.  \n- Users can fine-tune AI behavior by adjusting settings and observing responses.  \n\n**Definitions**  \n- **Few-shot examples**: Providing a small number of examples in prompts to guide model responses.  \n- **Chat playground**: Interactive interface to test and configure AI chatbots.  \n\n**Key Facts**  \n- Azure OpenAI Studio supports generative AI app development on Azure.  \n- Adjustable parameters help tailor AI response behavior.  \n\n**Examples**  \n- Testing an AI chatbot\u2019s responses and tweaking parameters to improve output quality.  \n\n**Exam Tips \ud83c\udfaf**  \n- Know that Azure OpenAI Studio is the main interface for working with Azure OpenAI models.  \n- Understand the purpose of few-shot examples and parameter tuning in the studio.  \n- Be aware of current access limitations and Microsoft\u2019s responsible AI focus.  \n\n---\n\n"
  },
  {
    "section_title": "\ud83c\udfa4 [02:11:44] Azure OpenAI service pricing",
    "chunk_id": 8,
    "timestamp_range": "02:11:40 \u2013 02:13:31",
    "key_concepts": [
      "Pricing is usage-based, primarily per 1,000 tokens processed (prompt and completion).",
      "Different models have different pricing tiers based on capabilities and context window size.",
      "GPT-3.5 Turbo (4K token context):"
    ],
    "definitions": {
      "Context window": "The maximum number of tokens the model can consider at once."
    },
    "key_facts": [
      "Pricing is pay-as-you-go, based on token usage or compute hours.",
      "Larger context windows increase cost.",
      "More advanced models are more expensive."
    ],
    "examples": [
      "Using GPT-4 with 8K context costs 3 cents per 1,000 prompt tokens and 6 cents per 1,000 completion tokens."
    ],
    "exam_tips": [],
    "raw_markdown": "### \ud83c\udfa4 [02:11:44] Azure OpenAI service pricing  \n**Timestamp**: 02:11:40 \u2013 02:13:31\n\n**Key Concepts**  \n- Pricing is usage-based, primarily per 1,000 tokens processed (prompt and completion).  \n- Different models have different pricing tiers based on capabilities and context window size.  \n- GPT-3.5 Turbo (4K token context):  \n  - $0.0015 per 1,000 prompt tokens  \n  - $0.002 per 1,000 completion tokens  \n- GPT-3.5 Turbo (16K token context):  \n  - $0.003 per 1,000 prompt tokens  \n  - $0.004 per 1,000 completion tokens  \n- GPT-4 standard (8K token context):  \n  - $0.03 per 1,000 prompt tokens  \n  - $0.06 per 1,000 completion tokens  \n- GPT-4 large context (32K tokens):  \n  - $0.06 per 1,000 prompt tokens  \n  - $0.12 per 1,000 completion tokens  \n- GPT-4 Turbo and GPT-3.5 Turbo 16K have no publicly listed prices yet.  \n- Other models (base, fine-tuning, image, embedding, speech) have separate pricing.  \n- Higher quality and larger context models cost more.  \n\n**Definitions**  \n- **Context window**: The maximum number of tokens the model can consider at once.  \n\n**Key Facts**  \n- Pricing is pay-as-you-go, based on token usage or compute hours.  \n- Larger context windows increase cost.  \n- More advanced models are more expensive.  \n\n**Examples**  \n- Using GPT-4 with 8K context costs 3 cents per 1,000 prompt tokens and 6 cents per 1,000 completion tokens.  \n\n**Exam Tips \ud83c\udfaf**  \n- Understand pricing differences between GPT-3.5 Turbo and GPT-4 models.  \n- Know that token count affects cost and that larger context windows are pricier.  \n- Be aware that pricing varies by model type and usage.  \n\n---\n\n"
  },
  {
    "section_title": "\ud83c\udfa4 [02:13:14] What are Copilots",
    "chunk_id": 8,
    "timestamp_range": "02:13:31 \u2013 02:15:58",
    "key_concepts": [
      "Copilots are AI-powered assistants integrated into applications to help users with common tasks using generative AI models.",
      "Built on a standard architecture allowing customization for specific business needs.",
      "Copilots leverage pre-trained large language models (LLMs) from Azure OpenAI Service, optionally fine-tuned with domain-specific data.",
      "They assist by generating content, synthesizing information, and aiding strategic planning.",
      "Examples include Microsoft Copilot integrated into Office apps, Bing search copilot, Microsoft 365 Copilot, and GitHub Copilot for developers.",
      "Copilots enhance productivity by providing first drafts, summarizations, code suggestions, and testing support."
    ],
    "definitions": {
      "Copilot": "An AI assistant embedded in software applications to augment user productivity."
    },
    "key_facts": [
      "Microsoft Copilot is embedded in Office apps for document creation, spreadsheets, presentations, and email management.",
      "Bing\u2019s copilot provides natural language answers during web searches.",
      "GitHub Copilot assists developers with code generation, documentation, and testing."
    ],
    "examples": [
      "Microsoft 365 Copilot helping craft documents and manage emails.",
      "GitHub Copilot suggesting code snippets and helping with code testing."
    ],
    "exam_tips": [],
    "raw_markdown": "### \ud83c\udfa4 [02:13:14] What are Copilots  \n**Timestamp**: 02:13:31 \u2013 02:15:58\n\n**Key Concepts**  \n- Copilots are AI-powered assistants integrated into applications to help users with common tasks using generative AI models.  \n- Built on a standard architecture allowing customization for specific business needs.  \n- Copilots leverage pre-trained large language models (LLMs) from Azure OpenAI Service, optionally fine-tuned with domain-specific data.  \n- They assist by generating content, synthesizing information, and aiding strategic planning.  \n- Examples include Microsoft Copilot integrated into Office apps, Bing search copilot, Microsoft 365 Copilot, and GitHub Copilot for developers.  \n- Copilots enhance productivity by providing first drafts, summarizations, code suggestions, and testing support.  \n\n**Definitions**  \n- **Copilot**: An AI assistant embedded in software applications to augment user productivity.  \n\n**Key Facts**  \n- Microsoft Copilot is embedded in Office apps for document creation, spreadsheets, presentations, and email management.  \n- Bing\u2019s copilot provides natural language answers during web searches.  \n- GitHub Copilot assists developers with code generation, documentation, and testing.  \n\n**Examples**  \n- Microsoft 365 Copilot helping craft documents and manage emails.  \n- GitHub Copilot suggesting code snippets and helping with code testing.  \n\n**Exam Tips \ud83c\udfaf**  \n- Know the concept of copilots as AI assistants integrated into apps.  \n- Be familiar with Microsoft\u2019s implementations of copilots across productivity and development tools.  \n- Understand how copilots use generative AI to enhance workflows.  \n\n---\n\n"
  },
  {
    "section_title": "\ud83c\udfa4 [02:15:43] Prompt engineering",
    "chunk_id": 8,
    "timestamp_range": "02:15:58 \u2013 02:18:46",
    "key_concepts": [
      "Prompt engineering is the process of refining instructions (prompts) given to generative AI to improve response quality.",
      "Important for both developers building AI apps and end users interacting with AI.",
      "Techniques include defining system messages that set context, constraints, and style (e.g., \u201cYou are a helpful assistant responding cheerfully\u201d).",
      "Prompts should be precise and explicit to get targeted, relevant outputs.",
      "Examples of prompt types: zero-shot (no examples), one-shot (single example).",
      "Effective prompt engineering involves iterative refinement of prompts and outputs."
    ],
    "definitions": {
      "System message": "A prompt component that sets the AI\u2019s behavior and response style.",
      "Zero-shot learning": "AI performs a task without prior examples.",
      "One-shot learning": "AI learns from a single example to perform a task."
    },
    "key_facts": [
      "Well-structured prompts yield better AI responses.",
      "Iterative improvement is key to prompt engineering success."
    ],
    "examples": [
      "Prompt: \u201cCreate a list of 10 things to do in Edinburgh during August.\u201d",
      "User query example: \u201cCan my camera handle the rainy season in the Amazon rainforest next week?\u201d with prompt engineering integrating weather data, product specs, and travel tips."
    ],
    "exam_tips": [],
    "raw_markdown": "### \ud83c\udfa4 [02:15:43] Prompt engineering  \n**Timestamp**: 02:15:58 \u2013 02:18:46\n\n**Key Concepts**  \n- Prompt engineering is the process of refining instructions (prompts) given to generative AI to improve response quality.  \n- Important for both developers building AI apps and end users interacting with AI.  \n- Techniques include defining system messages that set context, constraints, and style (e.g., \u201cYou are a helpful assistant responding cheerfully\u201d).  \n- Prompts should be precise and explicit to get targeted, relevant outputs.  \n- Examples of prompt types: zero-shot (no examples), one-shot (single example).  \n- Effective prompt engineering involves iterative refinement of prompts and outputs.  \n\n**Definitions**  \n- **System message**: A prompt component that sets the AI\u2019s behavior and response style.  \n- **Zero-shot learning**: AI performs a task without prior examples.  \n- **One-shot learning**: AI learns from a single example to perform a task.  \n\n**Key Facts**  \n- Well-structured prompts yield better AI responses.  \n- Iterative improvement is key to prompt engineering success.  \n\n**Examples**  \n- Prompt: \u201cCreate a list of 10 things to do in Edinburgh during August.\u201d  \n- User query example: \u201cCan my camera handle the rainy season in the Amazon rainforest next week?\u201d with prompt engineering integrating weather data, product specs, and travel tips.  \n\n**Exam Tips \ud83c\udfaf**  \n- Understand the role of system messages in guiding AI behavior.  \n- Know the difference between zero-shot and one-shot learning in prompt design.  \n- Practice crafting clear, explicit prompts for best results.  \n- Remember prompt engineering is iterative.  \n\n---\n\n"
  },
  {
    "section_title": "\ud83c\udfa4 [02:18:51] Grounding",
    "chunk_id": 8,
    "timestamp_range": "02:18:46 \u2013 02:20:42",
    "key_concepts": [
      "Grounding is a prompt engineering technique that provides specific, relevant context within a prompt to improve AI accuracy and relevance.",
      "It enables LLMs to perform tasks without explicit training by including necessary information in the prompt.",
      "Grounding differs from general prompt engineering by focusing on enriching prompts with context rather than just formatting or style.",
      "Grounding helps ensure AI outputs are accurate and aligned with responsible AI principles.",
      "Framework includes prompt engineering (broad), fine-tuning (training on specific data), and training (resource-intensive customization).",
      "LLM Ops and responsible AI practices underpin all stages of model development and deployment."
    ],
    "definitions": {
      "Grounding": "Adding relevant context to prompts to help AI generate accurate, context-aware responses.",
      "Fine-tuning": "Training an LLM on specific data to improve performance on particular tasks."
    },
    "key_facts": [
      "Grounding allows leveraging LLMs for new tasks without retraining.",
      "Responsible AI and operational efficiency are critical throughout AI lifecycle."
    ],
    "examples": [
      "Including the full text of an email in a prompt to get an accurate summary."
    ],
    "exam_tips": [],
    "raw_markdown": "### \ud83c\udfa4 [02:18:51] Grounding  \n**Timestamp**: 02:18:46 \u2013 02:20:42\n\n**Key Concepts**  \n- Grounding is a prompt engineering technique that provides specific, relevant context within a prompt to improve AI accuracy and relevance.  \n- It enables LLMs to perform tasks without explicit training by including necessary information in the prompt.  \n- Grounding differs from general prompt engineering by focusing on enriching prompts with context rather than just formatting or style.  \n- Grounding helps ensure AI outputs are accurate and aligned with responsible AI principles.  \n- Framework includes prompt engineering (broad), fine-tuning (training on specific data), and training (resource-intensive customization).  \n- LLM Ops and responsible AI practices underpin all stages of model development and deployment.  \n\n**Definitions**  \n- **Grounding**: Adding relevant context to prompts to help AI generate accurate, context-aware responses.  \n- **Fine-tuning**: Training an LLM on specific data to improve performance on particular tasks.  \n\n**Key Facts**  \n- Grounding allows leveraging LLMs for new tasks without retraining.  \n- Responsible AI and operational efficiency are critical throughout AI lifecycle.  \n\n**Examples**  \n- Including the full text of an email in a prompt to get an accurate summary.  \n\n**Exam Tips \ud83c\udfaf**  \n- Know the difference between prompt engineering and grounding.  \n- Understand grounding\u2019s role in improving AI task accuracy without retraining.  \n- Be aware of the AI development hierarchy: prompt engineering \u2192 fine-tuning \u2192 training.  \n\n---\n\n"
  },
  {
    "section_title": "\ud83c\udfa4 [02:20:36] Copilot demo",
    "chunk_id": 8,
    "timestamp_range": "02:20:42 \u2013 02:25:38",
    "key_concepts": [
      "Demonstration of using GPT-4 powered copilot via Microsoft Bing.",
      "Users can access copilot by searching \u201ccopilot Bing\u201d and entering the interface.",
      "Popular prompt examples include image generation, idea generation, explanations, and code writing.",
      "Conversation style can be adjusted: creative, balanced, or precise.",
      "Copilot can generate text answers, code snippets in multiple languages, and images via DALL\u00b7E 3 integration.",
      "Users can modify generated images (e.g., add rainbow, change dog to cat, alter sky colors).",
      "Code generation examples include Python function to check prime numbers and JavaScript function to reverse strings.",
      "Copilot provides credible, sourced information with clickable links for further reading."
    ],
    "definitions": {
      "Copilot Bing": "Microsoft Bing search enhanced with GPT-4 powered AI assistant."
    },
    "key_facts": [
      "Copilot supports multi-language code generation.",
      "Integrated with DALL\u00b7E 3 for image creation and editing.",
      "Provides follow-up question suggestions and source links."
    ],
    "examples": [
      "Prompt: \u201cSummarize the main differences between supervised and unsupervised learning for the AI-900 exam.\u201d",
      "Prompt: \u201cCreate an image of a cute dog running through a green field on a sunny day.\u201d",
      "Prompt: \u201cWrite a Python function to check if a number is prime.\u201d",
      "Prompt: \u201cCreate a JavaScript function to reverse a string.\u201d"
    ],
    "exam_tips": [],
    "raw_markdown": "### \ud83c\udfa4 [02:20:36] Copilot demo  \n**Timestamp**: 02:20:42 \u2013 02:25:38\n\n**Key Concepts**  \n- Demonstration of using GPT-4 powered copilot via Microsoft Bing.  \n- Users can access copilot by searching \u201ccopilot Bing\u201d and entering the interface.  \n- Popular prompt examples include image generation, idea generation, explanations, and code writing.  \n- Conversation style can be adjusted: creative, balanced, or precise.  \n- Copilot can generate text answers, code snippets in multiple languages, and images via DALL\u00b7E 3 integration.  \n- Users can modify generated images (e.g., add rainbow, change dog to cat, alter sky colors).  \n- Code generation examples include Python function to check prime numbers and JavaScript function to reverse strings.  \n- Copilot provides credible, sourced information with clickable links for further reading.  \n\n**Definitions**  \n- **Copilot Bing**: Microsoft Bing search enhanced with GPT-4 powered AI assistant.  \n\n**Key Facts**  \n- Copilot supports multi-language code generation.  \n- Integrated with DALL\u00b7E 3 for image creation and editing.  \n- Provides follow-up question suggestions and source links.  \n\n**Examples**  \n- Prompt: \u201cSummarize the main differences between supervised and unsupervised learning for the AI-900 exam.\u201d  \n- Prompt: \u201cCreate an image of a cute dog running through a green field on a sunny day.\u201d  \n- Prompt: \u201cWrite a Python function to check if a number is prime.\u201d  \n- Prompt: \u201cCreate a JavaScript function to reverse a string.\u201d  \n\n**Exam Tips \ud83c\udfaf**  \n- Familiarize with copilot capabilities: text generation, code writing, image creation.  \n- Understand how to adjust conversation style for different outputs.  \n- Recognize copilot\u2019s integration with other Azure OpenAI services like DALL\u00b7E.  \n- Use copilot for exam study by generating explanations and summaries.  \n\n"
  },
  {
    "section_title": "\ud83c\udfa4 [02:26:45] Azure Machine Learning Service",
    "chunk_id": 9,
    "timestamp_range": "02:26:35 \u2013 02:27:31",
    "key_concepts": [
      "Azure Machine Learning Service provides different compute options:"
    ],
    "definitions": {
      "Compute Instance": "A virtual machine for development and running notebooks in Azure ML",
      "GPU Compute": "Specialized hardware for faster ML training and inference, more costly than CPU"
    },
    "key_facts": [
      "GPU compute costs approximately $0.90 per hour for notebook usage",
      "CPU compute is sufficient for running cognitive services and lightweight ML tasks"
    ],
    "examples": [
      "Creating a new compute instance for notebooks with CPU to reduce cost",
      "Launching JupyterLab from Azure ML Studio for consistency in development"
    ],
    "exam_tips": [],
    "raw_markdown": "### \ud83c\udfa4 [02:26:45] Azure Machine Learning Service  \n**Timestamp**: 02:26:35 \u2013 02:27:31\n\n**Key Concepts**  \n- Azure Machine Learning Service provides different compute options:  \n  - Compute Instances: for running notebooks (development, lightweight testing)  \n  - Compute Clusters: for training models  \n  - Inference Clusters: for inference pipelines  \n  - Attached Compute: integrating external compute resources like HDInsight or Databricks  \n- Compute Instances can be CPU or GPU based; GPU is more expensive (~$0.90/hour)  \n- For notebook development and running cognitive services, a CPU instance is sufficient and cost-effective  \n- Notebook instances support multiple launch options: JupyterLab, Jupyter Notebook, VS Code, R Studio, Terminal  \n- Python kernel version may vary (3.6 vs 3.8), but this is generally not critical for most tasks  \n\n**Definitions**  \n- **Compute Instance**: A virtual machine for development and running notebooks in Azure ML  \n- **GPU Compute**: Specialized hardware for faster ML training and inference, more costly than CPU  \n\n**Key Facts**  \n- GPU compute costs approximately $0.90 per hour for notebook usage  \n- CPU compute is sufficient for running cognitive services and lightweight ML tasks  \n\n**Examples**  \n- Creating a new compute instance for notebooks with CPU to reduce cost  \n- Launching JupyterLab from Azure ML Studio for consistency in development  \n\n**Exam Tips \ud83c\udfaf**  \n- Understand the different compute types in Azure ML and their use cases  \n- Know when to choose CPU vs GPU compute instances based on workload and cost  \n- Be familiar with launching notebooks via Azure ML Studio and selecting the correct compute target  \n\n\n"
  },
  {
    "section_title": "\ud83c\udfa4 [02:27:58] Juypter Notebooks",
    "chunk_id": 9,
    "timestamp_range": "02:27:31 \u2013 02:29:41",
    "key_concepts": [
      "JupyterLab can be launched from Azure ML Studio to edit and run notebooks",
      "Sometimes direct links to JupyterLab may not respond immediately; navigating via the compute tab can help",
      "Notebooks can be used to run code that interacts with Azure Cognitive Services",
      "Code and assets can be uploaded to the notebook environment for use in experiments",
      "Uploading entire folders may not be supported; individual files can be uploaded and organized into folders",
      "Organizing assets (images, data files) into folders within the notebook environment helps manage resources"
    ],
    "definitions": {
      "JupyterLab": "An interactive development environment for notebooks, code, and data",
      "Notebook Kernel": "The computational engine that executes the code contained in a notebook"
    },
    "key_facts": [
      "Python 3.6 kernel is commonly used but newer versions like 3.8 are available",
      "Uploading multiple files individually is necessary as folder upload is not supported"
    ],
    "examples": [
      "Downloading a public GitHub repo zip file, extracting, and uploading individual files to the notebook environment",
      "Creating folders like \"cognitive services\" to organize uploaded files such as images and data for OCR and classification"
    ],
    "exam_tips": [],
    "raw_markdown": "### \ud83c\udfa4 [02:27:58] Juypter Notebooks  \n**Timestamp**: 02:27:31 \u2013 02:29:41\n\n**Key Concepts**  \n- JupyterLab can be launched from Azure ML Studio to edit and run notebooks  \n- Sometimes direct links to JupyterLab may not respond immediately; navigating via the compute tab can help  \n- Notebooks can be used to run code that interacts with Azure Cognitive Services  \n- Code and assets can be uploaded to the notebook environment for use in experiments  \n- Uploading entire folders may not be supported; individual files can be uploaded and organized into folders  \n- Organizing assets (images, data files) into folders within the notebook environment helps manage resources  \n\n**Definitions**  \n- **JupyterLab**: An interactive development environment for notebooks, code, and data  \n- **Notebook Kernel**: The computational engine that executes the code contained in a notebook  \n\n**Key Facts**  \n- Python 3.6 kernel is commonly used but newer versions like 3.8 are available  \n- Uploading multiple files individually is necessary as folder upload is not supported  \n\n**Examples**  \n- Downloading a public GitHub repo zip file, extracting, and uploading individual files to the notebook environment  \n- Creating folders like \"cognitive services\" to organize uploaded files such as images and data for OCR and classification  \n\n**Exam Tips \ud83c\udfaf**  \n- Know how to launch and navigate Jupyter notebooks in Azure ML Studio  \n- Understand how to upload and organize files within the notebook environment  \n- Be aware of kernel versions and their impact on running code  \n\n\n"
  },
  {
    "section_title": "\ud83c\udfa4 [02:32:10] Azure Cognitive Services",
    "chunk_id": 9,
    "timestamp_range": "02:31:36 \u2013 02:34:56",
    "key_concepts": [
      "Azure Cognitive Services can be accessed via a unified API key and endpoint",
      "Cognitive Services resources are created in the Azure portal via the marketplace",
      "Pricing is variable but free tiers allow thousands of transactions before billing applies",
      "Responsible AI considerations are highlighted during resource creation",
      "Once deployed, Cognitive Services provide two keys and two endpoints; only one key is needed for use",
      "Keys and endpoints are used to authenticate API calls from notebooks or applications",
      "Keys should be kept secret and not publicly shared or embedded in notebooks in production"
    ],
    "definitions": {
      "Cognitive Services": "A suite of pre-built AI APIs for vision, speech, language, and decision-making",
      "API Key and Endpoint": "Credentials used to authenticate and access Azure Cognitive Services"
    },
    "key_facts": [
      "Cognitive Services resource creation includes selecting region, pricing tier (Standard), and naming",
      "Responsible AI checkbox or notice is part of the creation process",
      "Two keys and two endpoints are generated; one key is sufficient for use"
    ],
    "examples": [
      "Creating a Cognitive Services resource named \"Cog Services\" in US East region",
      "Copying the endpoint and key into Jupyter notebooks to authenticate API calls"
    ],
    "exam_tips": [],
    "raw_markdown": "### \ud83c\udfa4 [02:32:10] Azure Cognitive Services  \n**Timestamp**: 02:31:36 \u2013 02:34:56\n\n**Key Concepts**  \n- Azure Cognitive Services can be accessed via a unified API key and endpoint  \n- Cognitive Services resources are created in the Azure portal via the marketplace  \n- Pricing is variable but free tiers allow thousands of transactions before billing applies  \n- Responsible AI considerations are highlighted during resource creation  \n- Once deployed, Cognitive Services provide two keys and two endpoints; only one key is needed for use  \n- Keys and endpoints are used to authenticate API calls from notebooks or applications  \n- Keys should be kept secret and not publicly shared or embedded in notebooks in production  \n\n**Definitions**  \n- **Cognitive Services**: A suite of pre-built AI APIs for vision, speech, language, and decision-making  \n- **API Key and Endpoint**: Credentials used to authenticate and access Azure Cognitive Services  \n\n**Key Facts**  \n- Cognitive Services resource creation includes selecting region, pricing tier (Standard), and naming  \n- Responsible AI checkbox or notice is part of the creation process  \n- Two keys and two endpoints are generated; one key is sufficient for use  \n\n**Examples**  \n- Creating a Cognitive Services resource named \"Cog Services\" in US East region  \n- Copying the endpoint and key into Jupyter notebooks to authenticate API calls  \n\n**Exam Tips \ud83c\udfaf**  \n- Understand how to create and configure Cognitive Services in Azure portal  \n- Know the purpose of API keys and endpoints and best practices for managing them  \n- Be aware of the free tier usage limits and pricing considerations  \n\n\n"
  },
  {
    "section_title": "\ud83c\udfa4 [02:35:02] Computer Vision",
    "chunk_id": 9,
    "timestamp_range": "02:34:56 \u2013 02:38:40",
    "key_concepts": [
      "Computer Vision is an umbrella service for various image-related AI tasks",
      "The \"describe image in stream\" operation generates human-readable image descriptions with confidence scores",
      "Requires installing Azure Cognitive Services Vision SDK via pip in the notebook environment",
      "Additional Python libraries used include OS, matplotlib (for image display), and numpy",
      "Authentication uses Cognitive Services credentials (endpoint and key)",
      "Images are loaded as streams to be passed to the API",
      "The API returns tags and captions with confidence scores",
      "Captions may not always capture contextual or cultural knowledge (e.g., Star Trek characters)"
    ],
    "definitions": {
      "Describe Image in Stream": "API operation that returns a textual description of an image along with tags and confidence scores",
      "Confidence Score": "A numerical value indicating the likelihood that the description or tag is accurate"
    },
    "key_facts": [
      "Azure Cognitive Services Vision SDK is not pre-installed and must be installed manually",
      "Captions are returned as a list with associated confidence scores",
      "Example caption: \"Brent Spiner looking at a camera\" with 57.45% confidence"
    ],
    "examples": [
      "Loading an image file \"data.jpg\" from assets folder and passing it as a stream to the describe API",
      "Displaying the image with matplotlib and printing captions with confidence scores"
    ],
    "exam_tips": [],
    "raw_markdown": "### \ud83c\udfa4 [02:35:02] Computer Vision  \n**Timestamp**: 02:34:56 \u2013 02:38:40\n\n**Key Concepts**  \n- Computer Vision is an umbrella service for various image-related AI tasks  \n- The \"describe image in stream\" operation generates human-readable image descriptions with confidence scores  \n- Requires installing Azure Cognitive Services Vision SDK via pip in the notebook environment  \n- Additional Python libraries used include OS, matplotlib (for image display), and numpy  \n- Authentication uses Cognitive Services credentials (endpoint and key)  \n- Images are loaded as streams to be passed to the API  \n- The API returns tags and captions with confidence scores  \n- Captions may not always capture contextual or cultural knowledge (e.g., Star Trek characters)  \n\n**Definitions**  \n- **Describe Image in Stream**: API operation that returns a textual description of an image along with tags and confidence scores  \n- **Confidence Score**: A numerical value indicating the likelihood that the description or tag is accurate  \n\n**Key Facts**  \n- Azure Cognitive Services Vision SDK is not pre-installed and must be installed manually  \n- Captions are returned as a list with associated confidence scores  \n- Example caption: \"Brent Spiner looking at a camera\" with 57.45% confidence  \n\n**Examples**  \n- Loading an image file \"data.jpg\" from assets folder and passing it as a stream to the describe API  \n- Displaying the image with matplotlib and printing captions with confidence scores  \n\n**Exam Tips \ud83c\udfaf**  \n- Know how to install and import the Azure Cognitive Services Vision SDK in notebooks  \n- Understand how to authenticate and call the describe image API  \n- Be familiar with interpreting confidence scores and captions returned by Computer Vision  \n\n\n"
  },
  {
    "section_title": "\ud83c\udfa4 [02:38:44] Custom Vision",
    "chunk_id": 9,
    "timestamp_range": "02:38:40 \u2013 02:45:36",
    "key_concepts": [
      "Custom Vision allows building custom image classification and object detection models",
      "Custom Vision resource can be created via Azure portal marketplace or through the Custom Vision website linked to Azure account",
      "Projects can be created for classification (single or multi-class) or object detection",
      "Classification modes:"
    ],
    "definitions": {
      "Custom Vision": "Azure service to build, deploy, and improve custom image classifiers and object detectors",
      "Multi-class Classification": "Assigning one exclusive label per image",
      "Multi-label Classification": "Assigning multiple labels per image",
      "Probability Threshold": "Minimum confidence score for a prediction to be considered valid",
      "Precision and Recall": "Metrics to evaluate model accuracy and completeness"
    },
    "key_facts": [
      "Custom Vision projects are linked to Azure Cognitive Services resources",
      "Training can take 5-10 minutes depending on dataset and training mode",
      "Published models provide REST endpoints for integration",
      "Quick test allows immediate validation of model predictions on new images"
    ],
    "examples": [
      "Creating a project \"Star Trek crew\" to classify images of Star Trek characters (Worf, Data, Crusher)",
      "Uploading images and tagging them with character names",
      "Training the model with quick training and achieving 100% match on evaluation metrics",
      "Testing with new images: Worf identified with 98.7% confidence, other characters matched correctly",
      "Starting a new object detection project to detect \"combadge\" with tagged images"
    ],
    "exam_tips": [],
    "raw_markdown": "### \ud83c\udfa4 [02:38:44] Custom Vision  \n**Timestamp**: 02:38:40 \u2013 02:45:36\n\n**Key Concepts**  \n- Custom Vision allows building custom image classification and object detection models  \n- Custom Vision resource can be created via Azure portal marketplace or through the Custom Vision website linked to Azure account  \n- Projects can be created for classification (single or multi-class) or object detection  \n- Classification modes:  \n  - Multi-label: multiple tags per image (e.g., dog and cat in one photo)  \n  - Multi-class: one label per image (exclusive categories)  \n- Domains optimize models for different scenarios; General A2 domain is optimized for speed and used in demo  \n- Tags (labels) are created before uploading images for training  \n- Images are uploaded and tagged accordingly  \n- Training options: quick training (faster, less accurate) and advanced training (longer, more accurate)  \n- Probability threshold controls minimum confidence for valid predictions  \n- Evaluation metrics include precision, recall, and average precision to assess model quality  \n- Quick test feature allows testing model predictions with local images  \n- Models can be published to generate a public endpoint for programmatic access  \n- Object detection identifies and localizes objects within images, requiring bounding box annotations  \n\n**Definitions**  \n- **Custom Vision**: Azure service to build, deploy, and improve custom image classifiers and object detectors  \n- **Multi-class Classification**: Assigning one exclusive label per image  \n- **Multi-label Classification**: Assigning multiple labels per image  \n- **Probability Threshold**: Minimum confidence score for a prediction to be considered valid  \n- **Precision and Recall**: Metrics to evaluate model accuracy and completeness  \n\n**Key Facts**  \n- Custom Vision projects are linked to Azure Cognitive Services resources  \n- Training can take 5-10 minutes depending on dataset and training mode  \n- Published models provide REST endpoints for integration  \n- Quick test allows immediate validation of model predictions on new images  \n\n**Examples**  \n- Creating a project \"Star Trek crew\" to classify images of Star Trek characters (Worf, Data, Crusher)  \n- Uploading images and tagging them with character names  \n- Training the model with quick training and achieving 100% match on evaluation metrics  \n- Testing with new images: Worf identified with 98.7% confidence, other characters matched correctly  \n- Starting a new object detection project to detect \"combadge\" with tagged images  \n\n**Exam Tips \ud83c\udfaf**  \n- Understand the difference between classification and object detection in Custom Vision  \n- Know how to create projects, upload/tag images, train, test, and publish models  \n- Be familiar with evaluation metrics and their significance  \n- Remember that object detection requires bounding box annotations and is different from classification  \n- Know how to access Custom Vision via Azure portal and the Custom Vision website"
  },
  {
    "section_title": "\ud83c\udfa4 [02:51:18] Face Service",
    "chunk_id": 10,
    "timestamp_range": "02:51:38 \u2013 02:54:04",
    "key_concepts": [
      "Face Service is part of the Azure Computer Vision API.",
      "Uses Face Client with Cognitive Service credentials for authentication.",
      "Detects faces in images and returns face IDs and bounding boxes.",
      "Can detect additional face attributes like age, emotion, makeup, and gender if image resolution is sufficient.",
      "Bounding boxes are drawn using face rectangle coordinates (top, left, right, bottom).",
      "Face attributes are returned as a dictionary and can be iterated for detailed info."
    ],
    "definitions": {
      "Face ID": "A unique identifier for each detected face in an image.",
      "Face Rectangle": "Coordinates defining the bounding box around a detected face.",
      "Face Attributes": "Additional metadata about a face such as age, emotion, gender, and makeup."
    },
    "key_facts": [
      "Low-resolution images may not return detailed face attributes.",
      "Makeup detection focuses on lips and eyes only.",
      "The bounding box color and thickness can be customized (e.g., magenta color, thickness 3)."
    ],
    "examples": [
      "Detected one face in an image and drew a bounding box with annotation of the face ID.",
      "Estimated age approximately 44 years old for the detected face.",
      "Gender detected as male-presenting, but the subject was an Android character (non-human).",
      "Makeup detection returned no makeup detected despite visible makeup."
    ],
    "exam_tips": [],
    "raw_markdown": "### \ud83c\udfa4 [02:51:18] Face Service  \n**Timestamp**: 02:51:38 \u2013 02:54:04\n\n**Key Concepts**  \n- Face Service is part of the Azure Computer Vision API.  \n- Uses Face Client with Cognitive Service credentials for authentication.  \n- Detects faces in images and returns face IDs and bounding boxes.  \n- Can detect additional face attributes like age, emotion, makeup, and gender if image resolution is sufficient.  \n- Bounding boxes are drawn using face rectangle coordinates (top, left, right, bottom).  \n- Face attributes are returned as a dictionary and can be iterated for detailed info.\n\n**Definitions**  \n- **Face ID**: A unique identifier for each detected face in an image.  \n- **Face Rectangle**: Coordinates defining the bounding box around a detected face.  \n- **Face Attributes**: Additional metadata about a face such as age, emotion, gender, and makeup.\n\n**Key Facts**  \n- Low-resolution images may not return detailed face attributes.  \n- Makeup detection focuses on lips and eyes only.  \n- The bounding box color and thickness can be customized (e.g., magenta color, thickness 3).  \n\n**Examples**  \n- Detected one face in an image and drew a bounding box with annotation of the face ID.  \n- Estimated age approximately 44 years old for the detected face.  \n- Gender detected as male-presenting, but the subject was an Android character (non-human).  \n- Makeup detection returned no makeup detected despite visible makeup.\n\n**Exam Tips \ud83c\udfaf**  \n- Know that Face Service requires sufficient image resolution for detailed attribute detection.  \n- Understand the difference between face detection (bounding boxes, IDs) and face attribute extraction (age, emotion, etc.).  \n- Face Service uses Cognitive Service credentials similar to other Azure Cognitive Services.  \n- Be familiar with how to interpret face detection results and attributes programmatically.\n\n---\n\n"
  },
  {
    "section_title": "\ud83c\udfa4 [02:54:40] Form Recognizer",
    "chunk_id": 10,
    "timestamp_range": "02:54:40 \u2013 02:57:55",
    "key_concepts": [
      "Azure Form Recognizer extracts structured data from forms such as receipts.",
      "Uses a different client and authentication method (Azure Key Credential) than other Cognitive Services.",
      "Supports predefined fields for receipts like Merchant Name, Phone Number, Total Price, etc.",
      "Can analyze receipt images and return recognized fields with values.",
      "Some field names may have spaces or formatting inconsistencies (e.g., \"Total Price\").",
      "Results include recognized form fields and their values."
    ],
    "definitions": {
      "Form Recognizer": "Azure AI service that extracts key-value pairs and tables from documents and forms.",
      "Predefined Fields": "Standardized fields recognized by the service for specific form types (e.g., receipts)."
    },
    "key_facts": [
      "Form Recognizer requires Azure Key Credential, not Cognitive Service Credential.",
      "Merchant phone number and name are reliably extracted fields.",
      "Field names may not always match expected keys exactly (e.g., spacing issues).",
      "The service may not always extract all fields perfectly; results can vary."
    ],
    "examples": [
      "Extracted Merchant Name as \"Almdraft Out Cinema\" from a receipt image.",
      "Successfully retrieved Merchant Phone Number (e.g., 512707).",
      "Attempted to extract \"Total Price\" but had to try variations like \"Total\" to get a result."
    ],
    "exam_tips": [],
    "raw_markdown": "### \ud83c\udfa4 [02:54:40] Form Recognizer  \n**Timestamp**: 02:54:40 \u2013 02:57:55\n\n**Key Concepts**  \n- Azure Form Recognizer extracts structured data from forms such as receipts.  \n- Uses a different client and authentication method (Azure Key Credential) than other Cognitive Services.  \n- Supports predefined fields for receipts like Merchant Name, Phone Number, Total Price, etc.  \n- Can analyze receipt images and return recognized fields with values.  \n- Some field names may have spaces or formatting inconsistencies (e.g., \"Total Price\").  \n- Results include recognized form fields and their values.\n\n**Definitions**  \n- **Form Recognizer**: Azure AI service that extracts key-value pairs and tables from documents and forms.  \n- **Predefined Fields**: Standardized fields recognized by the service for specific form types (e.g., receipts).\n\n**Key Facts**  \n- Form Recognizer requires Azure Key Credential, not Cognitive Service Credential.  \n- Merchant phone number and name are reliably extracted fields.  \n- Field names may not always match expected keys exactly (e.g., spacing issues).  \n- The service may not always extract all fields perfectly; results can vary.\n\n**Examples**  \n- Extracted Merchant Name as \"Almdraft Out Cinema\" from a receipt image.  \n- Successfully retrieved Merchant Phone Number (e.g., 512707).  \n- Attempted to extract \"Total Price\" but had to try variations like \"Total\" to get a result.\n\n**Exam Tips \ud83c\udfaf**  \n- Remember Form Recognizer uses a different authentication method than other Cognitive Services.  \n- Know the common predefined fields for receipts and their typical usage.  \n- Be prepared to handle inconsistencies in field names when parsing results.  \n- Understand Form Recognizer is specialized for structured document extraction, especially receipts.\n\n---\n\n"
  },
  {
    "section_title": "\ud83c\udfa4 [02:57:55] OCR Computer Vision",
    "chunk_id": 10,
    "timestamp_range": "02:57:55 \u2013 03:02:52",
    "key_concepts": [
      "OCR (Optical Character Recognition) extracts printed or handwritten text from images.",
      "Implemented via Azure Computer Vision service.",
      "Two main OCR approaches: Recognize Printed Text (synchronous) and Read API (asynchronous).",
      "Read API is preferred for larger or more complex text extraction tasks.",
      "OCR accuracy depends heavily on image quality, resolution, and font style.",
      "Handwritten text recognition is possible but less accurate than printed text."
    ],
    "definitions": {
      "OCR": "Technology to convert images of text into machine-readable text.",
      "Read API": "Azure Computer Vision API for asynchronous, large-scale text extraction.",
      "Recognize Printed Text": "Synchronous OCR method for simpler, smaller text extraction."
    },
    "key_facts": [
      "Low-resolution images or stylized fonts (e.g., Star Trek font) reduce OCR accuracy.",
      "Read API processes text line by line asynchronously for better performance on large documents.",
      "Handwritten text recognition can be challenging; results may be approximate.",
      "OCR results include the extracted text and can be visualized alongside the image."
    ],
    "examples": [
      "Extracted partial text from a Star Trek themed image with some errors due to font artifacts.",
      "Successfully extracted more text from a higher resolution image with better accuracy.",
      "Recognized handwritten note from William Shatner with some misinterpretations but generally readable."
    ],
    "exam_tips": [],
    "raw_markdown": "### \ud83c\udfa4 [02:57:55] OCR Computer Vision  \n**Timestamp**: 02:57:55 \u2013 03:02:52\n\n**Key Concepts**  \n- OCR (Optical Character Recognition) extracts printed or handwritten text from images.  \n- Implemented via Azure Computer Vision service.  \n- Two main OCR approaches: Recognize Printed Text (synchronous) and Read API (asynchronous).  \n- Read API is preferred for larger or more complex text extraction tasks.  \n- OCR accuracy depends heavily on image quality, resolution, and font style.  \n- Handwritten text recognition is possible but less accurate than printed text.\n\n**Definitions**  \n- **OCR**: Technology to convert images of text into machine-readable text.  \n- **Read API**: Azure Computer Vision API for asynchronous, large-scale text extraction.  \n- **Recognize Printed Text**: Synchronous OCR method for simpler, smaller text extraction.\n\n**Key Facts**  \n- Low-resolution images or stylized fonts (e.g., Star Trek font) reduce OCR accuracy.  \n- Read API processes text line by line asynchronously for better performance on large documents.  \n- Handwritten text recognition can be challenging; results may be approximate.  \n- OCR results include the extracted text and can be visualized alongside the image.\n\n**Examples**  \n- Extracted partial text from a Star Trek themed image with some errors due to font artifacts.  \n- Successfully extracted more text from a higher resolution image with better accuracy.  \n- Recognized handwritten note from William Shatner with some misinterpretations but generally readable.\n\n**Exam Tips \ud83c\udfaf**  \n- Know the difference between synchronous OCR and asynchronous Read API in Azure Computer Vision.  \n- Understand factors affecting OCR accuracy: image resolution, font style, and text complexity.  \n- Be aware that handwritten text recognition is supported but less reliable.  \n- Remember to use Read API for large documents or when asynchronous processing is needed.\n\n---\n\n"
  },
  {
    "section_title": "\ud83c\udfa4 [03:02:54] Text Analysis",
    "chunk_id": 10,
    "timestamp_range": "03:02:54 \u2013 03:06:22",
    "key_concepts": [
      "Azure Text Analytics service analyzes text for sentiment, key phrases, and other language insights.",
      "Uses Cognitive Services credentials for authentication.",
      "Can process multiple text documents such as movie reviews.",
      "Extracts key phrases to identify important concepts or topics in text.",
      "Performs sentiment analysis to classify text as positive, neutral, or negative.",
      "Sentiment scores range typically from 0 (negative) to 1 (positive)."
    ],
    "definitions": {
      "Text Analytics": "Azure Cognitive Service for natural language processing tasks like sentiment analysis and key phrase extraction.",
      "Sentiment Score": "Numeric value indicating the positivity or negativity of text."
    },
    "key_facts": [
      "Sentiment scores above 0.5 generally indicate positive sentiment; below 0.5 indicates negative.",
      "Key phrases highlight important terms or concepts frequently mentioned in the text.",
      "Blank or empty documents can cause errors or null results in analysis.",
      "Text Analytics can be used to analyze customer reviews or feedback."
    ],
    "examples": [
      "Analyzed Star Trek movie reviews to extract key phrases like \"Borg ship,\" \"Enterprise,\" and \"neutral zone.\"",
      "Sentiment scores ranged from low (negative) to high (positive) reflecting reviewer opinions.",
      "Identified neutral and positive sentiments in different reviews."
    ],
    "exam_tips": [],
    "raw_markdown": "### \ud83c\udfa4 [03:02:54] Text Analysis  \n**Timestamp**: 03:02:54 \u2013 03:06:22\n\n**Key Concepts**  \n- Azure Text Analytics service analyzes text for sentiment, key phrases, and other language insights.  \n- Uses Cognitive Services credentials for authentication.  \n- Can process multiple text documents such as movie reviews.  \n- Extracts key phrases to identify important concepts or topics in text.  \n- Performs sentiment analysis to classify text as positive, neutral, or negative.  \n- Sentiment scores range typically from 0 (negative) to 1 (positive).\n\n**Definitions**  \n- **Text Analytics**: Azure Cognitive Service for natural language processing tasks like sentiment analysis and key phrase extraction.  \n- **Sentiment Score**: Numeric value indicating the positivity or negativity of text.\n\n**Key Facts**  \n- Sentiment scores above 0.5 generally indicate positive sentiment; below 0.5 indicates negative.  \n- Key phrases highlight important terms or concepts frequently mentioned in the text.  \n- Blank or empty documents can cause errors or null results in analysis.  \n- Text Analytics can be used to analyze customer reviews or feedback.\n\n**Examples**  \n- Analyzed Star Trek movie reviews to extract key phrases like \"Borg ship,\" \"Enterprise,\" and \"neutral zone.\"  \n- Sentiment scores ranged from low (negative) to high (positive) reflecting reviewer opinions.  \n- Identified neutral and positive sentiments in different reviews.\n\n**Exam Tips \ud83c\udfaf**  \n- Understand how to interpret sentiment scores and key phrase extraction results.  \n- Be aware that empty or malformed text inputs can cause errors.  \n- Know that Text Analytics is useful for analyzing customer feedback and reviews.  \n- Remember to authenticate using Cognitive Services credentials.\n\n"
  },
  {
    "section_title": "\ud83c\udfa4 [03:06:37] QnA Maker",
    "chunk_id": 11,
    "timestamp_range": "03:06:55 \u2013 03:24:48",
    "key_concepts": [
      "QnA Maker is a cognitive service for building question-and-answer knowledge bases from documents and FAQs.",
      "It is not always accessible directly from the Azure portal; often accessed via its own portal or marketplace.",
      "Requires creation of a QnA Maker service resource in Azure Cognitive Services before use.",
      "Supports free tier for initial experimentation.",
      "Knowledge bases can be created by uploading documents with questions and answers formatted using headings and text.",
      "Supports multi-turn conversations using linked Q&A pairs and prompts for guided interactions.",
      "After creating and training the knowledge base, it can be published for use.",
      "Integration with Azure Bot Service allows deploying the QnA Maker knowledge base as a conversational bot.",
      "Azure Bot Service supports multiple channels (Teams, Slack, Facebook, Web Chat, etc.) for bot deployment.",
      "Bot source code can be downloaded (Node.js example) for customization or integration.",
      "Simple embedding of the QnA Maker bot in applications can be done using iframe HTML code with secret keys."
    ],
    "definitions": {
      "Knowledge Base": "A collection of question-answer pairs that the QnA Maker uses to respond to user queries.",
      "Multi-turn conversation": "A feature allowing the bot to handle follow-up questions by linking related Q&A pairs.",
      "Azure Bot Service": "A platform to deploy and manage bots that can integrate with multiple communication channels."
    },
    "key_facts": [
      "QnA Maker service creation may take up to 10 minutes to provision fully.",
      "Supports various document formats for knowledge base creation.",
      "Free tier available for QnA Maker and Azure Bot Service (F0 plan).",
      "Bot channels include Teams, Slack, Facebook, Web Chat, Telegram, and more.",
      "Bot source code can be downloaded as a zip file for local development."
    ],
    "examples": [
      "Created a knowledge base with questions about Azure certifications (e.g., \"How many Azure certifications are there?\").",
      "Used headings in documents to define questions and text for answers.",
      "Tested QnA Maker with queries like \"How many certifications are there?\" and \"How many Azure certifications are there?\"",
      "Created a bot named \"certification q and a\" linked to the QnA Maker knowledge base.",
      "Tested the bot via the web chat channel with sample questions.",
      "Embedded the bot in a Jupyter notebook using iframe HTML and secret keys for simple interaction."
    ],
    "exam_tips": [],
    "raw_markdown": "### \ud83c\udfa4 [03:06:37] QnA Maker  \n**Timestamp**: 03:06:55 \u2013 03:24:48\n\n**Key Concepts**  \n- QnA Maker is a cognitive service for building question-and-answer knowledge bases from documents and FAQs.  \n- It is not always accessible directly from the Azure portal; often accessed via its own portal or marketplace.  \n- Requires creation of a QnA Maker service resource in Azure Cognitive Services before use.  \n- Supports free tier for initial experimentation.  \n- Knowledge bases can be created by uploading documents with questions and answers formatted using headings and text.  \n- Supports multi-turn conversations using linked Q&A pairs and prompts for guided interactions.  \n- After creating and training the knowledge base, it can be published for use.  \n- Integration with Azure Bot Service allows deploying the QnA Maker knowledge base as a conversational bot.  \n- Azure Bot Service supports multiple channels (Teams, Slack, Facebook, Web Chat, etc.) for bot deployment.  \n- Bot source code can be downloaded (Node.js example) for customization or integration.  \n- Simple embedding of the QnA Maker bot in applications can be done using iframe HTML code with secret keys.  \n\n**Definitions**  \n- **Knowledge Base**: A collection of question-answer pairs that the QnA Maker uses to respond to user queries.  \n- **Multi-turn conversation**: A feature allowing the bot to handle follow-up questions by linking related Q&A pairs.  \n- **Azure Bot Service**: A platform to deploy and manage bots that can integrate with multiple communication channels.  \n\n**Key Facts**  \n- QnA Maker service creation may take up to 10 minutes to provision fully.  \n- Supports various document formats for knowledge base creation.  \n- Free tier available for QnA Maker and Azure Bot Service (F0 plan).  \n- Bot channels include Teams, Slack, Facebook, Web Chat, Telegram, and more.  \n- Bot source code can be downloaded as a zip file for local development.  \n\n**Examples**  \n- Created a knowledge base with questions about Azure certifications (e.g., \"How many Azure certifications are there?\").  \n- Used headings in documents to define questions and text for answers.  \n- Tested QnA Maker with queries like \"How many certifications are there?\" and \"How many Azure certifications are there?\"  \n- Created a bot named \"certification q and a\" linked to the QnA Maker knowledge base.  \n- Tested the bot via the web chat channel with sample questions.  \n- Embedded the bot in a Jupyter notebook using iframe HTML and secret keys for simple interaction.  \n\n**Exam Tips \ud83c\udfaf**  \n- Know the workflow: create QnA Maker service \u2192 build knowledge base \u2192 train \u2192 publish \u2192 integrate with Azure Bot Service.  \n- Understand multi-turn conversation capabilities and how prompts link Q&A pairs.  \n- Be familiar with bot deployment channels supported by Azure Bot Service.  \n- Remember that QnA Maker service provisioning can take several minutes.  \n- Know that QnA Maker can ingest unstructured documents using headings for questions and text for answers.  \n- Recognize that bot source code can be downloaded for customization and integration.  \n\n---\n\n"
  },
  {
    "section_title": "\ud83c\udfa4 [03:25:11] LUIS",
    "chunk_id": 11,
    "timestamp_range": "03:24:48 \u2013 03:30:03",
    "key_concepts": [
      "LUIS (Language Understanding Intelligent Service) is a cognitive service for natural language understanding.",
      "It is accessed via its own portal (luis.ai) and linked to Azure Cognitive Services resources.",
      "Requires creation of an authoring resource in Azure Cognitive Services to manage LUIS apps.",
      "LUIS apps consist of intents (user goals) and entities (parameters or data extracted from utterances).",
      "Supports machine-learned and list entities (predefined lists).",
      "Example intent: \"BookFlight\" with utterances like \"Book me a flight to Toronto.\"",
      "After defining intents and entities, the model is trained and published to a production slot.",
      "Provides endpoint URLs for integration with applications.",
      "LUIS returns top scoring intent and confidence scores for utterances."
    ],
    "definitions": {
      "Intent": "The purpose or goal behind a user's input (e.g., booking a flight).",
      "Entity": "Specific data extracted from the user's input that provides details (e.g., location, date).",
      "Authoring resource": "Azure resource used to create and manage LUIS apps."
    },
    "key_facts": [
      "LUIS apps require training after adding intents and entities before publishing.",
      "Supports multiple regions; sometimes requires creating resources in specific regions for compatibility.",
      "Provides confidence scores indicating how likely an intent matches the user input.",
      "Published models have endpoints for integration with bots or applications."
    ],
    "examples": [
      "Created a \"BookFlight\" intent with example utterance \"Book me a flight to Seattle.\"",
      "Added an entity named \"location\" as a list entity to capture airport names.",
      "Trained and published the LUIS model.",
      "Tested the model and inspected the top scoring intent and confidence."
    ],
    "exam_tips": [],
    "raw_markdown": "### \ud83c\udfa4 [03:25:11] LUIS  \n**Timestamp**: 03:24:48 \u2013 03:30:03\n\n**Key Concepts**  \n- LUIS (Language Understanding Intelligent Service) is a cognitive service for natural language understanding.  \n- It is accessed via its own portal (luis.ai) and linked to Azure Cognitive Services resources.  \n- Requires creation of an authoring resource in Azure Cognitive Services to manage LUIS apps.  \n- LUIS apps consist of intents (user goals) and entities (parameters or data extracted from utterances).  \n- Supports machine-learned and list entities (predefined lists).  \n- Example intent: \"BookFlight\" with utterances like \"Book me a flight to Toronto.\"  \n- After defining intents and entities, the model is trained and published to a production slot.  \n- Provides endpoint URLs for integration with applications.  \n- LUIS returns top scoring intent and confidence scores for utterances.  \n\n**Definitions**  \n- **Intent**: The purpose or goal behind a user's input (e.g., booking a flight).  \n- **Entity**: Specific data extracted from the user's input that provides details (e.g., location, date).  \n- **Authoring resource**: Azure resource used to create and manage LUIS apps.  \n\n**Key Facts**  \n- LUIS apps require training after adding intents and entities before publishing.  \n- Supports multiple regions; sometimes requires creating resources in specific regions for compatibility.  \n- Provides confidence scores indicating how likely an intent matches the user input.  \n- Published models have endpoints for integration with bots or applications.  \n\n**Examples**  \n- Created a \"BookFlight\" intent with example utterance \"Book me a flight to Seattle.\"  \n- Added an entity named \"location\" as a list entity to capture airport names.  \n- Trained and published the LUIS model.  \n- Tested the model and inspected the top scoring intent and confidence.  \n\n**Exam Tips \ud83c\udfaf**  \n- Understand the difference between intents and entities in LUIS.  \n- Know the process: create authoring resource \u2192 build app with intents/entities \u2192 train \u2192 publish \u2192 consume endpoint.  \n- Be aware of region restrictions and resource linking for LUIS.  \n- Recognize that LUIS is used for natural language understanding, often integrated with bots.  \n- Know how to test LUIS models and interpret intent confidence scores.  \n\n---\n\n"
  },
  {
    "section_title": "\ud83c\udfa4 [03:30:56] AutoML",
    "chunk_id": 11,
    "timestamp_range": "03:30:56 \u2013 03:31:03",
    "key_concepts": [
      "Automated ML (AutoML) automates the process of building machine learning pipelines.",
      "It allows users to specify the type of model and prediction task without manual pipeline design.",
      "Azure ML Studio provides open datasets to use with AutoML for training models."
    ],
    "definitions": {
      "AutoML": "Automated machine learning that handles feature engineering, model selection, and training automatically."
    },
    "key_facts": [
      "AutoML simplifies ML model creation by automating pipeline steps.",
      "Azure ML Studio includes open datasets to facilitate AutoML experiments."
    ],
    "examples": [
      "Starting a new AutoML experiment in Azure ML Studio with no dataset initially, but using open datasets available in the platform."
    ],
    "exam_tips": [],
    "raw_markdown": "### \ud83c\udfa4 [03:30:56] AutoML  \n**Timestamp**: 03:30:56 \u2013 03:31:03\n\n**Key Concepts**  \n- Automated ML (AutoML) automates the process of building machine learning pipelines.  \n- It allows users to specify the type of model and prediction task without manual pipeline design.  \n- Azure ML Studio provides open datasets to use with AutoML for training models.  \n\n**Definitions**  \n- **AutoML**: Automated machine learning that handles feature engineering, model selection, and training automatically.  \n\n**Key Facts**  \n- AutoML simplifies ML model creation by automating pipeline steps.  \n- Azure ML Studio includes open datasets to facilitate AutoML experiments.  \n\n**Examples**  \n- Starting a new AutoML experiment in Azure ML Studio with no dataset initially, but using open datasets available in the platform.  \n\n**Exam Tips \ud83c\udfaf**  \n- Know that AutoML is designed to reduce manual effort in building ML models.  \n- Be familiar with Azure ML Studio\u2019s support for AutoML and open datasets.  \n- Understand that AutoML can be used for classification, regression, and other ML tasks."
  },
  {
    "section_title": "\ud83c\udfa4 [03:30:56] AutoML",
    "chunk_id": 12,
    "timestamp_range": "03:31:58 \u2013 03:52:35",
    "key_concepts": [
      "AutoML automates the process of selecting, training, and tuning machine learning models.",
      "Uses datasets like the diabetes dataset (422 samples, 10 features) for training and prediction.",
      "Target column (Y) is the value to predict; features (X) are input variables such as age, sex, BMI, BP, etc.",
      "AutoML can automatically detect the problem type (e.g., regression vs classification) based on the target variable.",
      "Featurization is automatic, including feature selection and data preprocessing.",
      "Training time can be configured (e.g., 3 hours max timeout).",
      "Primary metric for regression tasks often used is normalized root mean square error (RMSE).",
      "AutoML runs multiple algorithms (e.g., 42 models) and selects the best performing one, such as a voting ensemble model.",
      "Ensemble models combine multiple weaker models to improve prediction accuracy.",
      "Data guardrails handle data splitting, missing values, dimensionality reduction, and other preprocessing steps automatically.",
      "Models can be deployed to Azure services such as Azure Container Instances (ACI) or Azure Kubernetes Service (AKS).",
      "Deployment requires compute resources with specific core and memory requirements; quotas may limit deployment options.",
      "Once deployed, models can be tested by passing sample input data to get predictions.",
      "Visual Designer offers a drag-and-drop interface for building ML pipelines with more customization than AutoML.",
      "Visual Designer pipelines include steps like feature selection, data cleaning, data splitting, hyperparameter tuning, model training, scoring, and evaluation.",
      "Compute clusters must be created and selected before running experiments or pipelines."
    ],
    "definitions": {
      "AutoML": "Automated Machine Learning that simplifies building ML models by automating model selection, training, and tuning.",
      "Featurization": "The process of selecting and transforming raw data features into formats suitable for model training.",
      "Voting Ensemble": "A model that combines predictions from multiple models to improve accuracy.",
      "Data Guardrails": "Automated preprocessing steps that handle data quality issues such as missing values and high cardinality.",
      "Azure Container Instance (ACI)": "A lightweight Azure service for deploying containerized applications, including ML models.",
      "Azure Kubernetes Service (AKS)": "A managed Kubernetes service for deploying and managing containerized applications at scale.",
      "Normalized Root Mean Square Error (RMSE)": "A metric to evaluate regression model performance by measuring prediction errors."
    },
    "key_facts": [
      "Diabetes dataset: 422 samples, 10 features.",
      "AutoML ran about 42 different models in this example.",
      "Training timeout default set to 3 hours.",
      "Deployment requires VM SKU with at least 12 cores for AKS.",
      "Deployment to ACI is simpler and requires fewer resources than AKS.",
      "Ensemble models are not covered in detail in the course but are powerful ML techniques."
    ],
    "examples": [
      "Using the diabetes dataset to predict likelihood of diabetes based on features like BMI, age, sex, BP.",
      "Deploying the best AutoML model as an Azure Container Instance and testing it with sample input values (e.g., age 36, BMI 25.3, BP 83).",
      "Visual Designer pipeline example: binary classification with feature selection, data cleaning, data splitting, hyperparameter tuning, training, scoring, and evaluation."
    ],
    "exam_tips": [],
    "raw_markdown": "### \ud83c\udfa4 [03:30:56] AutoML  \n**Timestamp**: 03:31:58 \u2013 03:52:35\n\n**Key Concepts**  \n- AutoML automates the process of selecting, training, and tuning machine learning models.  \n- Uses datasets like the diabetes dataset (422 samples, 10 features) for training and prediction.  \n- Target column (Y) is the value to predict; features (X) are input variables such as age, sex, BMI, BP, etc.  \n- AutoML can automatically detect the problem type (e.g., regression vs classification) based on the target variable.  \n- Featurization is automatic, including feature selection and data preprocessing.  \n- Training time can be configured (e.g., 3 hours max timeout).  \n- Primary metric for regression tasks often used is normalized root mean square error (RMSE).  \n- AutoML runs multiple algorithms (e.g., 42 models) and selects the best performing one, such as a voting ensemble model.  \n- Ensemble models combine multiple weaker models to improve prediction accuracy.  \n- Data guardrails handle data splitting, missing values, dimensionality reduction, and other preprocessing steps automatically.  \n- Models can be deployed to Azure services such as Azure Container Instances (ACI) or Azure Kubernetes Service (AKS).  \n- Deployment requires compute resources with specific core and memory requirements; quotas may limit deployment options.  \n- Once deployed, models can be tested by passing sample input data to get predictions.  \n- Visual Designer offers a drag-and-drop interface for building ML pipelines with more customization than AutoML.  \n- Visual Designer pipelines include steps like feature selection, data cleaning, data splitting, hyperparameter tuning, model training, scoring, and evaluation.  \n- Compute clusters must be created and selected before running experiments or pipelines.  \n\n**Definitions**  \n- **AutoML**: Automated Machine Learning that simplifies building ML models by automating model selection, training, and tuning.  \n- **Featurization**: The process of selecting and transforming raw data features into formats suitable for model training.  \n- **Voting Ensemble**: A model that combines predictions from multiple models to improve accuracy.  \n- **Data Guardrails**: Automated preprocessing steps that handle data quality issues such as missing values and high cardinality.  \n- **Azure Container Instance (ACI)**: A lightweight Azure service for deploying containerized applications, including ML models.  \n- **Azure Kubernetes Service (AKS)**: A managed Kubernetes service for deploying and managing containerized applications at scale.  \n- **Normalized Root Mean Square Error (RMSE)**: A metric to evaluate regression model performance by measuring prediction errors.  \n\n**Key Facts**  \n- Diabetes dataset: 422 samples, 10 features.  \n- AutoML ran about 42 different models in this example.  \n- Training timeout default set to 3 hours.  \n- Deployment requires VM SKU with at least 12 cores for AKS.  \n- Deployment to ACI is simpler and requires fewer resources than AKS.  \n- Ensemble models are not covered in detail in the course but are powerful ML techniques.  \n\n**Examples**  \n- Using the diabetes dataset to predict likelihood of diabetes based on features like BMI, age, sex, BP.  \n- Deploying the best AutoML model as an Azure Container Instance and testing it with sample input values (e.g., age 36, BMI 25.3, BP 83).  \n- Visual Designer pipeline example: binary classification with feature selection, data cleaning, data splitting, hyperparameter tuning, training, scoring, and evaluation.  \n\n**Exam Tips \ud83c\udfaf**  \n- Understand the difference between regression and classification and how AutoML detects the problem type automatically.  \n- Know the primary metrics used for regression tasks (e.g., normalized RMSE).  \n- Be familiar with the concept of ensemble models as a combination of weaker models.  \n- Remember that AutoML includes automatic featurization and data guardrails to handle preprocessing.  \n- Know the deployment options for models: Azure Container Instances (ACI) for simpler deployments and Azure Kubernetes Service (AKS) for scalable production deployments.  \n- Be aware of resource requirements and quotas when deploying models in Azure.  \n- Visual Designer is useful for more customized ML pipelines beyond AutoML.  \n- For the exam, focus on understanding the AutoML workflow rather than deep technical details of each algorithm."
  },
  {
    "section_title": "\ud83c\udfa4 [03:58:31] MNIST",
    "chunk_id": 13,
    "timestamp_range": "03:58:45 \u2013 04:06:38",
    "key_concepts": [
      "MNIST is a popular dataset for computer vision tasks, consisting of 70,000 grayscale images of handwritten digits (0-9), each 28x28 pixels.",
      "The goal is to create a multiclass classifier to identify the digit represented in each image.",
      "The dataset is split into training and testing sets, typically using a random split.",
      "Data is loaded and visualized using libraries like NumPy and Matplotlib.",
      "The dataset files are compressed (e.g., .gz format) and need to be decompressed and registered in the Azure ML workspace for easy access during training."
    ],
    "definitions": {
      "MNIST Dataset": "A large database of handwritten digits commonly used for training various image processing systems.",
      "Data Registration": "The process of registering datasets in Azure ML workspace to enable easy retrieval during model training."
    },
    "key_facts": [
      "Dataset size: 70,000 images.",
      "Image dimensions: 28x28 pixels, grayscale.",
      "Data is stored in compressed files (e.g., .gz).",
      "Dataset is registered in the Azure ML workspace for reuse."
    ],
    "examples": [
      "Loading the MNIST dataset into a data folder, decompressing, and registering it in the workspace.",
      "Displaying 30 random images from the dataset using Matplotlib."
    ],
    "exam_tips": [],
    "raw_markdown": "### \ud83c\udfa4 [03:58:31] MNIST  \n**Timestamp**: 03:58:45 \u2013 04:06:38\n\n**Key Concepts**  \n- MNIST is a popular dataset for computer vision tasks, consisting of 70,000 grayscale images of handwritten digits (0-9), each 28x28 pixels.  \n- The goal is to create a multiclass classifier to identify the digit represented in each image.  \n- The dataset is split into training and testing sets, typically using a random split.  \n- Data is loaded and visualized using libraries like NumPy and Matplotlib.  \n- The dataset files are compressed (e.g., .gz format) and need to be decompressed and registered in the Azure ML workspace for easy access during training.\n\n**Definitions**  \n- **MNIST Dataset**: A large database of handwritten digits commonly used for training various image processing systems.  \n- **Data Registration**: The process of registering datasets in Azure ML workspace to enable easy retrieval during model training.\n\n**Key Facts**  \n- Dataset size: 70,000 images.  \n- Image dimensions: 28x28 pixels, grayscale.  \n- Data is stored in compressed files (e.g., .gz).  \n- Dataset is registered in the Azure ML workspace for reuse.\n\n**Examples**  \n- Loading the MNIST dataset into a data folder, decompressing, and registering it in the workspace.  \n- Displaying 30 random images from the dataset using Matplotlib.\n\n**Exam Tips \ud83c\udfaf**  \n- Understand the structure and purpose of the MNIST dataset.  \n- Know how to register and access datasets in Azure ML workspace.  \n- Be familiar with the typical train/test split and visualization techniques for image data.\n\n---\n\n"
  },
  {
    "section_title": "\ud83c\udfa4 [03:58:31] Data Labeling",
    "chunk_id": 13,
    "timestamp_range": "04:06:07 \u2013 04:06:38",
    "key_concepts": [
      "Data labeling involves preparing the dataset by splitting it into training and testing subsets.",
      "The process includes loading data, setting up labels, and ensuring data is ready for model training.",
      "Random splitting of data helps in unbiased training and evaluation."
    ],
    "definitions": {
      "Data Labeling": "Assigning meaningful tags or labels to data points to enable supervised learning.",
      "Train/Test Split": "Dividing data into subsets for training the model and testing its performance."
    },
    "key_facts": [
      "The dataset is split randomly into training and testing sets.",
      "Labels correspond to the digits represented in the images."
    ],
    "examples": [
      "Using a utility function (e.g., `load_data`) to load and split the MNIST dataset into training and testing sets."
    ],
    "exam_tips": [],
    "raw_markdown": "### \ud83c\udfa4 [03:58:31] Data Labeling  \n**Timestamp**: 04:06:07 \u2013 04:06:38\n\n**Key Concepts**  \n- Data labeling involves preparing the dataset by splitting it into training and testing subsets.  \n- The process includes loading data, setting up labels, and ensuring data is ready for model training.  \n- Random splitting of data helps in unbiased training and evaluation.\n\n**Definitions**  \n- **Data Labeling**: Assigning meaningful tags or labels to data points to enable supervised learning.  \n- **Train/Test Split**: Dividing data into subsets for training the model and testing its performance.\n\n**Key Facts**  \n- The dataset is split randomly into training and testing sets.  \n- Labels correspond to the digits represented in the images.\n\n**Examples**  \n- Using a utility function (e.g., `load_data`) to load and split the MNIST dataset into training and testing sets.\n\n**Exam Tips \ud83c\udfaf**  \n- Know the importance of data labeling and splitting in supervised learning.  \n- Understand how labeled data is used to train and evaluate models.\n\n---\n\n"
  },
  {
    "section_title": "\ud83c\udfa4 [04:07:09] Training and Deployment Workflow via Azure Machine Learning Service in a Notebook",
    "chunk_id": 13,
    "timestamp_range": "04:07:09 \u2013 04:11:46",
    "key_concepts": [
      "Training a machine learning model programmatically using Azure ML SDK in a Jupyter notebook.",
      "The workflow includes creating directories, writing training scripts, configuring the environment, submitting jobs to remote compute clusters, and monitoring runs.",
      "Training scripts typically include loading data, defining the model (e.g., logistic regression), fitting the model, making predictions, and evaluating accuracy.",
      "Models are saved (serialized) after training for later deployment.",
      "Azure ML creates a Docker container image matching the specified Python environment and dependencies, which is stored in Azure Container Registry (ACR).",
      "Remote compute clusters are provisioned to run training jobs; provisioning can take several minutes.",
      "ScriptRunConfig is used to specify the training script, compute target, environment, and parameters.",
      "Subsequent runs are faster if dependencies and images remain unchanged."
    ],
    "definitions": {
      "ScriptRunConfig": "Configuration object specifying the training script, compute target, environment, and arguments for Azure ML job submission.",
      "Azure Container Registry (ACR)": "A private registry for storing and managing container images in Azure.",
      "Docker Image": "A lightweight, standalone, executable package that includes everything needed to run a piece of software.",
      "Compute Target": "The compute resource (e.g., CPU cluster) where the training job runs.",
      "Model Serialization": "Saving the trained model to a file for later use or deployment."
    },
    "key_facts": [
      "Training script uses scikit-learn logistic regression for multiclass classification.",
      "Accuracy is used as the evaluation metric.",
      "Model output is saved as a `.pkl` file (pickle format).",
      "Compute cluster used is a CPU cluster (Standard D2 V2) with 0 to 4 nodes.",
      "Provisioning a compute cluster takes about 5 minutes.",
      "The first run takes longer due to Docker image creation; subsequent runs are faster.",
      "Environment includes Azure ML defaults and scikit-learn dependencies.",
      "Parameters such as regularization (0.5) are passed to the training script."
    ],
    "examples": [
      "Writing a training script that loads MNIST data, trains a logistic regression model, evaluates accuracy, and saves the model.",
      "Submitting the training job to a remote Azure ML compute cluster using ScriptRunConfig.",
      "Monitoring the job status from \"preparing\" to \"running\" to completion."
    ],
    "exam_tips": [],
    "raw_markdown": "### \ud83c\udfa4 [04:07:09] Training and Deployment Workflow via Azure Machine Learning Service in a Notebook  \n**Timestamp**: 04:07:09 \u2013 04:11:46\n\n**Key Concepts**  \n- Training a machine learning model programmatically using Azure ML SDK in a Jupyter notebook.  \n- The workflow includes creating directories, writing training scripts, configuring the environment, submitting jobs to remote compute clusters, and monitoring runs.  \n- Training scripts typically include loading data, defining the model (e.g., logistic regression), fitting the model, making predictions, and evaluating accuracy.  \n- Models are saved (serialized) after training for later deployment.  \n- Azure ML creates a Docker container image matching the specified Python environment and dependencies, which is stored in Azure Container Registry (ACR).  \n- Remote compute clusters are provisioned to run training jobs; provisioning can take several minutes.  \n- ScriptRunConfig is used to specify the training script, compute target, environment, and parameters.  \n- Subsequent runs are faster if dependencies and images remain unchanged.\n\n**Definitions**  \n- **ScriptRunConfig**: Configuration object specifying the training script, compute target, environment, and arguments for Azure ML job submission.  \n- **Azure Container Registry (ACR)**: A private registry for storing and managing container images in Azure.  \n- **Docker Image**: A lightweight, standalone, executable package that includes everything needed to run a piece of software.  \n- **Compute Target**: The compute resource (e.g., CPU cluster) where the training job runs.  \n- **Model Serialization**: Saving the trained model to a file for later use or deployment.\n\n**Key Facts**  \n- Training script uses scikit-learn logistic regression for multiclass classification.  \n- Accuracy is used as the evaluation metric.  \n- Model output is saved as a `.pkl` file (pickle format).  \n- Compute cluster used is a CPU cluster (Standard D2 V2) with 0 to 4 nodes.  \n- Provisioning a compute cluster takes about 5 minutes.  \n- The first run takes longer due to Docker image creation; subsequent runs are faster.  \n- Environment includes Azure ML defaults and scikit-learn dependencies.  \n- Parameters such as regularization (0.5) are passed to the training script.\n\n**Examples**  \n- Writing a training script that loads MNIST data, trains a logistic regression model, evaluates accuracy, and saves the model.  \n- Submitting the training job to a remote Azure ML compute cluster using ScriptRunConfig.  \n- Monitoring the job status from \"preparing\" to \"running\" to completion.\n\n**Exam Tips \ud83c\udfaf**  \n- Understand the end-to-end training workflow in Azure ML using notebooks.  \n- Know how to configure and submit training jobs programmatically.  \n- Be familiar with the role of Docker images and container registries in Azure ML.  \n- Remember that the first run involves image creation and takes longer.  \n- Know how to save and manage trained models for deployment."
  },
  {
    "section_title": "\ud83c\udfa4 [04:18:10] Data Labeling",
    "chunk_id": 14,
    "timestamp_range": "04:18:12 \u2013 04:22:38",
    "key_concepts": [
      "Data labeling projects can be created in Azure ML Studio to classify images or text.",
      "Multiple labeling types supported: multiclass, multilabel, bounding box, segmentation.",
      "Data sets can be uploaded from local files or referenced from public/private data stores.",
      "Labels are defined by the user (e.g., Star Trek series names like TNG, DS9, Voyager, TOS).",
      "Labeling interface allows submitting labels per data point with options like contrast adjustment and image rotation.",
      "Progress of labeling is tracked (e.g., 0 out of 17 completed).",
      "Labeled data sets can be exported in formats like CSV or COCO, and re-imported into Azure ML datasets for further use.",
      "Access control allows collaborators to join and label data within the project."
    ],
    "definitions": {
      "Data Labeling": "The process of annotating data points (images, text, etc.) with labels to create a labeled dataset for supervised learning.",
      "Multiclass Classification": "Assigning one label from multiple possible classes to each data point.",
      "Bounding Box": "Labeling method where rectangular boxes are drawn around objects in images.",
      "Segmentation": "Labeling method that assigns a label to each pixel in an image."
    },
    "key_facts": [
      "Uploading a folder of images is supported for labeling projects.",
      "Labeling progress is shown as a count of labeled items vs total.",
      "Export formats include CSV and COCO, compatible with Azure ML datasets.",
      "Labeling projects can be created without enabling auto-labeling assistants."
    ],
    "examples": [
      "Created a labeling project named \"my labeling project\" with multiclass classification.",
      "Uploaded 17 images from a folder named \"objects\".",
      "Defined labels such as TNG, DS9, Voyager, TOS for Star Trek series classification.",
      "Labeled images by selecting the correct series and submitting each label.",
      "Exported the labeled dataset for reuse."
    ],
    "exam_tips": [],
    "raw_markdown": "### \ud83c\udfa4 [04:18:10] Data Labeling  \n**Timestamp**: 04:18:12 \u2013 04:22:38\n\n**Key Concepts**  \n- Data labeling projects can be created in Azure ML Studio to classify images or text.  \n- Multiple labeling types supported: multiclass, multilabel, bounding box, segmentation.  \n- Data sets can be uploaded from local files or referenced from public/private data stores.  \n- Labels are defined by the user (e.g., Star Trek series names like TNG, DS9, Voyager, TOS).  \n- Labeling interface allows submitting labels per data point with options like contrast adjustment and image rotation.  \n- Progress of labeling is tracked (e.g., 0 out of 17 completed).  \n- Labeled data sets can be exported in formats like CSV or COCO, and re-imported into Azure ML datasets for further use.  \n- Access control allows collaborators to join and label data within the project.\n\n**Definitions**  \n- **Data Labeling**: The process of annotating data points (images, text, etc.) with labels to create a labeled dataset for supervised learning.  \n- **Multiclass Classification**: Assigning one label from multiple possible classes to each data point.  \n- **Bounding Box**: Labeling method where rectangular boxes are drawn around objects in images.  \n- **Segmentation**: Labeling method that assigns a label to each pixel in an image.\n\n**Key Facts**  \n- Uploading a folder of images is supported for labeling projects.  \n- Labeling progress is shown as a count of labeled items vs total.  \n- Export formats include CSV and COCO, compatible with Azure ML datasets.  \n- Labeling projects can be created without enabling auto-labeling assistants.\n\n**Examples**  \n- Created a labeling project named \"my labeling project\" with multiclass classification.  \n- Uploaded 17 images from a folder named \"objects\".  \n- Defined labels such as TNG, DS9, Voyager, TOS for Star Trek series classification.  \n- Labeled images by selecting the correct series and submitting each label.  \n- Exported the labeled dataset for reuse.\n\n**Exam Tips \ud83c\udfaf**  \n- Understand how to create and manage data labeling projects in Azure ML Studio.  \n- Know the types of labeling supported and when to use each (multiclass, multilabel, bounding box, segmentation).  \n- Be familiar with importing data, labeling workflow, and exporting labeled datasets.  \n- Recognize the importance of labeled data for supervised ML model training.\n\n---\n\n"
  },
  {
    "section_title": "\ud83c\udfa4 [04:22:38] Clean up",
    "chunk_id": 14,
    "timestamp_range": "04:22:38 \u2013 04:23:47",
    "key_concepts": [
      "After completing ML experiments, it is important to clean up resources to avoid unnecessary costs.",
      "Azure ML compute resources can be manually stopped or deleted.",
      "Deleting the resource group removes all associated resources including compute, storage, and container registries.",
      "It is recommended to verify no running resources remain by checking \"All Resources\" in the Azure portal.",
      "Manual cleanup is a good practice even if resource group deletion is planned."
    ],
    "definitions": {
      "Resource Group": "A container in Azure that holds related resources for an application or project.",
      "Compute Resource": "Virtual machines or clusters used to run ML experiments and training jobs."
    },
    "key_facts": [
      "Scaling and image creation processes can take around 5 minutes each.",
      "Container registries are included in resource group deletions.",
      "Manual deletion steps: stop compute, delete resource group, verify no leftover resources."
    ],
    "examples": [
      "Deleted compute instances manually before deleting the resource group.",
      "Deleted the entire resource group containing all Azure ML resources to ensure full cleanup."
    ],
    "exam_tips": [],
    "raw_markdown": "### \ud83c\udfa4 [04:22:38] Clean up  \n**Timestamp**: 04:22:38 \u2013 04:23:47\n\n**Key Concepts**  \n- After completing ML experiments, it is important to clean up resources to avoid unnecessary costs.  \n- Azure ML compute resources can be manually stopped or deleted.  \n- Deleting the resource group removes all associated resources including compute, storage, and container registries.  \n- It is recommended to verify no running resources remain by checking \"All Resources\" in the Azure portal.  \n- Manual cleanup is a good practice even if resource group deletion is planned.\n\n**Definitions**  \n- **Resource Group**: A container in Azure that holds related resources for an application or project.  \n- **Compute Resource**: Virtual machines or clusters used to run ML experiments and training jobs.\n\n**Key Facts**  \n- Scaling and image creation processes can take around 5 minutes each.  \n- Container registries are included in resource group deletions.  \n- Manual deletion steps: stop compute, delete resource group, verify no leftover resources.\n\n**Examples**  \n- Deleted compute instances manually before deleting the resource group.  \n- Deleted the entire resource group containing all Azure ML resources to ensure full cleanup.\n\n**Exam Tips \ud83c\udfaf**  \n- Always clean up Azure resources after ML experiments to avoid unexpected charges.  \n- Know how to delete compute resources and resource groups in Azure portal.  \n- Verify no active resources remain by checking the \"All Resources\" view."
  }
]